PageNo,Text
1,"['N° 10011.', 'B ESKRIFN I N G', 'OFFENTLICGJORD AF', 'KUNGL. PATENT- OCH REGISTRERINGSVERKET.', 'H. L. HARTENSTEIN, OCH G. A. WEBER,', 'BELLAIRE, BELMONT, Cry OHIO,', 'CHICAGO, ILLINOIS', '(NORDAMERIKAS FORENTA STATER).', 'Sätt och apparat för att tillgodogöra masugnsslagg, äfvensom pá detta sätt framstäld', 'produkt.', 'Patent i Sverige frán den 4 januari 1898.', 'För den slagg, som erhâlles vid reduktion', 'som densamma intager. A betecknar en kon-', 'af jernmalm i blästerugnar (masugnar), finnes', 'verter, som helst har den à ritningen angifna', 'sã föga användning, att den, praktiskt taget,', 'formen, nemligen plana sidoväggar r och en', 'kan betraktas sãsom en affallsprodukt, hvars', 'bakvägg r1, som är sammansatt af tvenne delar,', 'tillgodogörande är ett problem, hvilkets lös-', 'förenade med hvarandra medelst en afrundad', 'ning blir mer och mer af vigt. Denna upp-', 'vägg r2. Väggarne , äro förbundna med hvar-', 'finning omfattar ett sätt att behandla denna', 'andra medelst trenne väggar r3, rt och rs, som', 'affallsprodukt, sã att den kommer att bilda', 'luta mot hvarandra. Mellan väggen rs och den', 'en värdefull handelsvara, som är användbar', 'ena af väggdelarne r1 finnes en afloppsöppning', 'för âtskilliga kemiska eller andra processer,', 'q. Konvertens väggar kunna bestã af metall,', 'och som pa grund af sin kemiska samman-', 'invändigt beklädd med ett eldfast ämne (lämp-', 'sättning särskildt lämpar sig för framställ-', 'ligen eldfast lera), som isolerar bâde värme och', 'ning af gas pa ungefär samma sätt som ace-', 'elektricitet. För erhällande af tillträde till det', 'tyléngas framställes genom att bringa kal-', 'inre af konvertern A, t. ex. i och för repare-', 'ciumkarbid i beröring med vatten. För detta', 'ring af den invändiga beklädnaden, förnyande', 'ändamál blandar man slaggen, som kan vara', 'af de längre fram närmare angifna kolskif-', 'antingen i fast, uppdeladt tillstând, d. v. S. i', 'vorna och dylikt, äro väggarne r3 och pt af-', 'form af smá stycken, korn eller pulver, eller', 'tagbara samt förenade med hvarandra och med', 'i smält tillstànd, med en lämplig mängd af', 'närliggande väggar medelst skrufvar och bultar', 'ett kolhaltigt ämne och underkastar bland-', 'eller andra anordningar, som tillâta, att väg-', 'ningen, som kan beredas pa hvilket lämpligt', 'garne 73 och z-4 kunna lätt och snabbt bort-', 'sätt som helst, inverkan af en elektrisk ström,', 'tagas. Det inre af konvertern bildar trenne', 'af hvars strömkrets blandningen utgör del.', 'rum p,p¹ och 2p2, af hvilka det första p mot-', 'Detta är de allmänna dragen af förfarandet.', 'tager slaggen, da den kommer frân masugnen.', 'I praktiken förekomma specialfall, som när-', 'I det andra rummet p¹ astadkommes bland-', 'mare angifvas längre fram.', 'ningen, under det att behandlingen med elek-', 'A bifogade ritning visas sãsom exempel', 'tricitet sker i det tredje rummet p2. I sist-', 'en för utförande af ifragavarande sätt lämp-', 'nämda rum pp finnas tvenne elektroder o och', 'lig apparat. Fig. 1 visar en vertikal tvär-', '01, som helst bestà af kolskifvor och som äro', 'sektion och fig. 2 en vertikal längdsektion af', 'insatta i spar (ej visade) i den invändiga be-', 'apparaten, som i fig. 3 visas sedd underifrân.', 'klädnaden, genom hvilken ga tvenne ledningar', 'Fig. 4 visar en tvärsektion af en anordning', 'som förena elektroderna p och 01 med po-', 'för inmatning i apparaten af ett kolhaltigt', 'lerna till en elektrisk generator D (t. ex. en', 'ämne. Fig. 5, 5, 5b och 5c, som visa sektioner', 'dynamo-elektrisk maskin). Konvertern A upp-', 'af apparaten, angifva de olika ställningar,', 'bäres af ihâliga tappar n och n1, hvilka utga']"
2,"['ning, som visas i fig. 5, och tillbaka igen.', 'bragta i lager pâ öfre ändarne af standare m.', 'Pà detta sätt bringas den smälta metallen att', ""Tapparne n och n' äro vid sina yttre ändar"", 'flyta in i blandningskammaren p¹ och blir', 'försedda med kuggbjul l och 71 (fig. 1), som', 'fullständigt impregnerad med en otalig mängd', 'samverka med en vanlig, för vridning af kon-', 'kokspartiklar. Genom spektroskopisk observa-', 'vertern lämplig mekanism (ej visad à ritnin-', 'tion af konverterlagans kollinier kan man be-', ""garne). Bottnen till blandningsrummet p' ge-"", 'stämma, dá inblandningen har fortskridit till-', 'nomgas af matningsrör h af ett eldfast ämne,', 'räckligt langt. Det bör framhâllas, att bläster-', 't. ex eldfast lera. Hvart och ett af dessa rör', 'luften användes blott i fall gastillförseln är', 'innehäller tvá diafragmor h1, som äro gjorda', 'ofullständig, i hvilken händelse luften kan an-', 'af samma ämne som röret och hvilka nã nästan', 'vändas i förening med den pulveriserade kok-', 'ända ned till rörets nedre ände. Dessa dia-', 'sen för att astadkomma förbränning af den', 'fragmor hafva till ändamâl att dela rören i', 'senare i och för att bibehalla slaggen i smält', 'ett antal kanaler i och för en bättre fördel-', 'tillstand eller för att ersätta förloradt värme.', 'ning af det ämne, som blâses genom dem, sã-', 'Den gas, som användes, kan vara sâdan, som', 'som beskrifves längre fram. Dessa rör bilda', 'utvecklas af de i konvertern behandlade äm-', 'saledes formor. B och C äro rör, af hvilka', 'nena, och bör för att kunna förbrukas maga-', 'det ena leder frân en källa för reducerande', 'sineras i en lämplig behällare. Sedan inbland-', 'gas under tryck och det andra frân samma', 'ningen af det kolhaltiga materialet i slaggen', 'källa eller frân en blâsmaskin. Dessa rör gà', '(i ett förhällande af omkring en del kol pa', 'genom de ihâliga tapparne n och n¹, i hvilka', 'tre delar slagg) afslutats, pasläppes den elek-', 'de äro afbrutna (se fig. 1), sã att deras när-', 'triska strömmen; tryckgasen afstänges, och', 'mast konvertern belägna delar kunna vrida', 'konvertern svänges till det i fig. 5b angifna', 'sig med konvertern. Sistnämda delar äro me-', 'läget, hvarvid blandningen rinner in i rum-', 'delst rör i förbundna med formorna. Ett af-', 'met P2.', 'tagbart omhölje F är anbragt invid väggen 7-3', 'Masugnsslagg är en dälig ledare för elek-', 'för att skydda rören och formorna. Den hori-', 'tricitet, enär den (enligt hvad prof, tagna vid', 'sontala, stillastãende delen af hvartdera af', 'tillverkning af bessemerjern, visa) i medeltal', 'rören B och C är försedd med en längsträckt', 'bestar af 50 till 55 % kalk, 25 till 28 % kisel-', 'öppning g (se fig. 4), som omslutes af en ma-', 'syra, 16 till 18 % lerjord och en ringa mängd', 'tartratt H, anbragt pã röret och innehâllande', 'andra ämnen, som variera allt efter beskaffen-', 'en roterande, refflad cylinder H¹, som är lagrad', 'heten af den i masugnen behandlade malmen', 'nedtill i matartratten samt sträcker sig längs', 'och den sãsom flussmedel använda kalkstenen.', 'med och täcker motsvarande öppning g. Pa', 'Genom att blanda slaggen med det kolhaltiga', 'sin yttre ände uppbär denna cylinders axel f¹', 'ämnet, som är en god ledare für elektricitet,', 'en linskifva f, medelst hvilken den refflade', 'blir blandningen ledande, men den besitter', 'cylindern kringvrides, sã att den genom öpp-', 'fortfarande pa de ställen, som ligga mellan', 'ningen i motsvarande rör inmatar det kolhal-', 'närbelägna kokspartiklar, slaggens egenskap', 'tiga ämne (koks) E, som finnes i matartratten.', 'af ett däligt ledande ämne, hvarför, da ström-', 'Cylindrarne H¹ tillsluta öppningarne g sã tätt,', 'men pasläppes, i blandningen uppstar en otalig', 'att nâgon gas ej kan bortga genom de senare.', 'mängd elektriska bagar, hvilka âstadkomma', 'För apparatens försättande i verksamhet', 'den stora värmeintensitet, som erfordras för', 'upphettas konvertern pa förhand, derigenom', 'att omsätta blandningen till ifragavarande', 'att gas insläppes i densamma och antändes,', 'nya eller förbättrade produkt. Denna produkt,', 't. ex. medelst nagra brinnande trästycken eller', 'reducerad slagg, utgör en blandning af kal-', 'spanor, som inkastas i rummet. Da konvertern', 'cium-, aluminium- och kiselkarbid. Omvand-', 'blifvit tillräckligt upphettad, afstänges gasen,', 'lingsmedlet (ett kolhaltigt ämne) utgör saledes', 'och konvertern bringas till det i fig. 5 an-', 'äfven medlet för att genom den blandning,', 'gifna läget, i hvilket smält slagg intappas i', 'som skall omvandlas, leda den ström, som', 'densamma genom öppningen q. Slaggen tappas', 'astadkommer den för omvandlingen erforder-', 'antingen direkt fran masugnen eller, om sã', 'liga värmeintensiteten. Koksen desoxiderar', 'befinnes mera lämpligt, frän en gjutskänk,', 'och karburerar slaggen, som är fullständigt', 'som kan manövreras med tillhjelp af en sadan', 'karburerad efter ungefär tjugo minuter, da', 'hydraulisk lyftkran, som vanligen brukas vid', 'strömmen afbrytes och konvertern svänges till', 'jernverk. Den smälta slaggen kommer häri-', 'den i fig. 5c angifna ställningen för aftapp-', 'genom till rummet p. Derefter pâsläppes ga-', 'ning af den smälta produkten, som man genom', 'sen sã smaningom och koksmatningsmekanis-', 'gjutning kan bringa till stycken af önskad', 'men sättes i gang och fär gâ, under det att', 'form och storlek. Konvertern kan derpa anyo', 'gasen inströmmar med fullt tryck, hvilket far', 'användas pá det beskrifna sättet; den svänges', 'fortga, ända tills att en tillräcklig mängd', 'da till sitt i fig. 5 visade begynnelseläge för', 'koks (t. ex. en del koks pa tre delar slagg)', 'mottagande af en ny laddning smält slagg.', 'inmatats. Inmatningsprocessen varar blott om-', 'En bland följderna af denna uppfinning är,', 'kring fem minuter, under hvilken tid kon-', 'att jern och stàl kunna tillverkas för mycket', 'vertern lângsamt vrides pa sina tappar fran', 'mindre kostnader än hittills, enär slaggen i', 'den i fig. 5 visade ställningen till den ställ-', 'stället för att läggas i högar sãsom en värde-']"
3,"['nom att behandla masugnsslagg pã nágot af', 'full biprodukt. Ehuru i det föregaende be-', 'de sätt, som angifvas i patentanspräken 1:0),', 'skrifvits en särskild apparat för utförande af', '2:0) och 3:0).', 'ifrâgavarande förfarande, är detta dock ej', '5:0) Apparat för utförande af de i patent-', 'bundet vid nämda apparat, emedan inbland-', 'anspraken 1:0)-3:0) angifna sätten, bestaende', 'ningen af det kolhaltiga ämnet kan ske genom', 'af en konverter (A), som innehâller trenne med', 'att drifva detsamma in i den smälta slaggen,', 'hvarandra kommunicerande rum (p,p och p2),', 'da denna rinner fran masugnen till en lik-', 'det ena (p) beläget invid konverterns in- resp.', 'nande behâllare, i hvilken blandningen be-', 'afloppsöppning (q) och tjenande till att mottaga', 'handlas med elektricitet. Sistnämda behand-', 'slaggen, den andra (p2) genom formor (h) kom-', 'ling kan äfven ske, medan blandningen rinner.', 'municerande med en källa för en reducerande', 'Slaggen kan äfven behandlas, sedan den stelnat', 'gas resp. för tryckluft och användt för den', 'genom afsvalning, i det att den smältes före', 'smälta slaggens impregnering med ett finför-', 'behandlingen.', 'deladt, kolhaltigt ämne, och det tredje (p²)', 'beläget mellan elektroder (0,01), sá att en', 'Patentansprak:', 'elektrisk ström kan ledas genom den smälta', 'och med ett kolhaltigt ämne impregnerade', '1:0) Sättet att tillgodogöra masugnsslagg,', 'slaggen.', 'bestande i att blanda slaggen, som är antingen', '6:0) Vid sádana apparater, som angifvas i', 'i fast och uppdeladt tillstand eller i smält', 'patentanspräket 5:0), den anordningen, att for-', 'tillstand, med en lämplig mängd af ett kol-', 'morna (h) äro uppdelade i sin längdrigtning', 'haltigt ämne, som är fint fordeladt, och utsätta', 'medelst väggar eller diafragmor (li¹), i ända-', 'blandningen för inverkan af elektrisk ström', 'mâl att astadkomma en bättre fördelning af', 'genom att införa densamma i strömkretsen.', 'det ämne, som genom formorna indrifves i den', '2:0) Vid det i patentanspräket 1:0) angifna', 'i rummet (p¹) befintliga smälta slaggen.', 'sättet förfarandet, da slaggen är i smält till-', '7:0) Vid sadana apparater, som angifvas i', 'stand, att före densammas införande i ström-', 'patentanspräket 5:0), den anordningen, att tätt', 'kretsen i densamma indrifva en reducerande', 'invid de rör (B,C), som förena rummet (p¹)', 'gas.', 'med en källa för reducerande gas resp. för', '3:0) Vid det i patentanspräket 1:0) angifna', 'tryckluft, äro anbragta behâllare (E) för det', 'sättet förfarandet, dá slaggen är i smält till-', 'finfördelade, kolhaltiga ämnet, varande i hvarje', 'stand, att i densamma indrifva det finfürdelade,', 'behállare förlagd en roterande, refflad cylinder', 'kolhaltiga ämnet med tillhjelp antingen af den', '(H¹), som tillsluter en öppning (g), anordnad', 'i patentanspräket 2:0) omnämda gasen eller af', 'i väggen mellan behallaren och röret, i ända-', 'en ström af tryckluft eller af gasen och tryck-', 'mál att det kolhaltiga ämnet má vid cylinderns', 'luften pa samma gâng.', 'rotation inmatas i röret och af den reduce-', '4:0) Det ämne (en blandning af kalcinm-,', 'rande gasen eller tryckluften indrifvas i den', 'aluminium- och kiselkarbid), som erhâlles ge-', 'smälta slaggen.', '(Härtill en ritning.)', 'Stockholm 1899. Kungl. Boktryckeriet.', 'Offentliggjord den 29 juli 1899.']"
4,"[""I'i.'."", 'c2', 'q', 'I', 'e', 'A', 'H', 'ri', 'n', 'tof', 'f', ""f'"", 'H', 'H', ""0'"", '0', 'B', 'C', 'It', '1.', 'H', 'B', 'I', 'm', 'me', 'q', 'Fig.2.', ""I'i.'."", 'to', 'ri', 'r2', 're', 'C4', 'is', '2', ""c'"", 'Hi', 'I', 'h', 're', 'w', '24', 'h', '23', 'h', 'I', ""x'"", 'D', 'w', 'A', 'Iight', 'q/', 'H', 'High', 'Generalstabens Litografiska Anstalt.']"
5,"['to', 'F', '72', 't*', 'C5', 'H', 'A', 'q', 'n', 'H', ""f'"", ""II'"", 'to', 'T', 'B', '3-0', 'Fig 5a', 'c', 'Tig.', '50', 'q', 'F', '23', '7', 'TO', 't', 'is', 'n', 'r', 'ji', 'ei', '2', 'R', 'c4', 'A', ""T'4"", '23', 'I', 'cs', 'Fig. 5b', 't 2', 'Fre', 'H', ""x'"", 'A', 'n', 'q/', 'fi', 'I', 'c5 pr', 'c33', 'q4', 'Generalstabens Litografiska, Anstalt.']"
