PageNo,Text
9,"['304797', 'filmer med de enskilda komponenterna, vilket visar, att man uppnar en synergistisk', 'verkan. För belysande av detta uppträdande strökos lösningar eller syspensioner', 'av följande ekvimolära koordinationsföreningar i toluen pa glasskivor:', 'Guldisobutylmerkaptid-silverisooktyltioglykolat', '5', 'Guldisobutylmerkaptid-silvernaftenat', 'Guld-sek.-butylmerkaptid-silver-2-fenyletylmerkaptid', 'Guld-sek.-butylmerkaptid-silverisooktyltioglykolat', 'Guld-sek.-butylmerkaptid-silvernaftenat', 'Guld-tert.-butylmerkaptid-silverisooktyltioglykolat', '10', 'Guldisoamylmerkaptid-silvernaftenat', 'Guld-0-metylbensylmerkaptid-silverisopropylmerkaptid', 'Gula--metylbensylmerkaptid-silver-n-butyl-merkaptid', 'Guld-0X-metylbensylmerkaptid-silver-sek.-butylmerkaptid', 'Guld--metylbensylmerkaptid-silver-n-dodecylmerkaptid', '15', 'Guld--metylbensylmerkaptid-silveretyltioglykolat', 'Guld-0t-metylbensylmerkaptid-silverisooktyltioglykolat', 'Glasskivorna brändes sedan 1 h vid 150°C i en ugn med mekanisk konvektion.', 'I samtliga fall erhöllos filmer av metalliskt guld, vilka voro goda elektriska', 'ledare. Dû de enskilda komponenterna, dvs. guldisobutylmerkaptid, guld-sek.-buty1-', '20', 'merkaptid, guld-tert.-butylmerkaptid, guldisoamylmerkaptid, guld-O-metylbensyl-', 'merkaptid, silverisopropylmerkaptid, silver-n-butylmerkaptid, silver-sek.-butyl-', 'merkaptid, silver-n-dodecylmerkaptid, silver-2-fenyletylmerkaptid, silveretyltio-', 'glykolat, silverisooktyltioglykolat och silvernaftenat, strökos var för sig pa', 'glasskivorna och brändes pa exakt samma sätt och vid samma temperatur, blevo icke', '25', 'núgral av de bildade filmerna metalliska eller ledande, varför sãdana filmer mâste', 'brännas vid mycket högre temperatur än 150°C för erhällande av metalliska eller', 'ledande filmer.', 'Förgyllningsmedlen enligt föreliggande uppfinning bildar en metallfilm, da', 'de avsättes pa olika underlag och värmes. Även om den bildade metallfilmens deko-', '30', 'rativa verkan äir den viktigaste fördelen, uppvisar dessa filmer i och för sig', 'andra värdefulla egenskaper, susom hög ljusreflektion, sã att de kunna användas', 'i reflektorer och speglar, och förmâga att reflektera infraröda stralar, varför', 'de kunna användas som reflektorer for lampor, ugnar och liknande och för att', 'skydda material, som utsättes för höga temperaturer, elektrisk ledningsförmäga,', '35', 'sã att de kunna användas vid framställning av tryckta kretsar, resistorer och', 'kondensatorer och som underlag för lödfogar med oledande material, för galvani-', 'sering och för doppbeläggning i smälta metaller och legeringar, och mekanisk hâll-', 'fasthet, sã att de lämpar sig för bildning av vakuumtäta fogar mellan glas och me-', 'tall, och liknande. Med förgyllning och förgyllningsmedel avses sálunda i detta', '40', 'sammanhang även utnyttjande av andra av de bildade metallfilmernas värdefulla', 'egenskaper.']"
10,"['- 10 -', 'Valet av bärare bestämmer medlets uppträdande före bränningen och paverkas', 'av det sätt, pa vilket medlet skall paföras. Förutom av enkla lösningsmedel kan', 'bäraren bestà av blandningar av eteriska oljor, terpener, harts och liknande, vil-', 'ka har valts omsorgsfullt för att förläna medlet vissa fysikaliska egenskaper. Des-', '5', 'sa egenskaper, sãsom oljighet, viskositet, förangningshastighet, ytspänning och', 'klibbighet varierar med olika päföringsmetoder, sãsom penselstrykning, sprutning,', 'stöppling, stämpling, tryckning, bâde direkt och offset, varmt eller kallt raster-', 'tryck, stenciltryck, dekalkomani och liknande. Typiska bärare bestar av blandningar', 'av tva eller flera av följande komponenter: metyletylketon, cyklohexanon, etylace-', '10', 'tat, amylacetat, olika glykoletrar (""Cellosolve""), butanol, nitrobensen, toluen,', 'xylen, petroleumeter, kloroform, koltetraklorid, olika terpener, sãsom pinen, di-', 'penten, dipentenoxid, terpineol och liknande, eteriska oljor, sûsom lavendelolja,', 'rosmarinolia, anisolja, sassafrasolja, vintergrönolja, fenkolsolja och terpentin,', 'assyrisk asfalt, olika typer av kolofonium och hartser, balsam och konsthartser.', '15', 'Förgyllningsmedel avsedda för bränning vid temperaturer av ca 90 - 250°C pa', 'icke eldfast underlag, sásom papper, trä, läder, textil, plaster av den termoplas-', 'tiska typen och liknande, erfordras icke nágot flussmedel utan är olämpligt, eme-', 'dan det icke pa nágot sätt medverkar till den brända filmens sammanhang och vid-', 'häftning och har en benägenhet att höja den för bränningen erforderliga tempera-', '20', 'turen och att försämra den brända filmens utseende. Flussfria förgyllningsmedel', 'föredras därför särskilt för bränning vid temperaturer av 250°C och därunder. God', 'vidhäftning kan vid behov uppnas med sãdana lättbrända förgyllningsmedel genom in-', 'förlivning av en lack i förgyllningsmedlet eller beläggning av den brända filmen', 'med en lack eller fernissa eller med ett ytskikt av plast laminerat pa ytan.', '25', 'Förgyllningsmedel avsedda för bränning vid 300°C och däröver pa eldfast un-', 'derlag, sûsom glas, keramik, rostfritt stal, glimmer och kvarts, försättes lämpli-', 'gen med ett flussmedel. Valet av flussmedlets komponenter bestämmer filmens upp-', 'trädande under och efter bränningen och pâverkas vanligen av arten av det under-', 'lag, som skall förgyllas, och det avsedda andamálet med underlaget. Om en blank', '30', 'film önskas, kan flussmedlet bestà av smá mängder salter eller resinater av ro-', 'dium eller iridium för förbättring av den vid bränning av förgyllningsmedlet bil-', 'dade metallfilmens kontinuitet och glans. Om en film med. maximal vidhäftning och', 'slitstyrka önskas, kan andra komponenter, sãsom salter och resinater av vismut,', 'krom, bly, kadmium, tenn, koppar, kobolt, antimon och uran, användas- som fluss-', '35', 'medel. De sistnämnda komponenterna smälter `vanligen till ett lättsmält glas eller', 'en glasyr under bränningen och kan användas med eller utan rodium- eller iridium-', 'föreningar alltefter som man önskar en matt eller blank film. Det har tidigare', 'framhallits, att koordinationsföreningarna enligt föreliggande uppfinning lämpli-', 'gen kan framställas i en eller flera av de bärare, som skall användas i förgyll-', '40', 'ningsmedlet. Om man emellertid skall framställa ett flusshaltigt medel, máste', 'guld-silver-koordinationsföreningen : framställas före tillsättningen av flussen,']"
11,"['304797', 'emedan denna stör bildningen av guld-silver-koordinationsföreningen', 'tuld-silver-koordinationsföreningarna enligt föreliggande uppfinning kan', 'även användas 1 förgyllningsmedel innehâllande andra ädelmetaller, sãsom platina', 'eller palladium. Sulforesinater eller andra lösliga föreningar av platina eller', '5', 'palladium liksom pulver av dessa bägge metaller kan införlivas 1 förgyllningsmedel', 'innehallande guld-silver-koordinationsföreningarna enligt föreliggande uppfinning', 'för att den metallfilm, som bildas vid bränning, skall uppvisa speciella färgto-', 'ner eller elektriska egenskaper.', 'Halten guld-silver-koordinationsförening i förgyllningsmedlet kan variera', '10', 'inom vida gränser alltefter päföringsmetoden och det önskade resultatet. Ett me-', 'del, som skall sprutas pa underlaget för erhallande av en oledande, blank färg vid', 'bränning, kan innehâlla sã litet som 0,1 of guld och ekvimolär mängd silver. Ett me-', 'del, som skall paföras genom rastertryck eller maskinrandning för erhällande av en', 'högledande guldfilm, kan innehalla 16 of guld eller mera och ekvimolär mängd silver.', '15', 'In fördel med guld-silver-koordinationsföreningarna enligt föreliggande uppfinning', 'är, att de bilda opaka filmer, som har stark guldglans vid en guldhalt, som ligger', 'lüngt under den, som erfordras i förgyllningsmedel, som innehäller enbart guld', 'eller blandningar av tidigare känd typ.', 'Den tillämpade bränningstemperaturen beror pa arten av den produkt eller det', '20', 'underlas, som skall förgyllas och den önskade typen film. Vid behandling av under-', 'lag med relativt lâg värmebeständighe: halles ränningstemperaturen sã lâg som möj-', 'ligt för uppnéende av en metallfilm och lämpligen vid ca 90 - 250°C Vid förgyll-', 'ning av papper ligger temperaturen för bränning av det pâförda ?örgyllningsmedlet', 'normalt vid ca 90 - 150°C, medan bränningstemperaturen för trä normalt är ca 90', '-', '25', '130°C och för läder ca 90 - 130°C. För textilier, exempelvis av vegetabiliska cellu-', 'losafibrer, exempelvis bomull, är brähningstemperaturen normalt ca 90 - 140°c och', 'för textilfibrer av animalisk karaktär innehâllande protein, exempelvis ull, är', 'bränningstemperaturen normalt ca 90 - 130°C. För syntetfibertextilier, exempelvis', 'polyesterfibrer, sûsom !polyetylentereftalat, är bränningstemperaturen normalt ca', '30', '90 - 130°C och för textilier av blandningar av polyesterfibrer och animaliska eller', 'vegetabiliska fibrer, exempelvis polyetylentereftalat och ull eller bomull, är', 'bränningstemperaturen normalt ca 90 - 130°C För termoplaster, exempelvis akryl-', 'plaster eller -hartser, exempelvis termoplastiska polymerer eller sampolymerer av', 'metyl- eller etylestrar av akrylsyra eller metakrylsyra, polyetylen eller polypro-', '55', 'pylen, ir brähningstemperaturen normalt ca 90 - 125°C. Om lag bränningstemperatur', 'av ca 90 - 250°C erfordras, ür upphettning med infraröda strâlar särskilt fördel-', 'aktig, emedan den bildade metallfilmen har en värmereflekterande yta, som förhind-', 'rar överhettning. För eldfast underlag, exempelvis glas, glaserad keramik eller', 'porslin erfordras en temperatur av ca 500 - 900°C för smältning av flussen och', '40', 'uppnãende av en metallfilm med maximal vidhäftning.', 'Enligt följande exempel har produkterna, da det äir frâga om ugnsbrähning,']"
12,"['- 12 -', 'placerats vid rumstemperatur i en ugn, som sedan har värmts till en angiven tem-', 'peratur, hällits vid denna under angiven tid, dvs. hälltiden, och kylts, varvid', 'den totala behandlingen tar en timme eller mera. Vid tunnelbränning har produk-', 'terna letts genom en kontinuerlig tunnel under 1 h 25 min., varvid tunneln är', '5', 'värmd sã, att produkterna värmes langsamt till den angivna temperaturen, halles', 'ca 10 min. vid denna och sedan kyles langsamt. Med delar avses viktdelar och hal-', 'terna är räknade pa vikten i det följande, om annat icke anges.', 'Uppfinningen kommer i det följande att belysas närmare genom nágra icke be-', 'gränsande exempel.', '10', 'Exempel 1', 'Förgyllningsmedel innehillande guldetylmerkaptid-silvernaftenat.', 'En blandning av 156 delar guldetylmerkaptid, 200 delar silvernaftenat och', '3204 delar nafta med hög flampunkt omrördes under värmning till 70°C under 10 min.', 'och omrördes sedan 30 min., vid ca 70°c o för erhallande av en klar, mörkt purpur-', '15', 'röd lösning av en guldetylmerkaptid-silvernaftenat-koordinationsföreninginnehal-', 'lande 3,34 of guld och 1,83 % silver, vilken stelnade till ett mattligt styvt gel', 'vid kylning till rumstemperatur. Detta gel pafördes som ett dekorativt mönster', 'genom tryckning med schablon genom en nylonduk, (""Nitex""-raster nr 196 med mask-', 'vidd 0,074 mm) pa en vit melaminskiva, ett stycke dekalkomanipapper och ett styc-', '20', 'ke melaminimpregnerat x -cellulosapapper av den typ, som användes för ytdekore-', 'ring av bordsservis av melamin. Om melaminskivan värmdes med en infraröd lampa pa', '375 W under 5 min. pa ett avstand av ca 11 cm, framträdde mönstret som en blank', 'guldfilm. Melaminskivar skadades icke genom värmningen. Om dekalkomanipapperet', 'värmdes med en infraröd lampa pa 250 W under 10 min. pa ett avstand av 76 mm, fram-', '25', 'trädde mönstret som en blank guldfilm. Papperet skadades icke genom upphettningen.', 'Om A-cellulosapapperet värmdes pa samma sätt, framträdde mönstret som en tillta-', 'lande, matt guldfilm utan att papperet skadades.', 'För astadkommande av en tryckt, elektronisk krets med hjälp av en guldetyl-', 'nerkaptid-silvernaftenat-koordinationsförening kokades en blandning av 50 delar', '30', 'guldetylmerkaptid, 65 delar silvernaftenat och 2060 delar toluen 1 h under ater-', 'flöde för erhallande av en toluenlösning av guldetylmerkaptid-silvernaftenat-', 'coordinationsförening. Denna lösning värmdes till ca 100°C i en öppen skap pa', 'ett vattenbad, tills huvuddelan av toluenen hade förängats under kvarlämnande av', 'ca 117 delar mörk pasta. Denna anbragtes genom rastertryck i form av en elektro-', '35', 'nisk krets pa en glasskiva, som värmdes pa en värmeplatta med en yttemperatur av', 'ca 230°C. Efter ca 5 min. hade det paforda mönstret omvandlats till en elektriskt', 'ledande metallfilm. Tunna remsor av aluminiumfolie placerades i kontakt med mönst-', 'ret pa olika ställen, varefter en andra glasskiva belagd pa ena sidan med ett', 'akrylharts och värmd pa samma värmeplatta placerades över den första skivan med', '40', 'den belagda sidan i kontakt med den elektroniska kretsen. Det bildade laminatet', 'fick sedan svalna under ett tryck av ca 0,28 kp/cm². Härigenom erhölls en perma-', '2']"
13,"['304797', 'nent inkapslad, elektronisk krets, där aluminiumfolieremsorna tjänstgjorde som', 'ledare till kretsen. Da elström trycktes pa ledningarna, fungerade kretsens ele-', 'ment som motstand eller kondensatorer alltefter som mönstret bildade en kontinu-', 'erlig eller diskontinuerlig, elektrisk krets.', '5', 'Exempel 2', 'Förgyllningsmedel innehâllande guld-n-butylmerkaptid-silvernaftenat', 'En blandning av 572 delar guld-n-butylmerkaptid och 676 delar silvernafte-', 'nat i 8300 delar koltetraklorid omrördes 1 h vid 60 - 85°c. Tillräckligt med.', 'koltetraklorid tillsattes för ersättning av den förângade koltetrakloriden, var-', '10', 'igenom totalt 8602 delar koltetraklorid tillfördes. Härvid erhölls en viskös,', 'bärnstensfärgad lösning, som stelnade till ett styvt gel vid avsvalning. 54 de-', 'lar av detta utspäddes med 27 delar toluen till bildning av en rastertryckpasta', 'innehillande 2,67 of Au och 1,46 % Ag. Denna pasta trycktes genom ett raster nr', '304 pa dekalkomanipapper. Vid värmning under en infraröd lampa erhölls en blank', '15', 'guldfilm utan att papperet skadades. Dekalkomanin fullbordades pa vanligt sätt ge-', 'nom beläggning med lack, varefter guldmönstret lätt kunde överföras till önskat', 'underlag pa vanligt sätt genom fuktning av papperet och avskalning av den med', 'mönstret försedda lackfilmen. Tryckpastan anbragtes även pa en melamintallrik un-', 'der bildning av en blank guldfilm, utan att tallriken skadades, da den hölls 10', '30', 'min. under en infraröd lampa.', 'Exempel 3', 'Förgyllningsmedel innehâllande guld-X-metylbensylmerkaptid-silveretylmerkaptid.', 'En blandning av 667 delar guld-a-metylbensylmerkaptid och 341 delar silver-', 'etylmerkaptid i 7500 delar kloroform omrördes 4 h vid rumstemperatur. Ingen eller', '25', 'obetydlig reaktion inträdde. Blandningen omrördes och värmdes till 50°c under en', 'timme samt omrördes 0,5 h vid ca 50°C. Reaktionen var nu i huvudsak fullbordad', 'och lösningen filtrerades fri Trân spar av olösligt material. Vid indunstning av', 'det klargula filtratet vid rumstemperatur erhölls 1011 delar av den ekvimolära', 'koordinationsföreningen, nämligen guld-d-metylbensylmerkaptid-silveretylmerkap-', '30', 'tid, som ett gult harts. 1 del av denna koprdinationsförening omrördes med 6 de-', 'lar akrylharts, 6 delar etylacetat och 100 delar kloroform till bildning av en', 'Ilargul lösning innehâllande 0,35 5 Au och 0,19 1/2 Ag. Om denna lösning anbragtes', 'pa en skiva av soda-kalkglas och hölls 90 min. vid ca 150°C, erhölls en vidhäf-', 'tande film med en tilltalande, mörk purpurfärg.', '35', 'Exempel 4', 'Förgyllningsmedel innehâllande guldisobutylmerkaptid-silverisooktioglykolat.', 'A. En blandning av 400 delar guldisobutylmerkaptid, 698 delar toluenlös-', 'ning av silverisooktyltioglykolat innehâllande 21,51 1/2 silver och 620 delar to-', 'luen omrördes 90 min. vid rumstemperatur. Reaktionen var icke fullbordad utan', '40', 'avslutades genom omröring av blandningen 30 min. vid ca 50°C. Efter tillsats av', 'toluen för ersättning av förângningsförlusterna erhölls 1718 delar klargul lös-']"
14,"['- 14 -', 'ning av guldisobutylmerkaptid-silverisooktyltioglykolat innehallande 16 % guld', 'och 8,76 % silver. Denna lösning ströks med pensel pa en mörkgrön mösskärm av', 'akrylplast avsedd att skydda ögonen mot stark strälning. Sedan skärmen hade hal', 'lits 10 min. pa ett avstand av ca 12,5 cm frän en infraröd lampa pa 250 W, er-', '5', 'hölls en blank guldfilm pa den belagda delen av skärmen utan skador pa plasten.', 'Denna film minskade avsevärt genomsläppningen av infrarött och synligt ljus ge-', 'nom mösskärmen.', 'B. Ett nágot mindre koncentrerat förgyllningsmedel framställdes genom ut-', 'spädning av 25 delar av medlet A enligt ovan med 5 delar xylen, 5 delar etylace-', '10', 'tat och 5 delar kloroform till bildning av en klar gul lösning innehillande 10 %', 'guld och 5, 475 % silver. Denna lösning ströks med pensel pa olika underlag, var-', 'efter provstyckena höllos ca 11 cm frân en infraröd lampa pa 250 W under den tid,', 'som framgar av följande tabell 1. I samtliga fall erhöllos blanka guldfilmer pa', 'underlagen.', '15', 'Tabell 1', 'Förgyllning med förgyllningsmedel innehallande guldisobutylmerkaptid-silver-', 'isooktyltioglykolat.', 'Underlag', 'Upphettningstid', 'min.', '20', 'Mösskärm av akrylplast', '10', 'Fenolhartslimmat papperslaminat', '10', 'Melaninplastskiva', '10', 'Glasfibersemerat epoxihartslaminat', '15', 'Skiva av svart naturhärdgummi', '20', '25', 'Tunn polyamidskiva (nylon)', '60', 'Polypropylenskiva', '30', 'Furublock', '10', 'Svartlackerat lock av kolstal', '2', 'Vitlackerat lock av kolstal', '7', '30', 'Mässingsplät', '20', 'Skiva av klorerad polyeter (""Penton"")', '5', 'Tunn skiva av halogenerad fluorkarbonplast', '(""Aclar 22C"")', '10', 'Tunn skiva av halogenerad fluorkarbonplast', '35', '(""Aclar 33C"")', '15', '&tylcellulosafolie', '7', 'Glasfiberarmerat kiselplastlaminat', '5', 'Tunn folie av polyetylentereftalat (""Mylar""', 'R', '4', 'Cellulosaacetatfolie', '5', '40', 'Väggplatta av rostfritt stal 302', '5', 'Samma medel ströks med pensel pa en flaska av lineär polyetylen. Sedan']"
15,"['304797', 'den belagda delen av flaskan hade hällits ca 4 S i flamman frân en bunsenbrän-', 'nare, erhölls en blank guldfilm.', 'Samma medel ströks med pensel pa en klar skiva av soda-kalk-glas, vilken', 'värmdes 7 h pa en värmeplatta med yttemperaturen ca 90°C En blank guldfilm bil-', '5', 'dades.', 'Samma medel ströks med pensel pa ett stycke vävd glasfiberduk, som hölls', '10 min. pa ett aystand av ca 18 cm frân en infrarödstrilare pa 6000 W. En mörk', 'guldbeläggning bildades. Den utgjorde god ledare för elektricitet.', 'Samma medel ströks med pensel pa ett tunt skikt av fluorerad polyetylen-', '10', 'polypropylen (""Teflon FEP""), som hölls 20 S pa ett avstand av ca 18 cm frân en', 'infrarödstrilare pa 6000 W. En halvblank guldfilm bildades, vilken var blank, sedd', 'fran baksidan.', 'C. Ett flusshaltigt förgyllningsmedel innehâllande guldiscbutylmerkaptid-', 'silverisooktyltioglykolat för högtemperaturbrähning pa eldfast underlag bereddes', '15', 'en blandning av 100 delar av medlet A enligt ovan, 14 delar vismutresinatlösning', 'i en blandning av eteriska oljor, 4,5 of Bi, 4 delar lösning av kromresinat i en', 'blandning av cyklohexanon och terpentinolja, 2,05 % Cr, och 2 delar lösning av', 'rodiumsulforesinat i en blandning av eteriska oljor och kolväten, 5 c/s Rh. Den bil-', 'dade, klara lösningen, som innehöll 13,33 of guld och 7,30 of silver, ströks med', '20', 'pensel pa en glaserad, keramikplatta, som värmdes till 650°C i en ugn och hölls', '10 min. vid denna temperatur. En vidhäftande, ledande, matt guldfilm bildades,', 'vilken blev blank vid polering och kunde lodas.', 'D. 70 delar av medlet C ovan blandades med 50 delar sulfurerad balsam till', 'bildning av ett förgyllningsuedel innehallande 3 of guld och 4,38 of silver. Detta', '25', 'medel ströks med pensel pa olika eldfasta underlag, vilka brändes under lämpliga', 'betingelser för de enskilda underlagen. I samtliga fall erhöllos ledande guldfil-', 'mer. Underlagen, bränningsbetingelserna och de brända filmernas utseende framgar', 'av följande tabell 2.', 'Tabell 2', '30', 'Förgyllning med ett flusshaltigt förgyllningsmeãel innehâllande guldisobutyl-', 'terkaptid-silverisoolstyltioslylsolat.', 'Underlag', 'Bränning', 'Filmens ut-', 'seende', 'Tefat av borsilikat-opalglas', 'värmning till 650°C', 'blank', 'hâlltid 10 min.', '55', 'värmning till 650°c', 'blank', 'Rör av klart borsilikatglas', 'hâlltid 10 min.', 'värmning till 740°c', 'blank', 'Smilt kiseldioxidskiva', 'hâlltid 10 min.', 'värmning till 740°C', 'matt', '40', 'luminiumoxidskiva', 'halltid 10 min.']"
16,"['- 16 -', 'Underlag', 'Bränning', 'Filmens ut-', 'seende', 'Skiva av sodakalk-opalglas', 'tunnelbränning till 600°c blank', 'Emaljerad stalplat', 'värmning till 600°C', 'blank', '5', 'Aluminiumplat', 'värmning till 500°C', 'halvblank', 'Emaljerad aluminiumplät', 'värmning till 500°C', 'halvblank', 'Titanplat', 'värmning till 500°C', 'halvblank', 'Dricksglas av klart sodakalkglas', 'värmning till 600°C', 'blank', 'hälltid 10 min.', '10', 'Porslinstallrik', 'värmning till 800°C', 'blank', 'halltid 10 min.', 'Skâl av glaskeramik', 'värmning till 800°C', 'matt', '""Pyroceram""', 'halltid 10 min.', 'Glimmerskiva', 'värmning till 500°C', 'blank', '15', 'Rostfri stalplat', 'värmning till 500°C', 'blank', 'Fajansfat', 'värmning till 740°c', 'blank', 'hâlltid 10 min.', 'Samma medel ströks med pensel pa en glasfiberarmerad kiselplastskiva, som', 'värmdes 15 min. med en infrarödstralare pa 9000 W pa avstândet ca 18 cm. En blank', '20', 'ledande guldfilm erhölls. Om nágon hâlitid icke anges, har materialet enbart värmts', 'till den angivna temperaturen.', 'Samma medel ströks med pensel pa en glasfiberarmerad epoxiplastskiva, som', 'värmdes 3 h med en infrarödstralare pa 3000 W pa ett avstand av ca 18 cm. En blank,', 'icke ledande guldfilm erhölls.', '25', 'Exempel 5', 'Förgyllningsmedel innehallande guld-X-metylbensylmerkaptid-silver-n-oktadecylmer', 'kaptid.', 'En toluenlösning av guld-X-metylbensylmerkaptid-silver-n-oktadecylmerkaptid', 'bereddes genom omröring av en blandning av 201 delar guld--metylbensylmerkaptid,', '30', '238 delar silver-n-oktadecylmerkaptid och 2516 delar toluen under 20 min. vid 95°C', 'till bildning av en klargul lösning innehallande 4,00 % guld och 2,19 1/2 silver, vil-', 'ken lösning stelnade till ett styvt gel vid svalning till rumstemperatur. En bland-', 'ning av 10 delariav denna lösning, 3 delar stearinsyra, 3 delar stearon och 3 de-', 'lar melamin omrördes i en öppen skâl pa ett vattenbad, tills 8 delar hade förängats', '35', 'och 11 delar &terstod under bildning av ett.fast, termoplastiskt förgyllningsmedel', 'innehâllande 3,6 % guld och 1,97 to silver. Detta medel trycktes varmt med schablon', 'genom en nylonduk (""Nitex""-raster nr 230 med maskvidd 0,062 mm) värmd med en in-', 'fraröd lampa pa en glaserad keramikplatta. Den paförda filmen hardnade omedelbart', 'och var klibbfri. Efter bränning av plattan i ugn genom värmning till 350°C och', '40', 'bibehallande av denna temperatur under 5 min., framträdde det pâtryckta mönstret', 'som en blank, ledande citrongul guldfilm.']"
