PageNo,Text
1,"['UTLÄGGNINGSSKRIFT nr', '305 347', 'Int CI B 23 p 1/10 Kl. 48 a 3/04', 'P.ans. nr 9194/62', 'Inkom den', '24 VIII 1961', 'Giltighetsdag den', '6 VI 1961', 'PATENT- OCH', 'Ans. allmänt tillgänglig den', '1 VII 1968', 'REGISTRERINGSVERKET', 'Ans. utlagd och utläggnings-', 'skriften publicerad den', '21 X 1968', 'Prioritet begärd frân den 6 VI 1960', '(USA, 34 334)', 'GENERAL ELECTRIC COMPANY, SCHENECTADY, N.Y., USA', 'Uppfinnare: R D Halverstadt, D A Stewart och C J Hunt', 'Ombud: L Brann', 'Förfarande för avlägsnande av material fran ett elektriskt ledande', 'arbetsstycke med katodverktyg', 'Tillägg till 209 183', 'Föreliggande uppfinning avser ett förfarande för', 'avlägsnande av material frân ett elektriskt ledande arbets-', 'stycke med ett poröst katodverktyg enligt patentet 209.183,', 'varvid man bringar det por8sa katodverktyget, som kan använ-', 'das för sâväl mekanisk som elektrolytisk avverkning av mate-', 'rialet, att inverka pá arbetsstycket 1 närvaro av en elekt-', 'rolyt mellan arbetsstycket och katodverktyget, samt bringar', 'en elektrisk ström att passera mellan arbetEstycket och ka-', 'toden. Detta förfarande utmärkes särskilt av att elektrolyten', 'ledes in 1 katodverktyget, vars porer äro elektriskt ledande,', 'och pressas genom porerna 1 katodverktyget till den bearbe-', 'tande ytan hos verktyget, samt till omrádet mellan verktyget', 'och arbetsstycket, varvid don elektriska strommen bringas', 'att passera frân arbetsstycket genom verktyget utmed de', 'elektriskt ledande porerna 1 detta.', 'Detaljer av varmhällfasta legeringar, som användas', '1 högeffektmotorer, sãsom gasturbiner, tillverkas för närva-', 'rande av varmhällfasta legeringar genom vanlig slipning med', 'Dupl.kl. 21 h:30/02']"
2,"['305347', 'en slipskiva innehállande förglasad aluminiumoxid. I mânga', 'fall är det icke möjligt att avverka mer än ca 25 u material', 'frän arbetsstyckets yta för varje arbetsslag. Manga bearbet-', 'ningar kräva avverkning av metall frân arbetsstycket till ett', 'djup av 12,7 mm eller mera. Bearbetningen med en vanlig slip-', 'skiva är därför mycket tidsödande och omständlig. Denna', 'slipning kan medföra spänningar och verkliga sprickor 1 ytan', 'eller inuti arbetsstycket, vilka kunna bilda brottanvisningal', '1 detaljen.', 'För undvikande av den lângsamma avverkningen vid', 'användning av slipskivor med förglasad aluminiumoxid har man', 'försökt att använda diamantslipskivor. För enkel, jämn skär-', 'ning kunna diamantslipskivorna användas. Det har emellertid', 'icke visat sig möjligt att använda diamantslipskivor', 'för avverkande slipning av andra material än sintrad kar-', 'bid, keramik och liknande.', 'Även om diamantslipskivorna skulle kunna användas', 'för', 'avverkande slipning, skulle de behöva skärpas efter', 'mycket kort användning, emedan den varmhállfasta legeringen', 'är sá hard och seg, att även diamantslipskivor f& begränsad,', 'nyttig livslängd. Det är vidare praktiskt taget omöjligt att', 'riva en metallbunden diamantslipskiva, da invecklad form', 'erfordras. Invecklad, elektrolytisk slipning med användning', 'av sádana slipskivor är sâlunda praktiskt taget omöjlig.', 'Uppfinningen kommer 1 det följande att beskrivas', 'närmare med hänvisning till bifogade ritningar, vilka som']"
3,"['3', 'exempel visa nagra utföringsformer. Fig. 1 visar schematiskt', 'en slipmaskin enligt uppfinningen. Fig. 2 Ir en partiell vy', 'av en detalj, som har formats genom- slipning enligt förelig-', 'gande uppfinning.Fig. 3 H en perspektivvy av en annan de-', 'tali, som har formats genom slipning enligt föreliggande', 'uppfinning. Fig. 4 är ett tvärsnitt genom en slipskiva med', 'elektrolyttillförsel enligt uppfinningen. Fig. 5 ooh 6 äro', 'schematiska tvärsnitt genom slipskivor och arbetsstycken och', 'belysa tillämpningen av uppfinningen.', 'Enligt föreliggande uppfinning användes en katod', 'sammansatt av ett material, som är oledande för elektricitet', 'och genomsatt av porer, som tillsammans bilda ett kontinuer-', 'ligt system. Denna katods porer äro elektriskt ledande och', 'exempelvis impregnerade med ett material, som utgör en', 'god ledare för elektricitet.', 'Enligt uppfinningen kan man genomföra en', 'slutbearbetning, vid vilken en metallyta, som har modifierats', 'genom elektrolytiskt angrepp, slipas mekaniskt. Man kan', 'Even genomföra grovbearbetning och sedan finbearbething, var-', 'vid den bildade ytan Astadkommes genom elektrolytisk bear-', 'betning under grovbearbetningssteget och mekanisk slipning', 'jämte elektrolytisk bearbetning under slutsteget.', 'Vid elektrolytisk slipning och borrning ledes', 'likstrom genom en elektrolyt anrednad som en film mollan', 'arbetsstycket och en komplementär elektrod, som till sin', 'verkan avarar mot det skärande eller avverkande verktyg,']"
4,"['4.', 'som vanligen användes för att avverka metall frän ett', 'arbetsstycke. Denna elektrod kan eventuellt &stadkomma', 'mekanisk avverkning av metall samtidigt med den elektro-', 'lytiska bearbetningen alltefter elektrodens sammansättning', 'och det sätt, pâ vilket elektroden ausättes mot arbets-', 'stycket. Oberoende av om slipande metallavverknirg äger', 'rum eller icke äger rum ""pussar"" den roterande elektroden', 'den bearbetatie ytan och avlägsnar varje passiverands film,', 'vilken lämnas kvar som en elektrolysprodukt.', 'Liksträm, som ledes genom denna elektrolybfilm', 'frán det som anod kopplade arbetsstyoket till det som katod', 'kopplade ""verktyget"" avlägsnar metali frân anoden och av-', 'sätter den pá katoden. Det kemiska verkningssättet', 'skiljer sig icke frân vanlig galvanisering med undantag', 'för att elektrolyten är sammansatt att utfälla metalljoner,', 'som avlägsnas frán arbetsstycket, sã att de avsättas', 'pâ katoden.']"
5,"['5.', 'Katoden enligt föreliggande uppfinning gör det möjligt', 'att använda hög strömtäthet 1 elektrolytfilmer mellan katoden', 'och arbetsstycket och gör det även möjligt att understödja', 'den elektrolytiska bearbetningen med mekanisk bearbetning av', 'arbetsstycket med katoden som ett skärande eller slipande medel', 'liksom förbättrat putsmedel. Genom lämpligt val av material för', 'den porösa katoden kan den mekaniska verkan växla mellan lutt', 'putaning eller polering och avsevärd slipning eller skärning.', 'Under alla förhällanden uppvisar katoden enligt föreliggande upp-', 'finning en kombination av en icke-metalls önskvärda, fysikaliska', 'egenskaper och en metalls ledningsförmäga.', 'Den elektrolyt, som användes i samband med elektroden en-', 'ligt uppfinningen, kan sprutas till gränsytan mellan katoden', 'och arbetsstycket, ehuru man anser det fördelaktigt att till-', 'föra elektroden genom katodens porsystem för att säkerställa', 'tillräcklig tillförsel av elektrolyt till bearbetningszonen.', 'Denna tillförsel av elektrolyt genom katoden kan páskyndas ge-', ""nom att elektroly'en ledes under tryck till katoden eller genom"", 'centrifugalkraft, om en kratod i form av en roterande skiva an-', 'vändes. Om elektrolytflödet genom katod.en är otillräckligt, kan', 'elektrolyttillförseln förstärkas genom pasprutning,', 'Den föreditagna katoden enligt föreliggonde uppfinning', 'utgöres av en slipskiva med ett slipmedel bestäende av förglasad', 'aluminiumoxid. Denna slipskiva kan vara av standardtyp och är']"
6,"['6', 'Atminstone partiellt impregnerad med ett ""elektriskt lodande', 'material"" eller ""elektriskt ledande tryckfärg"" av den typ, som', 'nu användes vid framställning av tryckta kretsar. En föredragen', 'tryckfärg innehaller finfördelad silveroxid suspenderad 1 en', 'lkmplig vätska. Sedan skivan har impregnerats, reduceras silver-', 'oxiden till metalliskt silver genom varmebehandling vid den', 'temperatur, vid vilken silveroxiden reduceras. ""Elektriskt', 'ledande"" hänför sig till materialets eller tryckfärgens tillständ,', 'dá katoden är redo för användning. Beläggningen av tryckfärg', 'pâ porväggarna 1 skivan bildar en elektrisk förbindelse med', 'relativt lágt motstand mellan skivans nav och dess yta. Elektro-', 'lyten kan ledas till användningsstället genom skivans kontinuer-', 'liga porsystem. En slipakiva av förglasad aluminiumoxid utgör', 'vidaro 1 och för aig ett utomordentligt slipverktyg beträffande', 'avverkningeförmiga och nötningabeständighet. Ehuru här huvudsak-', 'ligen har omnKmnts en slipskiva av förglased aluminiumoxid, kan', 'man Even använda mod glas bundna karbidslipekivor, sã att exempelvis en', 'skiva av kiselkarbid impregnerad nod elektriskt ledande material', '1 nânga fall Er likvMrd med aluminiumozidslipskivan.', ""Föreliggande uppfinning l'impar sig särskilt för avverining"", 'av metall frán arbetsstycken av varmhällfasta legoringar genom', 'slipning. Snitt med ett djup av 6,4 mm oller djupare kunna ut-', 'föras under förslipningen eller grovalipningen, medan toleransen', 'kan hállas vid oa 2,5u under färdigslipningen. Avverkningen av']"
7,"['7.', 'metall under grovslipaingon kan med andra ord vara mánga ganger', 'större än avverkningen av metall för ett enda arbetsslag vid en', 'vanlig slipskiva. En avsevärd besparing av tid och slipnings-', 'kostnader uppnás sálunda genom föreliggande uppfinning.', 'Vid användning av slipskivor av förglasad aluminiumoxid har', 'det visat sig, att den maximala avverkningen icke alltid ger', 'tillátliga dimensionstoleranser. Maximal avverkning uppnás ge-', 'nom användning av relativt hög strömtäthet inom zonen för', 'elektrolytisk bearbetning. Vid sádan strömtäthet avverkas me-', 'tallen nästan helt genom elektrolytisk erosion, medan förslit-', 'ningen av slipskivan är nästan noll. Graden av elektrolytisk be-', 'arbetning är emellertid icke alltid pálitligt exakt 1 önskad grad.', 'Den erhâllna ytan astadkommes sálunda genom elektrolytens', 'elektrokemiska verkan, som kan variera, istället för slipmedlets', 'mekaniska verkan, som är relativt exakt.', 'Enligt ett utförande Astackommer sättet enligt uppfinningen', 'en möjlighet att ástadkomma en färdigslipning, som häller', 'dimensionerna inom de erforderliga, snäva toleranserna. Detta', 'astadkommes genom ökning av hastigheten eller genom minskning', 'av spänningen vid färdigalipningen. Denna verkan minskar ström-', 'tätheten och den resulterande erosionen i sádan grad, att slip-', 'medlet bearbetar arbetsstycket mekaniskt och förlänar arbets-', 'stycket dess slutliga eller färdiga yta.', 'Denna mekaniska slipning sker emellertid icke utan stöd', 'av elektrolytisk bearbetning och aluminiumoxidalipskivan skulle']"
8,"['8', '1 själva verket loke kunna dstadkomma en jämförbar slipverkan', 'pâ den normalt eldfasta ytan pa en varmhällfast legering i frán-', 'varo av den elektrolytiska bearbetningen. Denna överraskande', 'slipverkan föriclaras genom hypotesen, att clektrolytens katjoner', 'angripa och försvaga oller rugga upp eller angripa arbets-', 'styckets yta, sã att slipskivans slipmedel icke arbetar mot den', 'varmhällfasta legeringens intakta och släte yta. Denna eroderande', 'och slipande verkan &stadkommer mindre spänningar 1 arbets-', 'stycket än slipning med andra typer av slipskivor, sã a tt', 'sprickorna bli färre.', '..', 'Förfarandet', 'enligt föreliggande uppfinning', 'kan genomföras med: den anordning,', 'som visas schematiskt 1 fig. 1. En slipskiva 20 är monterad pû', 'nágon lämplig drivmekanism 21. Mekanismen omfattar medel för', 'att föra slipskivan 20 reverserande longitudinellt och trans-', 'versellt i förhällande till arbetsstycket 22. Mekanismen om-', 'fattar Aven medel för att bringa skivan 20 att rotera med ett', 'varvtal, som kan regleras enligt önskan 1 beroende av den slip-', 'ningsoperation, som genomföres.', 'Arbetsstycket 22 är monterat pa en ledande hállare 23,', 'vilken genom en ledning 24 är kopplad son en anod till en lik-', 'strömskällas 25 Lositiva pol. En ledning 26 förbinder strömkäl-', 'lans negativa pol med slipskivan 20, sã att denna bildar en', 'katod 1 den elektrolytiska kretsen.']"
9,"['9', 'En elektrolytbehallare 27 Ir genom ett rör 28 förbunden', 'med ett hálrum 1 skivans 20 centrala del. Röret 28 har en ventil', '29 för reglering av tillförsein av elektrolyt till skivan 20.', 'Ett lämpligt, icke visat trâg för uppfängning av elekt-', 'rolyten Hr anordnat 1 samband med hällaren 23. Ett returrör 30', 'är anordnat för att leda elektrolyt genom ett filter 31 och med', 'en pump 32 tillbaka till behállaren 27.', 'Sásom kommer att diskuteras närmare 1 det foljande Ir', 'det enligt uppfinningen möjligt att variera förhällandet mellan', 'elektrolytisk och mekanisk slipning. För detta andamál finns', 'ett medel för att variera den spänning, som tryckes pá elektro-', 'derna, nämligen arbetsstycket 22 och skivan 20. Detta medel', 'visas schematiskt son en kompensator 33. Medel kunna Aven an-', 'ordnas för att undra slipskivans 20 varytal och visas schema-', 'tiskt som en varvtalsregulator 34.', 'Flüdet av eleistrolyt till slipskivan variorar 1 be-', 'roande av driftsbetinmoleerna, sâsom skivann storlek, arbetshastig+', 'het och förhällandst elektrolytisk slipning till vanlig ytslipning.', 'Skivans föredragna periferihastighet Ir oa 760-1830 m/min. under', 'slipningen. Dâ elektrolyt införes genom skivans nav, kommer', 'skivans rotation att utsutta elektrolyten für en centrifugal-', 'kraft, sá att den drives genom den porösa skivan. Elektrolyten', 'tillföres normalt en hastighet, vilken är 1 huvudsak lika', 'med don hastighet, med vilken elektrolyten avledes frân skivans']"
10,"['10', '305347', 'nay eller centrum genom den roterande skivans centrifuzalverí,', 'Elektrolyten kan emellertid Aven tillföras med hjälp av ett', 'munstyoke, som är placerat pa lämpligt ställe och riktat mot', 'skivans yts.', 'Elektrolyten kan utgöras av nágon lämplig lösning, som', 'möjliggör effektiv elektrolytisk bearbetning av arbetsstycket.', 'Som exempel pá en lämplig elektrolyt kan nämnas en vattenlösning', 'av natriunklorid ooh borsyra. Elektrolyten bör innehálla ett', 'reagens, som reagerar med de metalljoner, som avlägsnas frân', 'arbetsstycket, till bildning av en fällning, sá att metallen', 'icke utfälles pá skivan. Det eller de använda reagensen beror', 'delvis pa bestândsdelarna i den legering, som bearbetas. Om lege-', 'ringen övervägande bestâr av järn, kan natriumformiat med fram-', 'gâng användas son reagens. De avlägsnade metallionerna kunna', 'alternativt avskiljas frán lösningen, genom att elektrolyten', 'ledes genom en utfällningstank eller genom en jonseparator.', 'Elektrolyten kan Aterföras genom filtret 31 av pumpen 32,', 'sá att elektrolytlösningen blir fri frân fasta partiklar, som', 'skulle kunna sätta igen slipskivans hálrum.', 'Det má särskilt framhállas, att den i fig. 1 visade anord-', 'ningen endast utgör en utföringsform. Man kan använda varje', 'lämplig mekanism för uppsättning av slipskivan och arbetsstycket', 'och för att leda elektrolyt till slipskivan och ström mellan', 'denna och arbetsstycket.']"
11,"['13.', 'Under slipningen ansättes en spänning av exempelvis 16 V', 'mellan slipskivan och arbetsstycket, vilken spänning resulterar', 'i en strömstyrka genom elektrolyten e.v 30 - 140 A alltefter', ""slipskivans s'corlek och snittets djup. sã hög strömstyrka som"", '600 A har omellertid använts med framgáng. Slipskivan drives', 'med önskat varvical och elektrolyten ledes till densamma. Dá', 'skivan passerar längs arbetsstycket kommer elektrolytverkan att', 'förorsaka avverlining av metall frân arbetsstycket i beroende av', 'slipskivans kontur. Under denna förslipning avlägsnas material', 'nästan uteslutande elektrolytiskt frân arbetsstycket.', 'Även om nâgon metall icke avlägsnas genom slipning, kommer', 'den roterande elektrodskivan att putsa den yta, som skäres och', 'avlägsna varje bildad, passiverande film. Denna putsning lämnar', 'en yta, som är ren och idealisk för befrämjande av elektrolyt-', 'verkan.', 'Vid formning av ett formstycke av ett ämme av en varm-', 'hôllfast legering genomföres sà mânga elebtrolytiska förslip-', ""ningar som arfordras för grovslioning av stycke's. Sedan minskas"", 'den cpärming, son pá don elcktrolytiska kretsen eller', 'ôkas den relativa hastigheten nellan slipokivan och det ano-', 'diska erbetestycket. Denno ändring av endere av dessa para-', 'metrar nedför en ökning av den mokaniska slipningen i förhällande', 'till den elsktrolytista metallevverinirgen. Med hänsyn till enkel-', 'heten och ekonomien förodras ändring av spänningen för att andra']"
12,"['12', 'förhállandet mellan elektrolytisk och mokanisk slipning. Detta', 'kan Svervakas exakt genom mätning av effektökningen för drivning', 'av slipskivespindeln. Varje skning av effekten innebär en motsva.', 'rande ökning av den mekaniska avverkningen.', 'Fig. 2 och 3 visa sádana tvärsnittsformer, som kunna astad-', 'kommas genom sättet enligt föreliggande uppfinning. Formstycket', '35 énligt fig. 2 har bildats genom elektrolytisk slipning enligt', 'föreliggande uppfinning av en massiv, an 32 mm tjock stav. Me-', 'tallen utgjordes av en varmhällfast legering M-252, vilken ut-', 'tryckt 1 viktprocent har följande sammansättning:', 'C', '0,1', '-', '0,2', '%', 'Cr.', '18', '-', '20', 'Co', '9', '-', '11', 'Mo', '6', '-', '11', 'Ti', '2,25', '-', '2,75', 'Al', '0,25', '-', '1,25', 'N1', 'Rest', 'Ett ringformigt arbetsstycke 36 franställdes även av ett', 'material med tjockloken 25 mm. De bägge arbetsstyokenas 35 och', '36 tunna fenor kunna formas med sã snäva toleranser som 2,5u', 'vid sättet enligt föreligganda upprinning, emedan pá sin höjd', 'obetydlig, mekanisk kraft utôvas.', 'anylindos', 'Fig. 4 visar en slipskiva enligt föreliggande upp-', 'finning. En skiva 40, som kan utgöras av en vanlig slipskiva', 'av förglasad aluminiumoxid impregnerad med ett. ledande umne pá']"
13,"['13', 'det 1 det följande boskrivna sättet, har ett centralt hál 41.', 'En metallfattning 42 har en ringformi.g fläns 43 anordnad att', 'anligga mot skivans ena sida 44. En ihälig axeltapp 45, som', 'utgör cn godsfast del. av fattningen 42, passerar genom slip-', 'skivans hál 41 och är gängad vid 16 för paskrovning av en mutter', '47, genom vilken skivan 40 klämmes fast pá fattningen. Denna har', 'en hylstapp 48 för att trädas pà en arel 49, som ür förbunden', 'sá med en motor, att skivan kan bringas att rotera med lämpligt', 'varvtal för slipningen. Fattningen 42 är Tänt pa axcln 49 med', 'hjulp av en 50. Spänningen för elektrolysen kan tryckas', ""pá skivan genom en borste 51, som hâlles 1 kontak'c med hyls-"", 'tappens 48 yta.', 'Fattningens axoltapp 45 har flera periferiskt fördelade', 'hál 52, genom vilka elektrolyten passerar fran axsl tappen till', 'skivan 40. Denna kan vara.förzedd mod ett ringformigt spâr 53,', 'som är anordnat intill hAlen 52 till bildning av cn ficka för', 'upptagning av ett eloktrolytförràd. Elektrolyten strömmar frân', 'fickan 53 genom skivans 40 porer till dess periferi 54. Elcktro-', 'lyten ledes till fattningen genom ett rör 55, som skjuter in i', 'den iháliga axeltappingen 45 och slutar intill hâlen 52. Röret', '55 är genom en lämplig slang 56 förbundot med ett elektrolyt-', 'förräd. En packning kan anordnas mellan röret 55 och axcltappen', '45, ehuru den icko är nödvändig, om tillförseln av elektrolyt', 'genom röret 55 icke overstiger slipskivans 40 förmaga att nv-', 'leda elektrolyt, som har införts i axeltappen 45, genom den']"
14,"['14', 'centrifugalkraft, som driver clektrolytcn genom halen 52 och skivan.', 'Eftersom skivans 40 porer äro anordnade utan regelbunden for-', 'delning i hela skivan, har elektrolyten benägenhet att dispergeras', 'likformigt över skivans hela tvärsnitt. Härigenom uppnas en jämn för-', 'delning av elektrolyten utefter den slipade yta, 54, som befinner sig', 'i kontakt med arbetsstycket.', 'Fig. 5 och 6 visa tvã tänkbara utformningar av slipskivan', 'enligt fig. 4. Enligt fig. 5 är slipskivans periferi i stort sett', 'triangulär i tvärsnitt sãsom visas vid 57. Skivan kommer att avverka', 'metall till bildning av ett motsvarande spâr 58, som har samma triangu-', 'lära tvärsnitt.', 'Enligt fig. 6 har skivans kant konkavt och halvcirkelformigt', 'tvärsnitt sâsom visas vid 59. Det arbetsstycke, som bearbetas med slip-', 'skivan enligt fig. 6, kommer sãlunda att förses med en i tvärsnitt', 'halvcirkelformig as 60. Aven om arbetsytan pâ de här visade skivorna', 'har enkel form, kan denna arbetsyta rivas till godtycklig, enkel eller', 'invecklad form för astadkommande av motsvarande, slipade ytor pã', 'ett arbetsstycke.', 'P A T E N T K V', 'Förfarande för avlägsnande av material frân ett elektriskt', 'ledande arbetsstycke med ett katodverktyg enligt patentet 209.183,', 'varvid man bringar det porösa katodverktyget, som kan användas för', 'sãväl mekanisk som elektrolytisk avverkning av materialet, att inverka', 'pâ arbetsstycket i närvaro av en elektrolyt mellan arbetsstycket och', 'katodverktyget, och bringar en elektrisk ström att passera mellan', 'arbetsstycket och katoden, k ä n n e t e C k n a t d à r a V, att', 'elektrolyten ledes in i katodverktyget, vars pcrer äro elektriskt', 'ledande, pressas genem porerna i katodverktyget till den bearbetade', 'ytan av verktyget samt till omrâdet mellan verktyget och arbetsstycket,', 'samt att den elektriska strömmen bringas att passera frän arbetsstycket', 'genom verktyget utmed porerna.', 'ANFÖRDA PUBLIKATIONER:', 'Storbritannien 703 838, 748 485, 778 053', 'USA 2 798 846 (204-143)']"
15,"['27', '30', '33', '26', '28', '29', '&', '+', 'Z1', '20', '32', '24', '22', '34', '25', '31', '23', 'timg.', '1', '30', '35', 'Iig.2', '36', 'tig.3']"
16,"[""E'"", '40', '53', '47', '43', '50', '51', 'my', '45', '55', '56', '&', 'a', '+', '52', '52', '49', 'y', '46', '48', '41', 'o,', '42', '-53', '47', 'tight', '54', '59', '57', '58', 'GO', 'Timp']"
