PageNo,Text
1,"['UTLÄGGNINGSSKRIFT nr', '304 797', 'Int CI C 09 d 5/22 Kl. 22 g 2/01', 'P.ans. nr 13051/63', 'Inkom den 26 XI 1963', 'Giltighetsdag den 26 XI 1963', 'PATENT- - OCH', 'Ans. allmänt tillgänglig den 1 VII 1968', 'REGISTRERINGSVERKET', 'Ans. utlagd och utläggnings-', 'skriften publicerad den', '7 X 1968', 'Prioritet styrkt fran den 27 XI 1962', '(USA, 240 426)', 'ENGELHARD INDUSTRIES, INC., NEWARK, N.J., USA', 'Uppfinnare: R C Langley och H M Fitch', 'Ombud: o Grahn', 'Gulddekoreringsmedel innehallande guld-silver-koordinationsföreninga:', 'samt sätt att framställa sãdant', 'Föreliggande uppfinning hänför sig till medel för dekorering med ädelme-', 'tall och närmare bestämt till nya och förbättrade förgyllningsmedel, ett sätt', 'att förgylla med sãdana och nya koordinationsföreningar, vilka lämpar sig väl', 'for användning som komponenter i sãdana förgyllningsmedel.', '5', 'Förgyllningsmedel innehallande guld-sulforesinater är kända och har be-', 'skrivits av exempelvis Boudnikoff, Compt. rend. 196, p. 1898, 1933, och Chem-', 'nitius, J. Prakt. Chem. 117, p. 245, 1927. Guldsulforesinaterna framställes ge-', 'nom omsättning av ett guldsalt med en sulfurerad terpen, sãsom sulfurerad vene-', 'tiansk terpentin. Silversulforesinaterna framställes pa samma sätt genom omsätt-', '10', 'ning av ett silversalt med en sulfurerad terpen. Förgyllningsmedel innehallande', 'blandningar av guld- och silver-sulforesinater i olika proportioner är kända', 'och har beskrivits av exempelvis Zsigmondy, se den amerikanske patentskriften', '682 310, och av Chemnitius, Sprechsaal 60 p. 313, 1927. Chemnitius har även be-', 'skrivit blankförgyllningsmedel innehallande blandningar av ett guldsulforesinat,', '15', 'guldpulver och silverbensoat. Dekorering av föremal med dessa tidigare kända för-', 'gyllningsmedel har krävt bränning av medlet efter paförandet pa föremalet vid', 'hög temperatur av ca 500 - 800°C eller högre i beroende av det förgyllda under-', 'laget för avsättning av en ädelmetallfilm. De underlag, som skall förgyllas,', 'maste súlunda bestà av ett eldfast material eller ett material med god värme-', '20', 'beständighet för att uthärda den höga temperaturen vid beänningen. Underlag av', 'Dupl.kl. 12 0:23/03; 48 b:3/04']"
2,"['2 -', 'icke eldfast material eller material med lâg värmebeständighet, sãsom papper,', 'trä, läder, textil av cellulosa- och syntetfibrer samt plaster och plastlami-', 'nat av den termoplastiska typen kan icke brännas vid dessa hoga temperaturer,', 'emedan de da förstöras eller sönderdelas. De tidigare kända blandningar, som', '5', 'innehaller guldsulforesinat och silverbensoat, är vidare instabila och utfäller', 'omedelbart metalliskt silver pa grund av reduktion ay silverbensoatet.', 'Förgyllningsmedlen enligt föreliggande uppfinning innebär en förbättring', 'av de tidigare kända medlen enligt ovan och en speciell fördel är, att de gör', 'det möjligt att bränna föremál med lâg värmebeständighet, vilka icke är eldfasta,', '10', 'utan sönderdelning eller förstöring av icke eldfasta underlag. Förgyllningsmed-', 'len innehäller en koordinationsförening av en guldmerkaptid och ekvimolär mängd', 'silverkarboxylat eller -merkaptid, och en bärare för koodinationsföreningen. För-', 'gyllningsmedlen enligt föreliggande uppfinning möjliggör bränning av icke eldfas-', 'ta underlag vid avsevärt lägre temperatur än som har erfordrats tidigare utan vär-', '15', 'meskador pa underlaget och äir dessutom stabilare än tidigare kända blandningar,', 'varjämte den icke önskvärda utfällningen av metalliskt silver undvikes. Koordina-', 'tionsföreningarna uppvisar en fördelaktig synergism i förgyllningsmedlen i vissa', 'viktiga hänseenden i förhällande till användningen av koordinationsföreningens', 'komponenter var för sig. Koordinationsföreningarna uppvisar sãlunda avsevärt bätt-', '20', 're löslighet i organiska lösningsmedel än vardera komponenten för sig eller i fy-', 'sikalisk blandning. Förgyllningsmedel innehallande koordinationsföreningarna upp-', 'visar vidare aysevärt bättre täckförmaga än medel innehallande endera komponenten', 'i', 'koordinationsföreningen eller en blandning av bäggedera. Förgyllningsmedel in-', 'nehillande koordinationsföreningarna enligt föreliggande uppfinning brännes till', '25', 'filmer, som är guldgula och till sitt utseende icke kan skiljas frân filmer av', 'rent guld. Härigenom blir det möjligt att &stadkomma guldfilmer billigare genom', 'att det relativt billiga silvret ersätter en del av det guld, som normalt ingar', 'i', 'sãdana filmer. Aven om orsakerna till att koordinationsföreningarna enligt fo-', 'religgande uppfinning uppträder pa detta sätt ännu icke är helt klarlagda, är', '30', 'det uppenbart, att koordinationen medför en inbördes paverkan av komponenterna', 'under bränningen, vilken paverkan icke uppnas med de tidigare kända, icke koor-', 'dinerade blandningarna.', 'Koordinationsföreningarna enligt föreliggande uppfinning har den generella', 'formeln RSAu. Y, i vilken Y är R\' SAg eller R""C00Ag, varvid R, R\' och R"" repre-', '35', 'senterar alkylgrupper, förestrade karboxialkylgrupper, alkoxialkylgrupper, ali-', 'cykliska grupper eller aryl-, aralkyl-, alkaryl- eller terpenylgrupper. De fram-', 'ställes genom omsättning av 1 mol guldmerkaptid med 1 mol silverkarboxylat eller', 'silvermerkaptid, lämpligen i ett lösningsmedel, sûsom den bärare, som skall an-', 'vändas i förgyllningsmedlet, under upphettning av reagenserna till ca 50 - 120°C,', '40', 'om det ena eller bägge reagenserna är begränsat lösliga i organiska lösningsmedel,', 'vilket normalt är fallet. Upphettningen är väsentlig för denna reaktion, eftersom']"
3,"['304797', 'reaktionen utan upphettning icke fullbordas inom rimlig tid utan kan ta sã lang', 'tid som en vecka eller längre för att gal till fullbordan. Om bägge reagenserna', 'är lättlösliga i organiska lösningsmedel, kan det vara överflödigt att tillföra', 'värme för fullbordan av reaktionen, som kan fullbordas vid rumstemperatur. Tem-', '5', 'peraturer längt över 120°C bör undvikas med hänsyn till koordinationsföreningar-', 'nas lâga värmebeständighet. Ett av reagenserna bör generellt vara lösligt till', 'ca 5 viktprocent eller mera i de organiska lösningsmedel, vilka användes som bä-', 'rare i förgyllningsmedlen enligt föreliggande uppfinning. En fördel med uppfin-', 'ningen är, att koordinationsföreningens löslighet i organiska lösningsmedel nor-', '10', 'malt närmar sig lösligheten för den lättlösligare komponenten. Detta är fallet', 'även om den svârlösligare komponenten är olöslig eller har obetydlig löslighet.', 'Detta innebär en fördel, genom att det blir möjligt att använda relativt olösliga', 'föreningar, exempelvis guld-etylmerkaptid eller silver-2-etylkapronat, vilka nor-', 'malt är alltför olösliga för att kunna användas i förgyllningsmedel, som är av-', '15', 'sedda att ge en blank metallfilm utan polering.', 'Koordinationsföreningarna enligt föreliggande uppfinning kan innehalla ca', '2-60 kolatomer i molekylen och helst ca 6-40 kolatomer. I den allmänna formeln', 'RSAu.Y, där Y är R \'SAg eller R""C00Ag, medan R, R\' och R"" representerar en alkyl-', 'grupp, en förestrad karboxialkylgrupp, en alkoxialkylgrupp, en alicyklisk grupp', '20', 'eller en aralkyl-, alkaryl- eller terpenylgrupp, kan som exempel pa alkylgrupper', 'nämnas sãdana innehallande alkylgrupper med 1 - 20 kolatomer, som exempel pa de', 'förestrade karboxialkylgrupperna kan nämnas sãdana med karboxigruppen förestrad', 'med en alkylgrupp av en alifatisk alkohol och med alkylgruppen av karboxialkyl', 'innehâllande 1 - 20 kolatomer. Som exempel pa alkoxialkylgrupper kan nämnas sã-', '25', 'dana, där varje alkylgrupp innehâller 1 - 20 kolatomer, medan som exempel pa ali-', 'cykliska grupper kan nämnas cyklohexyl- och naftenylgrupper. Som exempel pa aryl-', 'grupper kan nämnas fenyl-, naftyl- och antrylgrupper, och pa aralkylgrupper fenyl-,', 'naftyl- och antrylgrupper i aryldelen och en alkyldel med 1 - 20 kolatomer. Som', 'exempel pa alkarylgrupper kan nämnas grupper med fenyl, naftyl och antryl i aryl-', '30', 'delen och med 1 - 20 kolatomer i alkyldelen och som exempel pa terpenylgrupper kan', 'nämnas pinanyl- och mentylgrupper.', 'Aven om det vanligen varken är nödvändigt eller önskvärt att isolera eller', 'rena koordinationsföreningen, som kan framställas i en eller flera av de bärare,', 'som skall användas i förgyllningsmedlet, kan koordinationsföreningarna enligt upp-', '35', 'finningen isoleras genom förängning av det lösningsmedel, i vilket de har fram-', 'ställts. De flesta koordinationsföreningarna erhâlles i amorf eller hartsartad', 'form, ehuru nágra fà kan isoleras som väldefinierade, kristalliserade ämnen. Om', 'sûlunda ekvimolära mängder guld-sek.-butylmerkaptid och silver-tert.-butylmerkap-', 'tid omröres vid ungefär 110°C i minsta möjliga mängd toluen för erhâllande av en', '40', 'klar lösning, utfälles kristaller av guld-sek.-butylmerkaptid-silver-tert.-butyl', 'merkaptid-koordinationsförening vid avsvalning och kan omkristalliseras ur toluen']"
4,"['304797', 'utan ändring av sammansättningen. De sãlunda erhallna, vita kristallerna sön-', 'derdelas utan att visa nágon skarp smältpunkt i ett smältpunktskapillärrör vid', 'temperaturer av 178°C och högre.', 'Guldmerkaptider, vilka lämpar sig för att kombineras med silverkarboxyla-', '5', 'ter eller silvermerkaptider till bildning av koordinationsföreningarna enligt', 'föreliggande uppfinning, omfattar guldmerkaptider av primära, sekundära och ter-', 'tiära merkaptaner, vilka kan ha alifatisk eller alicyklisk struktur eller aryl-,', 'alkaryl-, aralkyl- eller terpenylstruktur. Som exempel pa guldmerkaptider, som', 'med silverkarboxylater eller silvermerkaptider ger ekvimolära koordinationsföre-', '10', 'ningar, vilka lämpar sig för användning i förgyllningsmedlet enligt föreliggande', 'uppfinning, kan nämnas guldetylmerkaptid, guld-n-propylmerkaptid, guld-isopropyl-', 'merkaptid, juld-n-butylmerkaptid, guldisobutylmerkaptid, juld-sek.-butylmerkaptid,', '(uld-tert.-butylmerkaptid, guld-n-amylmerkaptid, guldisoamylmerkaptid, guld-n-', 'hexylmerkaptid, guld-n-heptylmerkaptid, guld-n-oktylmerkaptid, guld-tert.-oktyl-', '15', 'merkaptid, guld-2-etylhexylmerkaptid, guld-n-decylmerkaptid, guld-n-dodecylmer-', 'kaptid, juld-tert.-dodecylmerkaptid, juld-tert.-hexadecylmerkaptid, guld-n-oktade-', 'cylmerkaptid, etylestern av guldkarboximetylmerkaptid, isooktylestern av guldkar-', 'boximetylmerkaptid, 2-metoxietylester av guldkarboximetylmerkaptid, guld-2-meto-', 'xietylmerkaptid,guld-4-etoxibutylmerkaptid, guld-cyklohexylmerkaptid, guldbensyl-', '20', 'merkaptid, uld-O-metylbensylmerkaptid, guld-2-fenyletylmerkaptid, blandade guld-', 'kresylmerkaptider, blandade guldxylylmerkaptider, juld-p-tert.-butylfenylmerkaptid', 'guld-p-nonylfenylmerkaptid, guld-p-tert.-butyl-o-metylfenylmerkaptid, guldpinenmer-', 'kaptid och guld-1- mentylmerkaptid. De bästa resultaten har generellt erhällits', 'med koordinationsföreningar beredda av guld-prim. och guld-sek.-alkyl eller-aral-', '25', 'kylmerkaptider. Det är icke nödvändigt att använda rena guldmerkaptider vid till-', 'lämpning av uppfinningen, utan man kan använda blandningar av guldmerkaptider för', 'erhallande av blandningar av koordinationsföreningar.', 'Bland silvermerkaptider, som lämpar sig för kombination med guldmerkapti-', 'derna för bildning av koordinationsföreningarna enligt uppfinningen, kan nämnas', '30', 'silvermerkaptider av primära, sekundära och tertiära merkaptaner, som kan ha ali-', 'fatisk eller alicyklisk struktur eller aryl-, alkaryl-, aralkyl-eller terpenyl-', 'struktur. Som exempel pa specifika silvermerkaptider, som med guldmerkaptiderna', 'ger ekvimolära koordinationsföreningar, vilka lämpar sig för användning i förgyll-', 'ningsmedel, kan nämnas silveretylmerkaptid, silverisopropylmerkaptid, silver-n-', '35', 'butylmerkaptid, silverisobutylmerkaptid, ver-sek.-butylmerkaptid, silver-tert.', 'butylmerkaptid, silver-2-etylhexylmerkaptid, ilver-tert.-nonylmerkaptid, silver-', 'n-dodecylmerkaptid, silver-n-oktadecylmerkaptid, etylestern av silverkarboximetyl-', 'merkaptid, isooktylestern av silverkarboximetylmerkaptid, tert.-dodecylestern av', 'silverkarboximetylmerkaptid, silver-2-metoxietylmerkaptid, silver-4-etoxibutyl-', '40', 'merkaptid, silvereyklohexylmerkaptid, silver-XX-metylbensylmerkaptid, silver-2-', 'fenyletylmerkaptid,  silver-p-tert.-butylfenylmerkaptid, silverpinenmerkaptid och']"
5,"['304797', 'silver-l-mentylmerkaptid. Särskilt goda resultat har erhällits med koordinations-', 'föreningar framställda av isooktylestern av silverkarboximetylmerkaptid, som fram-', 'ställes genom omsättning av ett silversalt med isocktyltioglykolat. Det är icke', 'nödvändigt att använda rena silvermerkaptider vid tillämpning av uppfinningen utan', '5', 'man kan använda blandningar av silvermerkaptider för erhâllande av blandningar av', 'koordinationsföreningar.', 'Bland silverkarboxylater, vilka lämpar sig för förening med guldmerkaptider-', 'na till bildning av koordinationsföreningarna enligt uppfinningen, kan nämnas sil-', 'verkarboxylater av alifatiska eller alicykliska karbonsyror eller aryl-, alkaryl,', '10', 'aralkyl- eller terpenylkarbonsyror. Som exempel pa karboxylater, som med guldmer-', 'kaptider ger ekvimolära koordinationsföreningar, vilka lämpar sig för användning', 'i förgyllningsmedlen, kan nämnas: silverbutyrat, silver-2-etylkapronat, silver-10-', 'undecenoat, silverstearat, silver-s-tert.-dodecyl-tioglykolat, silveroleat, silver-', 'p-tert.-butylbensoat, silverhydrocinnamat, silverfenylacetat, silverdifenylacetat,', '15', 'silvermetoxiacetat, silver-3-etoxibutyrat, silverhexahydrobensoat, silverkamforat,', 'silveretylsuccinat, silvernaftenat och hydrerat silverresinat. Särskilt goda re-', 'sultat har erhâllits med koordinationsföreninga framställda av silvernaftenat.', 'Det är icke nödvändigt att använda rena silverkarboxylater vid tillämpning av', 'uppfinningen utan man kan använda blandningar av silverkarboxylater för erhâllan-', '20', 'de av blandningar av koordinationsföreningar.', 'Exempel pa koordinationsföreningar, vilka lämpar sig för framställning av', 'förgyllningsmedlen enligt uppfinningen, är sammanställda till följande tabell.', 'I samtliga fall framställdes koordinationsföreningen av ekvimolära mängder av an-', 'givna guld- och silverföreningar, varvid ett tankestreck betecknar koordinations-', '25', 'bindningen. Med hänsyn till överskädligheten och kortheten användes termerna guld-', 'eller silver-etyl-, isooktyl-, tert.-dodecyl- och 2-metoxietyl-tioglykolat för att', 'beteckna etyl-, isooktyl-, cert.-dodecyl- och 2-metoxietyl-estrarna av guld eller', 'silverkarboximetylmerkaptid. I samtliga fall är alkylgruppen bunden vid karboxi-', 'gruppen som en förestrande grupp, medan metallen är bunden som en merkaptid vid', '30', 'tioglykolsyrans merkaptansvavelatom.', 'uldetylmerkaptid-silver-dmetylbensylmerkaptic', 'Guldetylmerkaptid-silver-tert.-nonylmerk', 'Guldetylmerkaptid-silverisooktyltioglykolat', 'Guldetylmerkaptid-silvernaftenat', '35', 'Guld-n-propylmerkaptid-silvernaftenat', 'Guld-isopropylmerkaptid-silvernaftenat', '11a-n-butylmerkaptid-silverisooktyltioglykolat', 'uld-n-butylmerkaptid-silver-1-mentylmerkaptic', 'Guld-n-butylmerkaptid-hydrerat silverresinat', '40', 'Guldisobutylmerkaptid-silver-n-butylmerkaptid', 'Guldisobutylmerkaptid-silverisobutylmerkaptid']"
6,"['304797', 'Guldisobutylmerkaptid-silver-sek.-butylmerkay', 'Guldisobutylmerkaptid-silver-tert.-butylmerkaptid', 'Guldisobutylmerkaptid-silvercyklohexylmerkaptid', 'Guldisobutylmerkaptid-silver-2-etylhexylmerkapt:', '5', 'Guldisobutylmerkaptid-silverisooktyltioglykolat', 'Guldisobutylmerkaptid-silver-p-tert.-butylfenylmerkaptid', 'Guldisobutylmerkaptid-silverpinenmerkaptid', 'Guldisobutylmerkaptid-silver-n-dodecylmerkaptid', 'Guldisobutylmerkaptid-silvernaftenat', '10', 'Guldisobutylmerkaptid-hydrerat silverresinat', 'Ld-sek.-butylmerkaptid-silver-n-butylmerkaptid', 'uld-sek.-butylmerkaptid-silverisobutylmerkaptid', 'Guld-sek.-butylmerkaptid-silver-sek.-butylmerkaptid', 'Guld-sek.-butylmerkaptid-silver-tert.-butylmerkaptid', '15', 'Guld-sek.butylmerkaptid-silvereyklohexylmerkaptid', 'uld-sek.-butylmerkaptid-silver-2-etylhexylmerkaptid', 'la-sek.-butylmerkaptid-silver-2-fenyletylmerkaptid', 'luld-sek-butylmerkaptid-silverisooktyltioglykolat', 'uld-sek.-butylmerkaptid-silver-l-mentylmerkaptid', '20', 'uld-sek.-butylmerkaptid-silver-p-tert.-butylfenylmerkaptic', '-sek.-butylmerkaptid-silverpinenmerkaptid', 'Guld-sek.-butylmerkaptid-silver-n-dodecylmerkaptid', 'Guld-sek.-butylmerkaptid-silver-tert.-dodecyltioglykolat', 'Guld-sek.-butylmerkaptid-silvernaftenat', '25', 'Guld-sek.-butylmerkaptid-hyarerats silverresinat', 'uld-tert.-butylmerkaptid-silverisooktyltioglykolat', 'tuld-tert.-butylmerkaptid-silver-l-mentylmerkaptid', 'uld-tert.-butylmerkaptid-silvernaftenat', 'Guld-tert.-butylmerkaptid-hydreratsilverresinat', '30', 'Guld-n-amylmerkaptid-silvernaftenat', 'Guld-isoamylmerkaptid-silvernaftenat', 'Guld-n-hexylmerkaptid-silvernaftenat', 'Guld-n-heptylmerkaptid-silvernaftenat', 'Guld-n-oktylmerkaptid-silvernaftenat', '35', 'ld-tert.-oktylmerkaptid-silverisooktyltioglykolat', 'ld-tert.-oktylmerkaptid-silvernaftenat', 'Guld-2-etylhexylmerkaptid-silvernaftenat', 'Guld-n-decylmerkaptid-silvernaftenat', 'Guld-n-dodecylmerkaptid-silvernaftenat', '40', 'Guld-tert-dodecylmerkaptid-silverisooktyltioglykolat', 'd-tert.-hexadecylmerkaptid-silvernaftenat']"
7,"['- 7 -', 'Guld-n-oktadecylmerkaptid-silvernaftenat', 'Guld-etyltioglykolat-silverisooktyltioglyke', 'Guld-isooktyltioglykolat-silvernaftenat', 'Guld-2-metoxietyl-tioglykolat-silverisooktyltioglykolat', '5', 'Guld-2-metoxietylmerkaptid-silvernaftena', 'Guld-4-etoxibutylmerkaptid-silvernaftena', 'Guldcyklohexylmerkaptid-silverstearat', 'Guldcyklohexylmerkaptid-silvernaftenat', 'Guldbensylmerkaptid-silvernaftenat', '10', '1d-0-metylbensylmerkaptid-silveretylmerkaptid', 'Guld-o-metylbensylmerkaptid-silverisopropylmerkaptid', 'Guld-o-metylbensylmerkaptid-silver-n-butylmerkaptid', 'Guld-o-metylbensylmerkaptid-silverisobutylmerkaptid', 'Guld-O-metylbensylmerkaptid-silver-sek.-butylmerka', '15', 'fuld-0-metylbensylmerkaptid-silver-tert.-butylmerkaptid', 'Guld-o-metylbensylmerkaptid-silver-2-etylhexylmerkaptid', 'd-metylbensylmerkaptid-silver-n-dodecylmerkaptio', 'Guld-8-metylbensylmerkaptid-silver-n-oktadecylmerkapti', 'uld-3-metylbensylmerkaptid-silveretyltioglykolat', '20', 'Guld-0-metylbensylmerkaptid-silverisooktyltioglykolat', 'Guld--metylbensylmerkaptid-silver-2-metoxietylmerkapti', 'Guld-0-metylbensylmerkaptid-silver-4-etoxibutylmerkapti', 'Guld-.-metylbensylmerkaptid-silvercyklohexylmerkaptid', 'Guld--metylbensylmerkaptid-silver-O-metylbensylmerkaptid', '25', '  Guld-ck-metylbensylmerkaptid-silver-2-fenyletylmerkaptid', ' Guld--metylbensylmerkaptid-silver-p-tert.-butylfenylmerkaptid', '-metylbensylmerkaptid-silverpinenmerkaptid', '-metylbensylmerkaptid-silver-l-mentylmerkaptid', 'd--metylbensylmerkaptid-silverbutyrat', '30', 'Guld-o-metylbensylmerkaptid-silver-10-undecenoat', 'Guld-d-metylbensylmerkaptid-silver-2-etylkapronat', 'Guld-d--metylbensylmerkaptid-silveroleat', 'GGuld-o-metylbensylmerkaptid-silver-p-tert.-butylber', '18-0-metylbensylmerkaptid-silverhydrocinnamat', '35', 'Guld--metylbensylmerkaptid-silverfenylacetat', 'Guld-o-metylbensylmerkaptid-silverdifenylacetat', 'tuld-X-metylbensylmerkaptid-silver-s-tert.-dodecyltioglykola', 'tuld-3--metylbensylmerkaptid-silvermetoxiacetat', 'Guld-O-metylbensylmerkaptid-silver-3-etoxibutyrat', '40', 'Guld-0-metylbensylmerkaptid-silverhexahydrobensoat', 'Guld-0-metylbensylmerkaptid-silverkamforat']"
8,"['- 8 -', 'Guld--metylbensylmerkaptid-silveretyIsuccinat', 'Guld-O-metylbensyimerkaptid-silvernaftenat', 'Guld-2-fenyletylmerkaptid-silvernaftenat', 'Blandade guldkresylmerkaptider-silverisooktyltioglykolat', '5', 'Blandade guldxylylmerkaptider-silverisooktyltioglykolat', 'Guld-p-tert.-butylfenylmerkaptid-silvernaftenat', 'Guld-p-nonylfenylmerkaptid-silvernaftena', 'd-p-tert.-butyl-o-metylfenylmerkaptid-silver-n-butyImerkaptid', 'Ld-p-tert.-butyl-o-metylfenylmerkaptid-silverisobutylmerkaptid', '10', ' Guld-p-tert.-butyl-o-metylfenylmerkaptid-silver-sek.-butylmerkaptid', '  Guld-p-tert.-butyl-o-metylfenyImerkaptid-silver-tert.-butylmerkaptid', 'Guldpinenmerkaptid-silveretylmerkaptid', 'Guldpinenmerkaptid-silvernaftenat', 'Guld-1-mentylmerkaptid-silvernaftenat', '15', 'Koordinationsföreningarna enligt uppfinningen brännes till metallfilmer', 'vid temperaturer, som ligger avsevärt lägre än de bränningstemperaturer, som', 'erfordras för att erhâlla metallfilmer med de tidigare kända blandningarna. Detta', 'innebär en stor fördel, emedan det härigenom blir möjligt att förgylla icke eld-', 'fasta underlag eller underlag med lag värmebeständighet, sãsom har nämnts ovan,', '20', 'exempelvis trä, papper, textilier, exempelvis av animaliska fibrer, sãsom ull, ve-', 'getabiliska fibrer, sãsom bomull, eller syntetfibrer, exempelvis polyesterfibrer,', 'eller blandningar av syntetfibrer och animaliska eller vegetabiliska fibrer, lä-', 'der och plaster och plastlaminat av den termoplastiska typen, vilka skulle kunna', 'skadas vid de högre temperaturer, som erfordras för de tidigare kända blandningar-', '25', 'na. Förmägan att bilda en metallfilm vid relativt làg temperatur innebär en av-', 'gjord fördel även vid relativt eldfasta material, där det kan vara önskvärt att', 'värma materialet till punkten för begynnande mjukning, som kan ligga mellan ca', '500°C för mjukt glas och upp till ca 800°C för keramis glasyr och ännu högre för', 'mer .eldfasta . material för att förbättra metallfilmens vidhäftning. Metallfilmen', '30', 'börjar att bildas i en oxiderande atmosfär, i vilken det organiska materialet av-', 'lägsnas snabbt och fullständigt frân filmen. Denna oxiderande. atmosfär âstadkom-', 'mes vanligen genom effektiv ventilation av den ugn, i vilken metallfilmen bildas.', 'Denna ventilation blir allt svarare och dyrbarare med höjning av temperaturen,', 'emedan värme gar förlorat med den för ventilation tillförda Luften. Sedan metall-', '35', 'filmen väl har bildats, kan fortsatt upphettning genomföras utan effektiv venti-', 'lation med atföljande värmeförluster.', 'Mânga av koordinationsföreningarna enligt föreliggande uppfinning medför', 'förutom den fördelen, att de brännes till metallfilmer vid lâg temperatur, som', 'ligger avsevärt lägre än den bränningstemperatur, som erfordras för tidigare kän-', '40', 'da medel, den fördelen, att de brännes till metallfilmer vid temperaturer, vilka', 'ligger avsevärt lägre än de temperaturery som erfordras för erhâllande av metall-']"
