PageNo,Text
10,"['10', 'Medan gas - eller vätskepumpen enligt uppfinningen har beskrivits med', 'hänvisning till ett speciellt utföringsexempel är det uppenbart att olika', 'modifikationer är tänkbara vid konstruktionen därav utan avsteg fron upp', 'finningstanken och uppfinningens ram. Silunda kan som exempel och ej', 'begränsande fackmonnen lätt lata de tvà gaserna och/eller vätskorna omkastas', 'inuti pumpen, d.v.s. lata den pumpande vätskan eller gasen passera genom', 'de centrala delarna av det flexibla rörformiga membranet 18 och den passiva', 'gasen eller vätskan mellan det flexibla membranet 18 och den inre ytan 28 av', 'höljet 12. Vidare kan höljet 12 konstrueras koniskt och ha inloppsöppningen', 'för den passiva gasen eller vätskan vid den bredare delen av konen, medon', 'utloppsöppningen kan placeras vid spetsen eller den smalare änden av konen.', 'Höljet 12 kan väsentligen vara av vilken form som helst, förutsatt att den', 'tilláter det flexibla membranet 18 att stoppa utströnmandet av pumpgasen', 'eller - vätskan genom utströmningsröret 26, när membranet 18 är utvidgat.', 'Uppmärksamheten fästes även pù att pumpen 10 tillsammans med en kylmedels-', 'reservoar och ett syreförräd kan inordnas i en kompakt enhet, som kan bäras', 'pa baksidan av rymddräkten. Pã liknande sätt kan dessa komponenter inordnas', 'som en enhet i en rymdfarkost som en del i det livuppehdllande systemet.', 'Därför maste uttryckligen framhillas, att föregdende beskrivning skall tolkas', 'enbart som en illustration av uppfinningen och att olika ändringar kan göras', 'utan att man avlägsnar sig fran uppfinningstanken, sûsom den definieras i', 'bifogade patentkrav.']"
11,"['/', '319085', 'PATENTKRAV', '1. Gas- eller vätskepump innefattande tvà separata ledningar, genom vilka gas eller', 'vätska kan passera huvudsakligen i samma riktning genom pumpen, ett flexibelt membran', '(18) bildande en avskiljande väggdel mellan ledningarna, varvid, när en första gas', 'eller vätska passerar i en riktning frän ett inloppsomräde (A) genom den första', 'ledningen till ett utloppsomrãde (B), en andra gas eller vätska passerar huvudsak-', 'ligen i samma riktning genom den andra ledningen, varvid den andra gasens eller', 'vätskans flöde i motsatt riktning är förhindrat, och varvid den andra gasen eller', 'vätskan kommer att drivas genom den andra ledningen medelst periodiskt uppträdande', 'tryckändringar i den första gasens eller vätskans flöde, vilka alstras genom att det', 'flexibla membranet (18) intermittent bildar en tätning i den första ledningen genom', 'att omväxlande komma i kontakt med och ur kontakt med en inre väggdel (28) i den', 'första ledningen, vilken väggdel är vänd mot membranet, k à n n e t e c k n a d', 'd', 'à r a v, att den tätningsbildande kontaktytan mellan membranet (18) och den inre', 'väggdelen (28) utsträcker sig: en förutbestämd längd i gasens eller vätskans rörelse-', 'riktning, varvid den förutbestämda längden är tillräcklig för att tillata tryck-', 'stegringen i inloppsomrädet (A) att gradvis öka volymen av inloppsomradet (A) mot', 'utloppsomrädet (B) over huvudsakligen hela den förutbestämda längden av kontakt-', 'ytan innan tätningen brytes vid det tillfälle inloppsomrädet (A) har expanderat', 'nämnda längd, därigenom astadkommande en periodiskt verkande pressning pa den andra', 'gasen eller vätskan medelst den utbuktning av membranet (18), vilken avgränsar in-', 'loppsomrädet (A), när utbuktningen förflyttar sig längs nämnda längd vid inlopps-', 'omradets (A) expansion.', '2. Gas- eller vätskepump enligt patentkravet 1, k à n n e t e c k n a d d à r a v,', 'att membranet (18) har formen av ett rör vars inre bildar den andra ledningen och', 'omges av en ihälig kropp (12), varvid utrymmet mellan membranet och kroppen bildar', 'den forsta ledningen.', '3. Gas- eller vätskepump enligt patentkravet 1 eller 2, k à n n e t e c k n a', 'd', 'd ai r a v, att en avsats (25) är anordnad pa den inre väggen av den iháliga kroppen', '(12) nära utloppsomrädet (B), vilken avsats är anordnad mellan en första väggdel', '(28) pa kroppen som definierar ett ledningsomräde genom vilket inloppsomrädet (A)', 'sträcker sig och en andra väggdel (27) pa kroppen som definierar utloppsomrädet', '(B), varvid avsatsen ästadkommer en ökning av kroppens tvärsnittsarea i riktning', 'fran ledningsomrädet genom vilket inloppsomrâdet utsträcker sig till utloppsomrâdet.', '4. Gas- eller vätskepump enligt patentkravet 2 eller 3, k ai n n e t e C k n a d d ai', 'r-', 'a v, att kroppen (12) är cylindrisk.']"
12,"['12', '5. Gas- eller vätskepump enligt nágot av föregaende patentkrav, k à n n e t e c k n a d', 'd', 'à r a V, att en envägsventil (20) är ansluten till den andra ledningens ena ände', 'och att en envägsventil (30) är ansluten till den andra ledningens andra ände, var-', 'vid ventilerna bestämmer flödets riktning.', 'ANFÖRDA PUBLIKATIONER:', 'USA 2 291 912 (103-44)']"
13,"['130', '131.', '40', 'C26', '10', '20', '16', '<-92-', '26', '-', 'I', '63', '14 24 f CP', '30)', '93', '31', '64', '29', 'f', '31', 'H', '92', '62', '60', '94', '100 91', '90', '50/', '90', '1', 'Flog2', '10', '03.5', '24', '26', '21 28', '12', '25', '27', '20a', '15', '18', '23', '206', '29)', 'B', '16', '14', '31', '14', '20', '16', '30', '28', '18', '.75', '18 27', '17', '30a', '30b']"
14,"['10', '24', '26', '21', '12', '28 25', '27', '31', '-A-', 'B', '16', '14', '20', '16', '30', '15 14', '28', '18', '25', '27', '23', 'Times', '24', '10', '26', '28', '25', '27', '21,', '12)', '29', '29,', '14.', '31,', '8', '214', '16', '20)', '30', '15', '18', '28', '27', '17', '25', '23']"
