PageNo,Text
1,"['UTLÄGGNINGSSKRIFT nr', '337 835', 'Int CI', 'F 25 b 33/00 Kl. 17 a 12', 'P.ans. nr', '15573/67', 'Inkom den', '14 XI 1967', 'Giltighetsdag den', '14 XI 1 967', 'PATENT- - OCH', 'Ans. allmänt tillgänglig den', '15 V 1969', 'REGISTRERINGSVERKET', 'Ans. utlagd och utläggnings-', 'skriften publicerad den', '23 VIII 1971', 'Prioritet ej begärd', 'AB ELECTROLUX, STOCKHOLM', 'Uppfinnare: W G Kögel', 'Ombud: F Lindström', 'Anordning vid en absorptionskylapparat, försedd med organ för alternativ drift', 'medelst elvärme eller gas- resp. fotogenbrännare', 'Den foreliggande uppfinningen hänför sig till en anordning vid en absorptions-', 'kylapparat, försedd med organ för alternativ drift medelst elvärme eller gas-', 'respektive fotogenbrännare. Det är tidigare känt att utbilda kokaraggregatet vid', 'en absorptionskylapparat med olika slag av värmekällor pã sãdant sätt, att kyl-', 'apparatens pump längs ett visst aysnitt är värmeledande förbunden med saväl en', 'hylsa för en elektrisk värmepatron som med en skorstenstub för gas- eller fotogen-', 'drift. De värmeledande förbindelserna med dessa organ medföra, att vid apparatens', 'drift med den ena värmekällan värme ledes över till organen för drift med den', 'andra värmekällan och även till hela skorstensröret, vilket medför att värmeför-', 'lusterna vid en apparat av detta slag bli avsevärt större än vid en apparat av', 'samma storlek men med endast en värmekälla.', 'Uppfinningen avser att nedbringa värmeförlusterna och därmed öka driftstiden', 'för kylapparater av ovan angivet slag, vilka tidvis drivas med ett medfört bränsle-', 'förräd av begränsad storlek och äro avsedda för kylskap eller kylboxar som användas', 'i transportmedel, t.ex. husvagnar, bâtar och flygplan.', 'Syftet med uppfinningen uppnas i huvudsak därigenom, att en värmeupptagande', 'och angutdrivande apparatdel i kokaraggregatet dels är försedd med elektrisk upp-', 'värmning, dels är värmeledande förbunden med ett frän en genom aggregatets isole-', 'ring gãende skorsten termiskt isolerat, men in i denna sig sträckande, värmeöver-', 'förande organ för värmeupptagning fran brännargaserna, sã att vid eldrift värme-', 'Dupl. kl. 17 a:8/02; 17 a:10']"
2,"['337835', 'överföringen till organ utöver de vid eldriften verksamma delarna av apparaten', 'begränsas till högst nämnda värmeöverförande organ.', 'Uppfinningen skall i det följande beskrivas närmare under hänvisning till tvã', 'sãsom exempel valda, pã ritningarna schematiskt visade utföringsformer. Härvid', 'komma även andra egenskaper hos uppfinningen att framga. Fig. 1 visar ett avsnitt', 'av kokaraggregatet till en absorptionskylapparat. Fig. 2 visar samma delar i en', 'horisontell sektion längs linjen II-II i fig. 1. Fig. 3 visar ett kokaraggregat', 'för alternativ drift med värmetillförsel till sâväl pump som kokare vid aggregatet.', 'Fig. 4 visar en horisontell sektion längs linjen IV-IV i fig. 3.', 'Figurerna visa anordningar vid en absorptionskylapparat, vilken kan vara ut-', 'bildad för att arbeta med ammoniak sãsom kylmedium, vatten sãsom absorptionsmedium', 'och vätgas sâsom indifferent gas. Även andra arbetsmedia kunna emellertid förekomma.', 'Endast de närmast aktuella detaljerna av apparaten visas, eftersom apparaten i öv-', 'rigt kan vara utförd pã i och för sig känt sätt. I fig. 1 och 2 visas sãledes ett', 'rör 10, som fungerar som vätskecirkulationspump med termosifonverkan, sã att kyl-', 'medieanga, som utdrives i pumpen tillsammans med absorptionslösning, uppfordras', 'genom ett stigrör 11. Pumpen 10, 11 ingär i en absorptionskylapparat, avsedd för', 'drift med en icke visad brännare för gas eller fotogen, vars heta gaser strömma', 'genom en skorsten 12, utförd av värmeisolerande material, sãsom steatit, keramik', 'eller asbestcement. De heta gasernas värmeinnehäll överföres till pumpröret 10,', '11 genom ett metalliskt värmeledande organ bestäende av en genom en slits 13 i', 'skorstensröret inskjuten vinge 14. Vid en dylik skorsten fão avgaserna som lämna', 'skorstenen en hög temperatur. Gasernas temperatur kan emellertid sänkas genom att', 'den del av skorstensröret som skjuter upp ur kokarisoleringen pã i och för sig', 'tidigare känt sätt förses med nagra hâl, vari kalluft insuges för att blandas med', 'gaserna.', 'Anordningen enligt fig. 1 och 2 är avsedd för drift alternativt med elektri-', 'citet eller med en brännare för gas eller fotogen. Vingen 14 inne i skorstenen', 'skjuter ut genom slitsen 13 till en linje utanför skorstenen, där vingen 14 är', 'värmeledande förbunden med apparatens pump 10, 11, exempelvis genom lödning. Vid', 'sidan om lödstället 15 mellan pumpen 10 och vingen 14 är en hylsa 16 av värme-', 'ledande material anordnad och värmeledande förbunden med pumpen 10, exempelvis', 'medelst lödning 17. Pumpröret 10, 11 stär sâlunda i värmeledande kontakt med sã-', 'väl hylsan 16 för en elektrisk värmepatron som med vingen 14, vilken kan vara ut-', 'förd av exempelvis rostfri plât. Pumpröret 10 kan lämpligen vara elektriskt', 'svetsat mot hylsan 16, medan vingen 14 kan vara värmeledande förbunden med pumpen', '10 genom silverlödning. Vid drift med brännare koncentreras den tillförda effekten', 'till den i skorstenen 12 genom slitsen 13 inskjutna delen av vingen 14 och icke', 'som vid tidigare kända konstruktioner längs hela skorstenens inre yta. Vid elek-', 'trisk drift däremot förefinnes ingen värmeledande kontakt mellan hylsan 16 och', 'skorstenen 12, vilket är mycket betydelsefullt, eftersom utsträlningsförlusterna']"
3,"['337835', 'frän kokaraggregatet härigenom kunna nedbringas väsentligt.', 'I den i samband med fig. 1 och 2 beskrivna anordningen ha de för absorptions-', 'kylapparatens funktion erforderliga mängderna ammoniakanga genererats enbart i', 'apparatens termosifonpump. För kylskäp av mindre storlekar och sãdana som ha mindre', 'än ca. 150 liters förvaringsrum är den mängd anga som utdrives frân termosifon-', 'pumpen fullt tillräcklig för erhällande av önskade prestanda i kylskapet. Helt', 'annat blir emellertid förhällandet för kylskap med större volymer. De i enbart en', 'pump genererade angmängderna räcka da icke till för att förse absorptionskylappa-', 'ratens evaporator med för erhällande av acceptabla temperaturer i kylskapet till-', 'räcklig mängd kylmedium. Genom att en värmeledande förbindelse anordnas även med', 'aggregatets ständrör, kan en ökning av mängden evaporatorn tillfört kylmedium', 'astadkommas. En anordning utförd pã i princip sãdant sätt och i enlighet med upp-', 'finningen visas i fig. 3 och 4.', 'Genom ytterledningen 18 till en vätsketemperaturväxlare 19 tillföres rik ab-', 'sorptionslösning frän apparatens icke visade absorbatorkärl till en pump 20 med', 'ett', 'stigrör 21, som mynnar in upptill i ett ständrör 22. Pumpröret 20 är värme-', 'ledande förbundet med en rostfri plât 23 samt med en hylsa 24 för en elektrisk', 'värmepatron. Den rostfria plâten 23 sträcker sig rakt igenom en skorsten 25, lämp-', 'ligen av värmeisolerande material, vilken är försedd med tva slitsar 26, 27. Pã', 'andra sidan om skorstenen 25 frän pumpröret 20 räknat är plâten 23 värmeledande', 'förbunden även med ständröret 22. Medelst en elektrisk värmekälla, placerad i', 'hylsan 24, eller medelst en gas- eller fotogenbrännare, placerad under skorstenen', '25, kan sãledes kylmedieanga utdrivas bâde ur den rika lösningen i pumpröret 20,', '21 och ur ständröret 22, som även utgör kokare, sã att erforderliga ängmängder', 'erhâllas, samtidigt som fattig absorptionslösning uppfordras i stigröret 21 till', 'en sã hög niva, att lösningen självrinner genom en innerledning 28 i vätsketempe-', 'raturväxlaren 19 till den icke visade absorbatorns tillförselställe för fattig', 'absorptionslösning. Den fattiga lösningen strömmar genom absorbatorn, där kyl-', 'medieanga absorberas, varefter lösningen aterföres till absorbatorkärlet, vari-', 'frän den genom vätsketemperaturväxlarens 19 ytterledning 18 aterföres till pumpen', '20.', 'De i pumpen 20, 21 och standröret 22 genom värmetillförsel frân den ena eller', 'den andra värmekällan genererade angorna ledas frân stândrörets 22 angrum genom en', 'ängledning 29 nedât till en väsentligen horisontell del 30 av vätsketemperatur-', 'växlaren, där angorna i motström fã bubbla igenom den frän absorbatorkärlet kom-', 'mande, pã kylmedium rika lösningen, varigenom en viss analysering äger rum, innan', 'kylmedieângan vid en lämpligare temperatur än i ledningen 29 genom en angledning', '31 ledes upp till apparatens icke visade kondensor.', 'Det är tidigare bekant, att vid kylapparater av här aktuellt slag känslig-', 'heten för värmefördelningen mellan pumpen ão ena sidan och kokaren respektive ett', 'ständrör à andra sidan är utomordentligt stor. Med beaktande härav är den värme-']"
4,"['4', 'ledande förbindelsen i fig. 3 och 4 sã utförd, att värmeströmmen frän värmekällan', 'till ständröret 22 är väsentligt mindre än rärmeströmmen till vätskecirkulations-', 'pumpen 20, 21. Detta har väsentligen astadkommits pã sã sätt, att den del av den', 'rostiria pläten 23 som är värmeledande förbunden med ständröret 22, är kortare än', 'den del av pläten som är förbunden med pumpröret 20, 21. Pumpröret 20 är lämpligen', 'silverlött vid plâten 23 frän en punkt 32 upp till en punkt 33, medan ständröret', '22 lämpligen genom silverlödning är värmeledande förbundet med pläten 23 frän en', 'punkt 34, belägen i jämnhöjd med den översta värmeledande förbindelsen vid punkten', '33 med pumpen och ned till en punkt 35 ungefär mitt emellan de bâda gränserna för', 'pumpens värmeledande förbindelse. Genom att längden av plâten 23 vid sidan av', 'ständröret och den värmeledande förbindelsen mellan de bâda delarna ökas eller', 'minskas, kan pa ett enkelt sätt vätskecirkulationen i apparaten regleras. En ökning', 'av den värmeledande kontakten mellan ständröret 22 och plâten 23 nedât minskar', 'vätskecirkulationen i apparaten, medan däremot en minskning av den värmeledande', 'kontaktens längd ökar den cirkulerande mängden.', 'De tvã slitsarna 26, 27 i skorstenen 25 av värmeisolerande material sträcka', 'sig fran skorstenens underkant och upp till plâtens 23 översta punkt. Därigenom är', 'det möjligt att vid montering av aggregatet med värmeisolering m.m. skjuta den', 'lösa skorstenen 25 uppifrän över plâtens 23 frän de värmeledande förbindelserna', 'fria del mellan ständröret 22 och pumpen 20.', 'De i det föregäende beskrivna anordningarna för att förbättra kylapparatens', 'verkningsgrad och möjliggöra standardisering av konstruktionen för drift med', 'elektricitet respektive gas eller fotogen som värmekälla utgöra blott exempel pã', 'uppfinningens tillämpning, vilken mã kunna varieras inom ramen för den till grund', 'liggande uppfinningstanken.', ' Patentkrav', '1.', 'Anordning vid en absorptionskylapparat, försedd med organ för alternativ drift', 'medelst elvärme eller gas- respektive fotogenbrännare, k ä n n e t e c k n a d', 'därav, att en värmeupptagande och ängutdrivande apparatdel (10) i kokaraggregatet', 'dels är försedd med elektrisk uppvärmning, dels är värmeledande förbunden med ett', 'frân en genom aggregatets isolering gande skorsten (12) termiskt isolerat, men', 'in i denna sig sträckande, värmeöverförande organ (14) för värmeupptagning frän', 'brännargaserna, sã att vid eldrift värmeöverföringen till organ utöver de vid el-', 'driften verksamma delarna (16, 10) av apparaten begränsas till högst nämnda värme-', 'överförande organ (14).', '2.', 'Anordning enligt patentkravet 1,kännetecknad därav, att', 'skorstenen (12) har en slits (13) för det värmeöverförande organet (14) och kan', 'skjutas till sitt läge i apparaten med det värmeöverförande organets värmeupp-', 'tagande delar (14) belägna inne i skorstenen (12).']"
5,"['337835', '3.', ""Anordning enligt patentkravet'1, kännetecknad därav, att"", 'skorstenen (25) har tvã slitsar (26, 27) för det värmeöverförande organet (23),', 'som sträcker sig genom skorstenen (25) och ut till värmeledande förbindelser med', 'tvã angutdrivande organ (20, 22) utanför skorstenen (25), nämligen med tvá', 'pumpar eller med en pump (20) och en kokare (22).', '4.', 'Anordning enligt patentkravet 2 eller 3, k ä n n e t e c k n a d därav,', 'att slitsen (13) respektive slitsarna (26, 27) i skorstensröret (12; 25) sträcker', 'sig förbi det värmeöverförande omrädet och till rörets ena ände.', '5. Anordning enligt nâgot av patentkraven 1 - 4, k ä n n e t e c k n a d där-', 'av, att skorstenen (12; 25) är utförd av värmeisolerande material.', 'time', '6. Anordning enligt patentkravet 1, k ä n n. e t e c k n a d därav, att det', 'värmeöverförande organet (14; 23) är permanent eller löstagbart värmeledande', 'förbundet med den eller de ängutdrivande apparatdelarna (10; 20, 22), exempelvis', 'fastklämt.', '7.', 'Anordning enligt nâgat av patentkraven 1 - 6, k ä n n e t e c k n a d där-', 'av, att apparatens pump (10; 20) har samma reaktionshöjd vid drift med den ena', 'som vid drift med den andra värmekällan, dvs. pumpens värmeledande förbindelser', 'äro anordnade inom samma höjdavsnitt.', '8. Anordning enligt patentkravet 3, k ä n n e t e c k n a d därav, att den', 'värmeledande förbindelsen (34-35) mellan det värmeöverförande organet (23) och', 'apparatens kokare (22) i skorstenens längdriktning är kortare än motsvarande', 'förbindelse (33-32) med pumpen (20).', '9.', 'Anordning enligt patentkravet 3 eller 8, k ä n n e t e c k n a d därav,', 'att apparaten är utrustad för tillförsel av elvärme pã skorstenens (25) pumpsida,', 'varvid värme tillföres kokaren (22) under förmedling av det rärmeöverförande,', 'rakt genom skorstenen (25) sig sträckande, för brännardrift avsedda organet (23).', 'ANFÖRDA PUBLIKATIONER:', 'Sverige 151 315 (17 a:12)', 'Frankrike 1 490 000', 'USA 3 080 729 (62-497), 3 177 677 (62-236)']"
6,"['12', '11', 'Y', '1', 'II', 'II', '16', 'L.', '10', 'Fig1', '15 13', '16-', '/2', '14', '17', '10', 'Fig.2']"
7,"['Fig.3', '21', '22', '29', '25', '3)', '33', '34', 'IV t', 'IV', '1', '23', '19', '28', '30', '24', '35', '18', '32', '20', 'Fig.4', 'E', '30', '31', '0', '29', '20', '22', '23', '27', '24', '25', '26']"
