PageNo,Text
1,"['UTLÄGGNINGSSKRIFT nr', '339 271', 'Int CI H 01 m 27/12 Kl. 21 k9 27/12', 'P.ans. nr', '1329/67', 'Inkom den', '30 I 1967', 'Giltighetsdag den', '30 I 1967', 'PATENT-OCH', 'Ans. allmänt tillgänglig den', '1 VII 1968', 'REGISTRERINGSVERKET', 'I', 'Ans. utlagd och utläggnings-', 'skriften publicerad den', '4 x 1971', 'Prioritet', 'styrkt frân den 1 II 1966', '(USA, 524 275)', 'UNITED AIRCRAFT CORPORATION, EAST HARTFORD, CONN. USA', 'Uppfinnare: R G Huebscher och T H Hacha', 'Ombud: S Penderud', 'Anordning för reglering av bortledningen av värme och vatten frân en väte-syre-', '-bränslecell', 'Uppfinningen hänför sig till en anordning för reglering av bort-', 'ledningen av värme och vatten frän en väte-syre-bränslecell, som', 'har en vätekammare, genom vilken vätgas cirkuleras frän ett inlopp', 'till ett utlopp längs efter en sâsom begränsningsvägg anordnad', 'väteelektrod, en kylplatta, som bildar en vägg i vätekammaren, en', 'vätekrets med en pump för vätecirkulationen och en kylkrets för', 'kylplattan, som är anordnad att arbeta i beroende av kylplattans', 'temperatur och innefattar en cirkulationspump för ett kylmedel.', 'Uppfinningens huvudkännetecker bestär i att i vätekretsen är', 'anordnad en kondensor, som är uppdelad i tvã kammare av en porös,', 'för vatten genomtränglig skiva, varvid anordningar förefinnas', 'för att leda med vattenanga bemängd vätgas frän vätekammarens', 'utlopp till den ena av nämnda kamrar och tillbaka till vätekam-', 'marens inlopp och varvid kylkretsen är sã anordnad, att kylmed-', 'let ledes frän kylplattan genom en kylare och därefter genom en', 'värmeväxlingsanordning i värmeväxlande kontakt med den andra', 'kammaren i kondensorn och att den porösa skivan har sãdan', 'e']"
2,"['2', 'porositet, att kondenserat vatten under inverkan av gastrycket i', 'den ena kammaren', 'strömmar genom skivan, under det att väte-', 'strömning genom skivan förhindras av vattnets ytspänning, varjämte', 'i den andra kammaren', 'finns en anordning för avlägsnande av', 'vattnet.', 'Anordningen enligt uppfinningen gör det möjligt att halla elektro-', 'lytvolymen i bränslecellen inom snäva gränser, sã att cellen hind-', 'ras frän att torka eller flöda över med âtföljande försämring av', 'dess elektriska prestanda. Flödning av cellen kan resultera i för-', 'lust av elektrolyt frän batteriet till yttre avlopp, och torkning', 'kan medföra inre blandning av vätgas och syrgas, vilket i närvaro', 'av elektroderna kan resultera i sönderbränning av cellen.', 'Uppfinningen skall i det följande närmare förklaras i anslutning', 'till ett à bifogade ritning visat schema över en enligt uppfinning-', 'en utförd anordning.', 'Uppfinningen är avsedd för en väte-syre-bränslecell, i vilken vät-', 'gas och syrgas förena sig till bildande av vatten och härvid alstra', 'användbar elektricitet. Cellen kan vara av ""bacontyp"", som arbetar', 'med porösa nickelelektroder och med innesluten elektrolyt. Elektro-', 'lyten ár anbragt mellan de tva elektroderna och cirkuleras icke ge-', 'nom cellen.', 'Pã ritningen visas en väte-syre-bränslecell med innesluten elektro-', 'lyt 2 mellan elektroder 4 och 6. Väteelektroden 4 är anordnad mel-', 'lan elektrolyten och en vätekammare 8, till vilken vätgas tillföres', 'genom ett inlopp 10. Syreelektroden 6 är anordnad mellan elektro-', 'lyten och en kammare 12, till vilken syrgas tillföres under tryck', 'genom ett inlopp 14. Överskott av syre avgar genom ett utlopp 16,', 'och överskott av väte och vattenanga avgär genom ett utlopp 18.', 'Cellen är anordnad i ett hus 20, som kan vara av isolerande mate-', 'rial, sã att elektroderna äro isolerade frân varandra och elektrisk', 'ström tillföres ledningar 22. I huset och intill vätekammarens 8', 'vägg är anbragt en kylplatta 24, medelst vilken värme avlägsnas', 'frän cellen. Denna platta har en kylkanal 26, som är inkopplad i']"
3,"['3', 'en tillsatskylkrets 28, i vilken ingär en blandningsventil 30 och', 'en cirkulationspump 32, vilken sistnämnda pumpar kylmedlet genom', 'kretsen. Pumpen drives företrädesvis med konstant varvtal av en', 'motor 34, da cellen är i drift.', 'Till kylkretsen eller ledningen 28 är ansluten en huvudkylkrets 36,', 'som är kopplad till kretsen 28 vid en punkt 38 nedströms om utlop-', 'pet för kylmedlet frän cellen (strömningsriktningen antydd medelst', 'pilen 40). Frân anslutningen 38 strömmar kylmedlet genom kretsen', '36 i pilens 42 riktning till en kylare 44 och därifrän via en', 'blandningsventil 46 genom en slinga 48, som är förbunden med en', 'kondensor 50, samt vidare till blandningsventilen 30. Denna sist-', 'nämnda ventil är temperaturberoende och inrättad att styras av en', 'temperaturavkännare 52, som företrädesvis är anordnad intill kyl-', 'plattan 24. Den avkända temperaturen paverkar via en temperatur-', 'regleranordning 54 en manöveranordning 56 för ventilen, som härvid', 'omställes för att reglera den kylmedelmängd, som tillföres kylkret-', 'sen 28 frän huvudkylkretsen, varvid det hela är sã inrättat, att en', 'konstant temperatur upprätthälles vid emperaturavkännaren 52 genom', 'ökning av tillförseln frän kretsen 36, om kylmedeltemperaturen bör-', 'jar öka. Det frän kretsen 36 genom ventilen 30 passerande kylmedlet', 'är kallare än kylmedlet i tillsatskylkretser 28, sãsom kommer att', 'framga i det följande.', 'Kondensorn 50 är av den typ, vid vilken en porös skiva 58 bildar', 'skiljevägg mellan tvã kammare 60 o-ch 62. Kammaren 60, som bildas', 'av en flänsförsedd platta 61, är fylld med vatten och kyles medelst', 'slingan 48. Till kammaren 62 tillföres vätgas och vattenanga frän', 'bränslecellen genom kretsen 64 frän vätgasutloppet 18, och frän kon-', 'densorn passerar vätgasen till en punkt 66 och därifran till vätgas-', 'inloppet 10. Ersättningsvätgas tillföres till kretsen intill utlop-', 'pet 18 genom en tilloppsledning 68.', 'Den porösa skivan 58 hâlles kall av vattnet i kammaren 60 och genom', 'kontakten med flänsarna pa plattan 61. Pã skivans 58 mot kammaren', '62 vända yta kondenseras vattnet i den av vätgas och vattenanga be-', 'stande atmosfären i nämnda kammare. Gastrycket i kammaren 62', 'tvingar vattnet genom skivan, allteftersom det bildas, men vattnets']"
4,"['PRU070971', '4', 'ytspänning hindrar gas frän att passera genom skivan. Det konden-', 'serade vattnet avgär genom en avlastningsventil 70 till en behâllare', '72. Ventilen 70 är inställd för att i kammaren 60 upprätthälla ett', 'tryck, som medger vatten att strömma genom den porösa skivan men', 'hindrar gasströmning genom densamma. Detta uppnãs även vid tyngd-', 'löst tillständ, eftersom det kondenserade vattnet ständigt täcker', 'skivans yta och tvingas genom skivan av gastryck.', 'Den porösa skivans temperatur hâlles konstant medelst en pã skivan', 'anbragt temperaturavkännare 74, som överför en temperatursignal till', 'en regleranordning 76, som i sin tur styr en manöveranordning 78 för', 'ventilen 46. Denna ventil blandar kylt kylmedel frän kylaren med', 'icke kylt kylmedel, som passerar förbi kylaren genom en förbigangs-', 'ledning 80, sã att skivan 58 hâlles vid väsentligen konstant tem-', 'peratur. Om skivtemperaturen vid punkten 74 ökar, kommer ventilen', '46 att omställas för att öka andelen av kylmedel frän kylaren, var-', 'igenom kylmedeltemperaturen i kammaren 60 och därmed skivans tem-', 'peratur sänkes.', 'Under drift regleras trycken hos det till cellen tillförda vätet', 'och syret pa känt sätt. Da motorn 34 arbetar, pressas vätgas in i', 'kammaren 8 och strömmar genom denna i samma riktning som kylmedlet', 'i plattan 24. En del av det väte och syre, som strömmar genom', 'elektrodernas porer, alstrar elektrisk ström, vilket ger en ökad', 'temperatur hos cellen, till dess att dess arbetstemperatur uppnitts.', 'Man kan antaga, att inloppstrycket för vätgasen och syrgasen är', 'ungefär 4,5 kg/cm² och att cellens normala arbetstemperatur är ca', '83°c. Pã grund av den stora värmeöverföringsytan och det laga ter-', 'miska motständet mellan kylmedlet i kanalen 26, plattan 24, elektro-', 'den 4 och elektrolyten 2 kommer kylmedlet och elektrolyten att ha i', 'huvudsak samma temperatur. Om det inträdande kylmedlet har en tem-', 'peratur av ca 47°C, kommer pa grund av ovanstäende elektrolytens', 'temperatur vid cellens inloppsände att uppga till nära 77°C. Man', 'kan vidare antaga, att lättningstemperaturen hos den blandning av', 'vätgas och vattenanga, som avgär frän kondensorn och tillföres cel-', 'len, är ca 65°C. Denna kombination av elektrolyttemperatur och']"
5,"['5', 'mättningstemperatur ger en given koncentration och volym hos elek-', 'trolyten. Dã kylmedlet passerar genom cellen, upptager det värme', 'och kan lämna cellen med en temperatur av ungefär 90°C. Sâlunda', 'kommer Lektrolyttemperaturen vid cellens utloppsände att ligga', 'nära 90°c. Om förhällandet mellan vätgasmängd och kylmedelmängd', 'är korrekt avvägt i konstruktionen, kommer ängtrycket hos vattnet', 'i vätgasströmmen vid cellens utlopp att ha en nättningstemperatur', 'av ungefär 79°C. Eftersom kylmedlet och vätgasen strömma i samma', 'riktning, kommer skillnaden mellan kylmedlets temperatur och vät-', 'gasens mättningstemperatur att bli väsentligen konstant och ge en', 'konstant koncentration och :volym hos elektrolyten liksom även en', 'konstant avgang av vatten frän cellens inloppsände till dess ut-', 'loppsände.', 'Kondensorn, som mottager vätgas och vattenanga vid en mättnings-', 'temperatur av ungefär 79°C, fäller ut vattenangan och kyler vät-', 'gasen till en mättningstemperatur av ungefär 65°C. Tryckfallet', 'i', 'vätekretsen 64 kompenseras medelst pumpen 66.', 'En ;del a.v det frän cellen avgaende kylmedlet passerar genom kyla-', 'ren 44, som sänker temperaturen till ungefär rumstemperatur, dvs', 'ungefär 20°C, under det att en annan del av kylmedlet passerar ge-', 'nom tillsatskylkretsen 28 i pilens 81 riktning, och resten av kyl-', 'medlet gar genom förbigangsledningen 80 förbi kylaren i beroende av', 'ventilernas 30 och 45 inställning, sã att inloppstemperaturen hos', 'det till kondensorn tillförda kylmedlet är omkring 49°C. Det frän', 'kondensorn avgaende kylmedlet kan ha en temperatur av ungefär 63°C', 'och blandas med kylmedlet i kretsen 28 vid ventilen 30, sã att det', 'till kylplattan tillförda kylmedlet pa nytt far en temperatur av', 'ungefär 77°C.', 'De ovan lämnade temperaturvärdena äro endast att betrakta sãsom', 'exempel, eftersom bränsleceller kunna vara inrättade att arbeta', 'med högre eller lägre tryck eller högre eller lägre temperaturer,', 'varvid temperaturerna och trycken i systemet fã anpassas i överens-', 'stämmelse därmed. Temperaturavkännarna äro allmänt kända och till-', 'gängliga pã marknaden liksom även regleranordningarna och bland-', 'ningsventilerna och ventilernas manöveranordningar.']"
6,"['6', 'Dã vätgasen passerar genom cellen; kommer den att upptaga vatten-', 'anga i proportion till temperaturstegringen i elektrolyten, vilket', 'ger sig till känna genom en temperaturökning hos kylmedlet.', 'Vätekretsen fungerar sãlunda i första hand för upptagning av vatten-', 'anga frän cellen och avgivning av denna anga till kondensorn och ut-', 'nyttjas sãlunda icke i första hand för att upprätthälla celltempera-', 'turen. Kylkretsen är oberoende av vätekretsen, varför man kan an-', 'vända ett mera effektivt kylmedel än vätgas, och vid lämplig av-', 'passning av kylmedelflödet erhälles en mycket effektiv bortledning', 'av värme frän cellen. Vid systemet bortfaller behovet av en cir-', 'kulerande elektrolyt.', 'Anordningen enligt uppfinningen har förmaga att halla elektrolyt-', 'volymen konstant vid ändringar i bränslecellens elektriska belast-', 'ning. Vid belastningsökning ökas temperaturen hos det frän cellen', 'avgäende kylmedlet och mättningstemperaturen hos det frän cellen', 'avgaende vätet med samma belopp. Skillnaden mellan dessa tempera-', 'turvärden förblir sãlunda oförändrad, och följaktligen blir elektro-', 'lytens volym konstant.', 'Uppfinningen är icke begränsad till den ovan beskrivna och pã rit-', 'ningen visade utföringsformen utan kan till sina detaljer modifieras', 'inom ramen för efterföljande patentkrav.', 'PATENTKRAV', '1.', 'Anordning för reglering av bortledningen av värme och vatten', 'frän en väte-syre-bränslecell, som har en vätekammare, genom vil-', 'ken vätgas cirkuleras frän ett inlopp till ett utlopp längs efter', 'en sãsom begränsningsvägg anordnad väteelektrod, en kylplatta, som', 'bildar en vägg i vätekammaren, en vätekrets med en pump för väte-', 'cirkulationen och en kylkrets för kylplattan, som är anordnad att', 'arbeta i beroende av kylplattans temperatur och innefattar en cirku-', 'lationspump för ett kylmedel, k ä n n e t e c k n a d av att i', 'vätekretsen är anordnad en kondensor (50), som är uppdelad i tva']"
7,"['7', 'kammare (60, 62) av en porös, för vatten genomtränglig skiva (58),', 'varvid anordningar förefinnas för att leda med vattenanga bemängd', 'vätgas frän vätekammarens (8) utlopp till den ena (62) av nämnda', 'kamrar och tillbaka till vätekammarens (8) inlopp och varvid kyl-', 'kretsen är sã anordnad, att kylmedlet ledes frän kylplattan (24)', 'genom en kylare (44) och därefter genom en värmeväxlingsanordning', 'i värmeväxlande kontakt med den andra kammaren (60) i kondensorn', 'och att den porösa skivan har sâdan porositet, att kondenserat vat-', 'ten under inverkan av gastrycket i den ena kammaren (62) strömmar', 'genom skivan, under det att väteströmning genom skivan förhindras', 'av vattnets ytspänning, varjämte i den andra kammaren (60) finns en', 'anordning för avlägsnande av vattnet.', '2.', 'Reglersystem enligt krav 1, k ä n n e t e C k n a t av att', 'i', 'kylkretsen ingär en i kylplattan (24) anordnad kylkanal (26) och en', 'mellan kondensorn (50) och kylkanalens (26) inlopp anbragt bland-', 'ningsventil (30), varjämte finns en andra kylkrets, som är inrättad', 'att tillföra kylmedel direkt frän kylkanalen (26) till blandnings-', 'ventilen (30), utan att kylmedlet passerar genom kylaren (44) och', 'kondensorn (50).', '3.', 'Reglersystem enligt krav 1 och 2, k ä n n e t e C k in a t av', 'att i kylkanalen (26) är anbragt en temperaturavkännare (52) för en', 'temperaturregleranordning (54), som är inrättad att pâverka en ma-', 'növeranordning (56) för blandningsventilen (30) för upprätthällande', 'av önskad temperatur i kylkanalen (26).', '4.', 'Reglersystem enligt krav 1, 2 och 3, k ä n n e t e C k n a', 't', 'av att kylaren (44) har en förbigängsledning (80), som är inrättad', 'att regleras av en ventil (46), som är inrättad att paverkas medelst', 'en manöveranordning (78), vilken är styrd av en med den porösa ski-', 'van (58) förbunden temperaturavkännare (74).', 'ANFÖRDA PUBLIKATIONER:', 'Sverige 314 724 (21 b:14/01), 331 141 (21 -9.27/02)', 'Frankrike 1 412 619', 'Tyskland Utläggningshkriften 1 067 490 (21 b:14/01)', 'Andra publikationer:', 'Industrial and engineering chemistry 52(1960):4, p. 301-303.']"
8,"['T3638', 'Hz', 'for', 'T40', '18', '22', '7', '1', 'Oz', '26', '20', '14', '64', '28', '242', '6', '8', '52-', 'O2', '4', '12', 'ta', 'f81', '10', '-HZ/HZO', '66', '34', '56', 'A', 'AB', '32', '50', 'B,', '14', '62. 58', '30', '-42', '36)', '-61', 'HZO', '48', '70', '-76', '12-D', '80', '44', '/', '46', 'B', 'AB', 'A 78']"
