PageNo,Text
1,"['UTLÄGGNINGSSKRIFT nr', '332 798', 'Int', 'CI D 04 h 11/00 Kl. 8 h 7', 'P.ans. nr', '15884/69', 'Inkom den', '19 XI 1969', 'Giltighetsdag den', '19 XI 1969', 'PATENT- - OCH', 'Ans. allmänt tillgänglig den 22 II 1971', 'REGISTRERINGSVERKET', 'Ans. utlagd och utläggnings-', 'skriften publicerad den', '22 II 1971', 'Prioritet ej begärd', 'THE DOW CHEMICAL COMPANY, MIDLAND, MICH. USA', 'Uppfinnare: R M Ngo, Newport News och W G Kirkman och C E Lowry, Williamsburg, Va.', 'Ombud: N Larfeldt', 'Textilmaterial med lugg', 'Föreliggande uppfinning avser textilmaterial med lugg och', 'en metod att göra sãdana textilmaterial eldskyddade och resistenta', 'mot statisk laddning.', 'Textilmaterial med lugg av antändbara naturliga fibrer', '5', 'sãsom bomull är av gammalt ursprung och har använts i manga ar som', 'mattor. Pã sista tiden har syntetiska polymera fibrer, som ocksà', 'är antändbara, sãsom cellulosafibrer, akrylfibrer, polyesterfibrer,', 'nylonfibrer och polypropenfibrer, fätt ökad användning som material', 'för tillverkning av textilmaterial med lugg.', '10', 'Försök att göra textilmaterial med lugg mindre antändbara', 'eller självslocknande har endast fätt begränsad framgang. Fastän', 'behandling med kända eldskyddsmedel minskar antändbarheten,uppvisar', 'det behandlade textilmaterialet ofta vissa ej önskvärda egenskaper', 'sãsom sämre känsel eller minskad mjukhet. Vidare medför sâdan be-', '15', 'handling ytterligare framställningssteg, vilket höjer kostnaderna', 'för framställning av textilmaterialet. Dessutom avlägsnas ofta', 'dessa eldskyddsmedel frän textilmaterialet med lugg med tiden genom', 'successiv tvättning eller shamponering.', 'Vad beträffar polymera meterial, har brom-haltiga mono-', '20', 'merer införts i polymerstrukturen under framställningen av poly-', 'meren för att de textilfibrer som framställes av dessa polymerer', 'Dupl.kl. 8 h:8']"
2,"['332798', 'skall bli självslocknande. Under det att derna metod mött varie-', 'rande grader av framgang, är fibrerna av dessa polymerer i allmän-', 'het dyrare än deras bromfria motsvarigheter. Ytterligare en annan', 'metod att göra textilmaterial med lugg eldskyddade är att belägga', '5', 'bäraren för textilmaterialet med lugg med ett eldskyddande material', 'eller att använda cellulosaacetat.', 'Ett annat problem som uppstär med textilmaterial med lugg', 'är bildandet av statisk elektricitet, da en person gar över en', 'matta av ett sãdant textilmaterial. Under vissa omständigheter och', '10', 'speciellt under förhällanden med lâg fuktighet kan den statiska', 'elektriska laddningen hos personen byggas upp till en sádan grad', 'att kontakten med en jordad kropp orsakar en obehaglig chock. Denna', 'ej önskade egenskap hos textilmaterial med lugg av polymera material', 'har fördröjt en vidare användning därav som mattor.', '15', 'Föreliggande uppfinning avser ett textilmaterial med lugg', 'bestäende av ett bärarmeterial och luggbildande öglor, som är', 'fästade vid denna bärare, varvid de luggbildande öglorna inne-', 'häller en trad av metalliskt laminat bestäende av ett självupp-', 'bärande metallskikt och ett polymert skikt, som är bundet till', '20', 'metallskiktet, varigenom textilmaterialet med lugg fär antistatiska', 'och eldskyddade egenskaper.', 'Uppfinningen askädliggöres genom bifogade ritning, där', 'fig. 1 visar ett tvärsnitt genom varpen av ett textilmaterial med', 'lugg enligt föreliggande uppfinning; fig. 2 utgör en mycket för-', '25', 'storad isometrisk vy av en trad av metalliskt laminat, som kan an-', 'vändas i textilmaterial med lugg enligt föreliggande uppfinning;', 'fig. 3 visar en utföringsform av garn, som innehäller en trad av', 'metalliskt laminat, som kan användas i textilmaterial med lugg', 'enligt föreliggande uppfinning.', '30', 'Pã ritningen och speciellt i fig: 1 visas ett textilma-', 'terial med lugg (10), som bestär av en bärare (11) och öglor (12),', 'som bildar lugg och är fästade vid bäraren (11). I den visade ut-', 'föringsformen bestär bäraren (11) av varp (13), vari invävts väft', '(14), som är väl känt inom tekniken. Bäraren (11) kan ha varje', '35', 'annan struktur, som hittills använts, som bärare för textilmaterial', 'med lugg. Bäraren (11) kan konstrueras av vilken som helst av de', 'filmer som tidigare använts inom tekniken sãsom jute, hampa, segel-', 'duk av bomull, flerskiktsbärare. De luggbildande öglorna är gjorda', 'av ett garn (15), som av tvã eller flera strängar (16). Tre-', '40', 'eller fyrsträngiga garn (15) användes vanligen och föredrages.', 'Garnet (15) innehäller en trad av metalliskt laminat (20), som i']"
3,"['332798', 'allmähet är närvarande i en mängd av 2 till 90 och företrädesvis', '4', 'till 15 viktprocent av garnet (15). Aterstoden av garnet (15)', 'bestär av fibrer (17)', 'I fig. 2 visas en lämplig trad av metalliskt laminat (20),', '5', 'som kan användas i textilmaterial med lugg (10). Dessa tradar av', 'metalliskt laminat (20). är kända inom tekniken och kan framställas', 'enligt kända förfaranden sãsom exempelvis beskrives i den ameri-', 'kanska patentskriften 3.069.746. I allmänhet bestär träden av me-', 'talliskt laminat (20) av ett metallskikt, som pã ena sidan bundits', '10', 'till ett polymert skikt (22) med nãgot lämpligt medel s&som ett', 'lim (23). Vid en föredragen utföringsform av träden av metalliskt', 'laminat (20), avbildad i fig. 2, är den andra ytan av metallskiktet', '(21) ocksã bunden till ett annat polymert skikt (24) med hjälp av', 'ett lim (25). Metallskiktet (21) kan utgöras av koppar, silver,', '15', 'nickel, krom, bly, tenn, aluminium eller legeringar därav. Alumi-', 'nium föredrages pã grund av dess kombination av egenskaper sãsom', 'stor smidighet, lyster, elektrisk ledningsförmäga, värmelednings-', 'förmaga och motständskraft mot mörkfärgning genom oxidation. Det', 'polymera skiktet (22) kan vara detsamma eller annat än det polymera', '20', 'skiktet (24). Fastän vilket som helst av de välkända polymera ma-', 'terialen kan användas, är de föredragna polymererna fiberbildande', 'polymerer med hög draghällfasthet sãsom t ex material av cellulosa', 'sãsom cellulosabutyrat; polyamider, sãsom nylon; polyolefiner, sã-', 'som kristallin polypropen; och lämpligen polyestrar, sãsom poly-', '25', 'etylen-tereftalat. Träden av metalliskt laminat (20) kan framställas', 'enligt förfaranden väl kända inom tekniken genom kombination av ett', 'polymert skikt (22) med ett själv-uppbärande metallskikt (21).', 'Emellertid gör, av skäl som ej helt förstas, trádar av metalliskt', 'laminat (20), som framställts enligt sãdana förfaranden som utfäll-', '30', 'ning frân anga i vakuum eller reduktion av metallkarbonyler, ej de', 'erhallna textilmaterialen med lugg självslocknande och de är olämp-', 'liga att använda vid föreliggande uppfinning. De metalliska skikt', 'som pâföres ett polymert substrat vid dessa förfaranden kan ej be-', 'skrivas som självuppbärande. Dessa metalliska skikt har i allmän-', '35', 'het en tjocklek av mindre än 5 um.', 'Trâdar av metalliskt laminat (20), som är användbara vid', 'föreliggande uppfinning, kan ha en bredd av frân mindre än 0,025', 'till över 6,25 mm, fastän de bredder som ligger inom detta omrâde', 'föredrages och en bredd av 0,39 mm har visat sig vara lämplig för', '40', 'de flesta användningar. Beroende pã sãdana faktorer som trádens']"
4,"['332798', '(20) bredd och tjockleken av skikten (21) och (22), om det finns', 'ett andra polymert skikt (24), dess tjocklek, mängden lim (23) och', '(25), kan tradar av metalliskt laminat (20), som är användbara vid', 'föreliggande uppfinning ha ett denier-tal av 125 till 500 och före-', '5', 'trädesvis frân 200 till 500.', 'Träden av metalliskt laminat (20) kan införlivas i garnet', '(15) genom en mängd förfaranden men införlivas bekvämast och lämp-', 'ligen däri under spinningen eller tvinningen. Dã exempelvis, sãsom', 'visas i fig. 3,en trad av metalliskt laminat (20) spinnes i en', '10', 'riktning motsatt fibrernas vid spinningsförfarandet erhâlles som', 'resultat ett garn (30) med traden av metalliskt laminat (20) pa', 'ytan av strängen (31). I detta fall bestär strängen (31) av antänd-', 'bara fibrer (17). Strängar som i huvudsak bestär av filament av', 'trad av metalliskt laminat kan kombineras med andra strängar, som', 'huvudsakligen bestär av fiber. Den lämpligaste metoden för inför-', '15', 'livande av de metalliska filamenten (20) i det använda garnet vid', 'tillverkning av textilmaterial med lugg enligt föreliggande upp-', 'finning är att tillsätta dem under spinningsförfarandet, varigenom', 'det erhâllna garnet far den i fig. 1 angivna strukturen som garnet', '(15). Andra metoder för införlivande av en trad av metalliskt la-', '20', 'minat (20) i garn är uppenbara för fackmannen- och varje metod med', 'hjälp av vilken de fördelas enhetligt genom garnet är effektiv för', 'att göra textilmaterialet med lugg självslocknande. Da traden av', 'metalliskt laminat (20) är tunnare eller da metallskiktet (21) är', 'tunnare eller bâda delarna, kan ett nágot ökat viktförhällande av', '25', 'trâden av metalliskt laminat (20) erfordras för erhällande av', 'samma grad av eldskyddande verkan. Da man använder tradar av me-', 'tallaminat av varierande tjocklek med metallskikt (21) av varieran-', 'de tjocklek, kan den minsta mängd som erfordras för att ge eld-', 'skyddande verkan lätt och enkelt bestämmas av fackmannen. Dã exem-', '30', 'pelvis metallskiktet (21) har en tjocklek av 11,25 um och det po-', 'lymera skiktet (22) och det polymera skiktet (24) vardera har en', 'tjocklek av 0,39 mm kan eldskyddande verkan erhâllas, da garnet', 'innehäller fem viktprocent av en trad av detta laminat. Naturligt-', 'vis kan textilmaterial med lugg enligt föreliggande uppfinning', '35', 'ocksã innehâlla nágot garn, som är fritt frân tradar av metalliskt', 'laminat (20), om bara garn innehällande dessa tradar är fördelade', 'över hela textilmaterialet.', 'Lämpliga fibrer (17) är de av polymeriserad akrylonitril,', 'som kan innehâlla upp till 20 % av en vinylmonomer, som kan sampoly-', '40', 'meriseras därmed. Exempel pã lämpliga vinylmonomerer omfattar bland']"
5,"['332798', 'andra allylalkohol, vinylacetat, akrylamid, metakrylamid, metyl-', 'akrylat, 2-vinylpyridin, etensulfonsyra, och dess alkalimetall-', 'salter, vinylbensen-sulfonsyra och dess salter, 2-sulfoetylmet', 'akryiat och dess salter, vinyllaktam sãsom vinyl-kaprolaktam och', '5', 'vinyl-pyrrolidon och blandningar därav. Sâledes omfattar uttrycket', 'akrylonitril-polymer homopolymerer av akrylonitril och sampolyme-', 'risat med slumpvis sammansatta merer, segmentpolymerisat och ymp-', 'polymerisat, som innehäller minst 80 viktprocent akrylonitril.', 'Dessa fibrer av akrylonitrilpolymerer är väl kända inom tekniken', '10', 'och tillgängliga i handeln och behöver ej närmare beskrivas.', 'Uppfinningen äskädliggöres närmare i följande exempel,', 'vari alla delar och procent är beräknade med avseende pã vikten,', 'om ej annat anges.', 'Exempel 1 En trad av metalliskt laminat framställdes pã', '15', 'följande sätt: En folie av aluminium med en tjocklek av 11,25 um', 'laminerades till tva folier av polyetylentereftalat med en tjock-', 'lek av 12,5 um med användning av ett polyesterlim. Det sã fram-', 'ställda metalliska laminatet upphettades 1.60 minuter vid 170°C', 'för härdning av limmet och bindning av de polymera skikten till', '20', 'aluminiumskiktet. Laminatet skars därefter till tradar med en', 'bredd av 0,4 mm för bildande av en trad av metalliskt laminat av', '240 denier.', 'Garn A En enkeltrad av ovanstäende trad av metalliskt', 'laminat sattes till en fiber av homopolymeriserad akrylonitril', '25', 'vid spinningen för framställning av en sträng med bomullsnummer', '2/1. Tvã av dessa strängar tvinnades samman till ett 2-trädigt', 'tvinngarn innehällande 9,0 viktprocent av tráden av metalliskt la-', 'minat, baserat pã vikten av garnet. Detta garn betecknas garn A.', 'Garn B Förfarandet för garn A upprepades med den skillnaden', '30', 'att traden av metalliskt laminat spanns i en riktning motsatt. fibrer-', 'nas vid spinningsförfarandet. Det erhällna garnet har en struktur', 'liknande den som visas i fig. 3.', 'Garn C Ett 4-trädigt tvinngarn framställdes genom samman-', 'tvinning av tva strängar bestäende av filament av trâden av metal-', '35', 'liskt laminat och tva strängar bestäende av filament av homopoly-', 'meriserad akrylonitril.', 'Garn D Förfarandet för garn C upprepades med den skill-', 'naden att en sträng av trad av metalliskt laminat användes i stället', 'för tvã.', '40', 'Garn E (som jämförelse) Ett kontrollgarn av 100 % poly-', 'meriserad akrylonitril som ej innehöll nâgon trad av metalliskt']"
6,"['332798', 'laminat sammantvinnades för framställning av ett garn med bomulls-', 'nummer 2/2.', 'Garn F (som jämförelse) Ett kontrollprov av tre strängar', 'av fibrer, varav 70 % utgjordes av homopolymeriserad akrylonitril', '5', 'och 30 % av modifierade akrylfibrer tvinnades samman till ett garn', 'med bomullsnummer 2/2. De här använda modifierade akrylfibrerna', 'framställdes av sampolymerer av 60 % akrylonitril och 40 % vinyli-', 'denklorid.', 'De i tabell I angivna garnen fästes vid en bärare av jute', '10', 'för framställning av textilmaterial med lugg. Dessa textilmaterial', 'provades med avseende pa självslockning vid rumstemperatur (20°C).', 'Bäraren innehäller ingen latex. Eldskyddsprovningen utföres genom', 'tändning av en kula av metenamin med bestämd bränntid. Resultaten', 'av försöken anges i tabell I.', 'Tabell I', 'Beteckning av', 'Vikt-% trad av', 'garnet i textil-', 'metalliskt la-', 'Försöksresultat', 'materialet med', 'minat i garnet', 'lugg', 'A', '9,0 %', 'Självslocknande', 'B', '9,0 %', 'jälvslocknande', 'C', '9,0 %', 'jalvslocknande', 'D', '4,5 %', 'Langsamt brinnande och', 'ej jälvslocknande', 'E', '0 %', 'Brinner fullständigt', 'F', '0 %', 'Langsamt brinnande och', 'ej självslocknande', '15', 'Exempel 2 Textilmaterialen,med lugg enligt exempel 1 som', 'innehöll garnen A, B och F underkastades en prövning av statisk', 'elektricitet. Detta försök utfördes genom att ett cirkulärt prov', 'av textilmaterialet med lugg med en diameter av 108 mm roterades', 'med en hastighet av 1800 varv/minut, medan en mässingsvals fick', '20', 'gnida mot provets lugg. En statisk sond var kopplad till mässings-', 'valsen för upptäckande av nágon statisk laddning som utvecklats.', 'Den statiska laddningen mättes i elektrostatiska enheter (esu) med', 'hjälp av en elektrostatisk voltmeter och resultaten av dessa för-', 'sök anges i tabell II.']"
7,"['7', 'Tabell II', 'Statisk elektricitet (esu)', 'Beteckning av', 'Efter be-', 'Vikt-9 trad av', 'Garn med', 'Efter tvätt-', 'garnet i textil-', 'handling', 'metalliskt la-', 'ytbehand-', 'ning med', 'materialet med', 'med lös-', 'minat i garnet', 'ling', 'detergent', 'lugg', 'ningsmedel', '(1)', '(2)', '(3)', 'A', '9,0', '0', '0', '0', 'D', '4,5', '0', '0', '0', 'F', '0', '0', '0', '3100', '(1) Som det erhällits fran tillverkaren.', '(2) Dessa prov tvättas med en detergent, sköljes med vatten, torkas', 'och jämvikten inställes i luft i 24 timmar vid 20°c och 65 %', 'relativ fuktighet.', '(3) Dessa prov tvättas i följd under skakning i vart och ett av tre', 'olika bad av isopropanol.', 'Patentkrav', 'Textilmaterial med lugg bestäende av en bärare och öglor som', 'bildar lugg, som är fästade i denna bärare, k ä n n e t e c k-', 'n a t av att dessa luggbildande öglor innehäller en trâd av me-', 'tallaminat, som bestär av tvã polymera skikt som bundits till mot-', 'satta sidor av ett metallskikt, varigenom textilmaterialet med', 'lugg erhäller antistatiska och eldskyddade egenskaper.', 'ANFÖRDA PUBLIKATIONER:', 'USA 3 069 746 (161-6)', 'Andra publikationer:', 'Textil och konfektion. 24(1967):10, p. 21.']"
8,"['20', '17', '16', '16', 'IO', '15', '12', '15', '13', 'II', '14', 'FIG.I', '20', 'N', '22', '23', '21', '25', '24', 'FIG.2', '17', '30', '20', '3I', 'FIG.3']"
