PageNo,Text
1,"['UTLÄGGNINGSSKRIFT nr 349 483', 'Int CI', 'B 01 k 1/00', 'H 01 m 27/12', 'P.ans. nr', '13707/69', 'Inkom den', '6 X 1969', 'Giltighetsdag den', '6 x 1969', 'PATENT- - OCH', 'Ans. allmänt tillgänglig den', '8 IV 1970', 'REGISTRERINGSVERKET', 'Ans. utlagd och utläggnings-', 'skriften publicerad den', '2 X 1972', 'Prioritet', 'begärd frân den 7 X 1968', '(Storbritannien, 47 406)', 'CONSTRUCTORS JOHN BROWN LTD, LONDON, STORBRITANNIEN', 'Uppfinnare: D S Salter, Horsham och D H Smith, Guildford', 'Ombud: P-U Hjärne', 'Elektrokemiskt. förfarande', 'Uppfinningen hänför sig till ett elektrokemiskt förfarande av', 'den typ, som inbegriper elektronöverföring vid en gränsyta fast fas-', 'vätska och i vilken en kemisk förändring äger rum och inkluderar för-', 'faranden, där man uppnär oxidation eller reduktion av kemiska ämnen', 'genom att pa den elektrod, som bildar den fasta gränsytan, anbringa', 'en positiv eller negativ laddning och även förfaranden, i vilka en', 'kemisk reaktion användes för alstring av elektricitet, som exempelvis', 'i bränsleceller.', 'Enligt uppfinningen tillhandahälles ett elektrokemiskt förfa-', 'rande vid vilket minst en av elektroderna, vid vilken elektronöverfö-', 'ring äger rum, utgöres av en massa av rörliga partiklar i en elektro-', 'lytcellkammare, vilka partiklar är elektriskt ledande eller atminstone', 'partiellt elektriskt ledande och under sin rörelse bringas i kontakt', 'med en strömledare, varvid rörelsen hos massan av partiklar astadkom-', 'mes av ett fluidum innefattande elektrolyten och/eller reaktanten el-', 'ler reaktanterna för den elektrokemiska reaktionen, som bringas att', 'strömma uppat genom elektrolytcellkammaren, som kännetecknas av att', 'partiklarna har en partikelstorlek av upp till 2000 um och att graden', 'av rörelse uppat hos partiklarna i fluidet begränsas av en ovanför par-', 'tikelbädden belägen partikelogenomtränglig skiljevägg, sã att den av', 'Dupl.kl. B 01 k 3/00; C 07 b 1/00; C 07 c 143/00; C 07 c 143/24; H 01 m 29/02;', 'H 01 m 43/00']"
2,"['2', 'de rörliga partiklarna upptagna volymen av elektrolytcellkammaren är', 'mindre än den volym, som partiklarna skulle uppta i fránvaro av den', 'partikelogenomträngliga skiljeväggen som en fluidiserad bädd vid flui-', 'disering vidminimiströmningshastighet hos partiklarna.', 'De partiklar, som bildar elektroden, kan utgöras helt av ett', 'elektriskt ledande material, sãsom en metall, eller kan exempelvis ut-', 'göras av en däligt ledande kärna, sãsom glas, keramik eller plastmate-', 'rial, med en yta som är ledande eller som har partier med god lednings-', 'förmága. Partiklarna kan alternativt vara av ett halvledande material', 'sãsom grafit. Företrädesvis är emellertid partiklarna helt ledande och', 'är uppbyggda av fasta metaller eller legeringar, sásom koppar, nickel,', 'bly eller Monel', 'R Partiklarna själva kan ta del i den elektrokemiska', 'reaktionen.', 'Partiklarna, som bildar elektroden, har vanligen en partikel-', 'storlek av 70-1000 um och kan sálunda beskrivas som pulver. Företrädes-', 'vis har partiklarna en partikelstorlek inom omrádet 100-250 m.', 'Partiklar av vilken som helst form kan användas. Emellertid är', 'det lämpligast att använda partiklar med runda grunddimensioner och', 'sãlunda föredras grynformiga klumpar före nalformiga partiklar och i', 'huvudsak sfäriska partiklar är mera lämpliga än grynformiga klumpar.', 'De partiklar, av vilka elektroden är uppbygg, bringas i kon-', 'takt med en strömledare, som kan bilda en effektiv kontakt med massan', 'av partiklar som bildar elektroden och som kan leda en elektrisk ladd-', 'ning mellan partiklarna och de yttre delarna av cellen eller halvcellen,', 'i vilka den elektrokemiska processen genomföres. Nämnda ledande organ', 'kan själv bilda väggen eller en del av väggen av den behâllare, som', 'innehäller den finkorniga elektroden.', 'Det fluidum, som innehäller elektrolyten och/eller reaktanten', 'eller reaktanterna, är vanligen en vätska och pumpas normalt genom den', 'finkorniga elektroden. Vid vissa reaktioner kan emellertid en eller', 'flera av reaktanterna föreligga i gasform. Anordningar kan finnas för', 'reglering av den hastighet, med vilken fluidet passerar genom elektro-', 'den.', 'Genomförandet av förfarandet enligt uppfinningen skall nu när-', 'mare belysas i anslutning till bifogade ritningar.', 'Fig. 1 visar schematiskt en diafragmacell som användes och', 'fig. 2 visar de resultat, som uppnáddes och är ett diagram över cell-', 'strömmen som funktion av flödeshastigheten för reduktionen av meta-', 'nitrobensensulfonsyra vid en kopparpulverelektrod vid konstant katod-', 'potential.']"
3,"['349483', 'Det särskilt exemplifierade elektrokemiska förfarandet är re-', 'duktionen av meta-nitrobensensulfonsyra i vattenhaltig lösning. Denna', 'reaktion försiggär vid en elektrisk potential mindre negativ än -0,8', 'volt relativt en mättad kalomelelektrod beroende pá elektrodmaterialet,', 'i en lösning innehällande 125-molar meta-nitrobensensulfonsyra och', '1-molar svavelsyra vid rumstemperatur. Ströntätheten över de enskilda', 'partiklarna vid reaktionen var ca 0,2 A/dm². Strömverkningsgraden är', 'högst vid en lägre strömtäthet och när elektrolyttemperaturen är för-', 'höjd.', 'Den i fig. 1 visade diafragmacellen som användes för dessa', 'experiment, bestär av en bädd 1 av kopparpartiklar bildande katoden i', 'cellen, varvid bäddens bredd är ca 1,3 cm och höjden ca 3,8 cm. Katod-', 'strömbäraren 2 i form av en koppartrad var placerad ca 0,5 cm frân', 'R', 'celldiafragmat 4, som var av väv av Terylene En nätanod 3 av pla-', 'tina var placerad ca 0,5 cm frân diafragmat 4 pã andra sidan av dia-', 'fragmat. Katodpartikelbädden vilade pá ett permeabelt stöd eller', 'diffusör 6. Bädden var ca 2,5 cm tjock. Anolyten utgjordes av 1-molar', 'svavelsyra i vatten.', 'Cellströmmen uppmättes sedan vid olika stigande flödeshastig-', 'heter för elektrolyt genom cellen vid konstant elektrodpotential. Re-', 'sultaten framgar av kurvan A i fig. 2. Det framgar att när partiklarna', 'i katodbädden kan röra sig fritt i elektrolytflödet uppnãs en optimal', 'ström vid en bestämd flödeshastighet och strömmen avtar starkt när', 'flödeshastigheten antingen sänks eller höjs i förhällande till den', 'optimala flödeshastigheten.', 'I ytterligare en serie experiment placerades en porös, avspär-', 'rande skiljevägg 5 ovanför partikelbädden för att begränsa partiklar-', 'nas fria rörelse i elektrolytflödet. Det visade sig att pa detta sätt', 'kunde en optimal cellström upprätthällas vid högre flödeshastigheter,', 'vilket framgär av kurvan B i fig. 2.', 'En viktig fördel med förfarandet enligt uppfinningen är som', 'framgar av ovannämnda att cellströmmen är mindre beroende av flödes-', 'hastigheten hos elektrolyten eller reaktanten genom elektroderna än', 'vid processer, i vilka den finkorniga bädden är helt fluidiserad och', 'där den finkorniga bädden ej är avspärrad. Det begränsade fall, dã den', 'finkorniga bädden är helt stationär faller dock inte inom ramen för', 'uppfinningen.', 'Förfarandet enligt uppfinningen kan emellertid utföras genom', 'att exempelvis ändra flödeshastigheten för elektrolyten pà ett pulse-', 'rande sätt, sã att under en period partiklarna i elektrodbädden kvar-']"
4,"['349483', 'hâlles fysikaliskt vid hög flödeshastighet och därefter bringas till', 'stationärt tillständ genom sänkning av flödeshastigheten under den,', 'vid vilken partiklarna i partikelbädden störs av flödet.', 'Förfarandet enligt uppfinningen kan med särskilt stor fördel', 'användas i celler, som har en lägre liggande del, som är konisk eller', 'kilformad och i vilken elektrolyten, som införes i cellen, har en', 'högre hastighet än när den passerar genom bädden. I sádana fall behö-', 'ver man ej använda nágon elektrolytdiffusör under partikelbädden.', '-1']"
5,"['349483', 'Patentkrav', '1. Elektrokemiskt förfarande vid vilket minst en av elektro-', 'derna, vid vilken elektronöverföring äger rum, utgöres av en massa av', 'rörliga partiklar i en elektrolytcellkammare, vilka partiklar är elekt-', 'riskt ledande eller ätminstone partiellt elektriskt ledande och under', 'sin rörelse bringas i kontakt med en strömledare, varvid rörelsen hos', 'massan av partiklar ästadkommes av ett fluidum innefattande elektroly-', 'ten och/eller reaktanten eller reaktanterna för den elektrokemiska', 'reaktionen, som bringas att strömma uppát genom elektrolytcellkamma-', 'ren, k ä n n e t e c k n a t av att partiklarna har en partikelstor-', 'lek av upp till 2000 um och att graden av rörelse uppât hos partiklar-', 'na i fluidet begränsas av en ovanför partikelbädden belägen, partikel-', 'ogenomtränglig skiljevägg, sã att den av de rörliga partiklarna upptag-', 'na volymen av elektrolytcellkammaren är mindre än den volym av elekt-', 'rolytcellkammaren, som partiklarna skulle uppta i frânvaro av den par-', 'tikelogenomträngliga skiljeväggen som en fluidiserad bädd vid fluidise-', 'ring vid minimiströmningshastighet hos partiklarna.', '2. Förfarande enligt krav 1, k ä n n e t e c k n a t av', 'att partiklarna uppvisar en partikelstorlek inom omrádet 75-1000 m.', '3. Förfarande enligt krav 1, k ä n n e t e c k n a t av att', 'det ledande organet själv bildar väggen eller en del av väggen i', 'elektrolytcellkammaren, som innehäller massan av rörliga partiklar.', '4. Förfarande enligt krav 1, k ä n n e t e c k n a t av att', 'fluidet pumpas genom elektrolytcellkammaren.', '5. Förfarande enligt nágot av kraven 2-4, k ä n n e t e c k -', 'n', 'a t av att partiklarna, som bildar elektroden, har en partikelstor-', 'lek inom omrádet 100-250 m.', '6. Förfarande enligt nágot av föregäende krav, k ä n n', 'e', '-', 't', 'e', 'c', 'K n a t av att hastigheten för elektrolytens strömning ändras', 'pã pulserande sätt, sã att under en period partiklarna i elektrodbäd-', 'den kvarhälles av den partikelogenomträngliga skiljeväggen och sedan', 'bringas till stationärt tillständ genom att man sänker strömnings-', 'hastigheten under den, vid vilken partiklarna i partikelbädden störs', 'av flödet.', 'ANFÖRDA PUBLIKATIONER:', 'Sverige patentansökningarna 7 230 /ar 1967/, 3 451 /ar 1968/', 'Frankrike 1 418972', 'J']"
6,"['Fig.1.', '-', '+', '2', '3', '5', '/', '6']"
7,"['Fig.2', '7', '6', 'B.', '5', '4', '3', '2', 'A.', '1', 'this', '0', '0', '200', '400', '600', '800', '1000', '1200', '1400', 'FLÖDESHASTIGHET (ml/min.)']"
