PageNo,Text
1,"['UTLÄGGNINGSSKRIFT nr', '359 723', 'Int', 'CI A 01 k 79/02', 'P.ans. nr', '4633/70', 'Inkom den', '3 IV 1970', 'Giltighetsdag den', '3 IV 1970', 'PATENT- - OCH', 'Ans. allmänt tillgänglig den', '4 x 1970', 'REGISTRERINGSVERKET', 'Ans. utlagd och utläggnings-', 'skriften publicerad den', '10 IX 1973', 'Prioritet', 'begärd fran den 3 IV 1969', '(Tyskland DL, WP 139 001)', 'VEB KABELWERK OBERSPREE (KWO), BERLIN-OBERSCHÖNEWEIDE, TYSKLAND DL', 'Uppfinnare: W Woboditsch, Berlin-Köpenick, M Spittka, Berlin-Friedrichshagen,', 'K Bader, Berlin-Friedrichsfelde, o Wegemann, Berlin-Friedrichshagen, H J Fischer', 'och H Richter, Rostock', 'Ombud: L Brann', 'Böjlig, upplindbar impulskabel för höga statiska och dynamiska dragpäkänningar', 'vid fiske', 'Uppfinningen avser en böjlig impulskabel för höga statiska', 'och dynamiska dragpäkänningar vid fiske med elektricitet, vilken är', 'speciellt avsedd för trälfiske med elektricitet.', 'Vid tidigare kända konstruktioner av elektriska ledningar, som', 'skola utsättas för höga dragpäkänningar, âstadkommas de höga. mekaniska', 'iragpäkänningsegenskaperna genom att ett bärande organ med motsvarande', 'styrka kombineras med den elektriskt ledande delen i ledningama. När', 'man önskar använda ledningar, som utsättas för höga mekaniska pã-', 'känningskrafter i samband med högsjöfiske, och dà särskilt i samband', 'med fiske med elektricitet, har det visat sig att dessa kända konstruk-', 'tioner icke fylla de krav som maste ställas, eftersom till följd av', 'de speciella förhällanden som rãda pá det öppna havet de krav som stäl-', 'las beträffande vridmomentfrihet i samband med mycket lânga längder av', 'kabel sâväl som de krav som ställas i fraga om pakänningshällfast-', 'het till följd av de râdande höga statiska och dynamiska dragpäkännings-', 'belastningarna de kända konstruktionerna icke motsvara de ställda', 'kraven.', 'Speciella konstruktioner för likartade ändamál äro tidigare', 'kända. Dessa konstruktioner innefatta ledare, ledarglättning, isolering,', 'fältbegränsning, âterledare, innermantel och bärande organ. Till följd', 'av kons aktionselementens dimensioner ha dessa kablar emellertid', 'mycket stor diameter.']"
2,"['2', 'Ett ändamál med uppfinningen är att genom en lämplig konstruk-', 'tion av kabeln eliminera de här nämnda olägenheterna.', 'En uppgift i samband med uppfinningen är därför att pá lämp-', 'ligt sätt utforma en för fiske med elektricitet avsedd impulskabel,', 'som är speciellt avsedd för trälfiske med elektricitet, sã att minsta', 'möjliga kraft överföres till nätet, som skulle kunna leda till en', 'förändring av nätställningen, och sã att själva impulskabeln upp-', 'visar tillräcklig motständskraft gentemot de förekommande höga statiska', 'och dynamiska dragpäkänningarna.', 'Uppgiften löses enligt uppfinningen pá sã sätt, att impuls-', 'kabeln samtidigt máste uppvisa i det följande förklarade känne-', 'tecken, som äro utmärkande för en pá ändamälsenligt sätt utformad', 'impulskabel för fiske med elektricitet, och da särskilt för trälfiske', 'med utnyttjande av elektricitet.', '1. Vid en i möjligaste man vridmomentfri impulskabel ráder', 'ett definierat förhällande mellan metervikt, lyftkraft, strömmotständ', 'och kabeldiameter, som kan uttryckas med ekvationen', '= .', 'varvid', '9I betecknar metervikten,', 'd betecknar kabeldiametern', 'a, b äro koefficienter, som i huvudsak äro beroende av träl-', 'ningshastigheten, vattendjupet och kabelns ytbeskaffenhet och som', 'fastställas pá empirisk väg.', 'Fackmannen pá omrádet kan pá empirisk väg fastställa', 'koefficienterna a och b, exempelvis genom att kabelsträckningen mellan', 'fartyg och nät mätes med hjälp av ett andra fartyg. Den kurvsträck-', 'ning som dá erhälles möjliggör en beräkning av den erforderliga', 'kabelsträckningen respektive kabelns metervikt.', 'För att teoretiskt bestämma parabeln', 'ai = a . d + b a2', 'är det nödvändigt att man exakt känner faktorerna a och b, eller', 'omvänt, att man för tvá olika diametrar d1 och d2 känner de mot-', 'svarande metervikterna ail och 912 respektiveförhällandena 9/1/21', 'och 912/d2.', '2. Kabeln är sá utformad, att det bärande organet sam-', 'tidigt utnyttjas sásom elektrisk huvudledare, varvid för att uppnã']"
3,"['3', 'vridmomentfrihet endast sádana slaglängder användes i det bärande', 'organets enskilda skikt som förhindra sáväl en alltför stor töjning', 'av', 'kabeln till följd av alltför liten slaglängd som att kabelns', 'innerkonstruktion vid böjning utträder till följd av alltför stor', 'slaglängd. Det bärande organet är därvid utformat motlöpande och i', 'flera skikt, varvid man använder sig av en massiv trad eller litstrad', 'eller en kombination av bâda dessa liksom även av varierande lits-', 'respektive trâddiametrar i de enskilda skikten.', '3. Det bärande organet bestâr av en specialtrád med en styrka', 'av 140 - 180 kp/mm², varvid kabeln fär uppvisa en lägsta draglast', 'och icke fär överskrida en högsta draglast vid samtidig vridmoment-', 'frihet och en bestämd metervikt, som framgar av ekvationen', '= a', '4. Det bärande organet innefattar flera skikt och uppvisar', 'sádana variationer beträffande slaglängder i tvärsnitt genom', 'skikten av stál och beträffande trâddiametern, att en fullständig', 'överklädnad av kabeln säkerställes samtidigt som vridmomentfrihet', 'ästadkommes, varvid dock vid användning av ställitstrad i det yttre', 'skiktet_ ett ytterhölje av plast eller elast máste överdragas.', 'Kabeln har till följd av sin förhállandevis enkla konstruk-', 'tion genom att den innefattar ett mycket litet antal konstruktions-', 'element förutom hög pakänningshállfasthet även den fördelen, att dess', 'diameter kan hállas inom godtagbara gränser, och kabeln är mycket', 'böjlig och kan därför lätt upplindas.', 'Genom den framkomna konstruktionen uppnás, att kabeln lägger', 'sig pá lämpligaste avstand mellan fartyget och nätet, sã att inga', 'krafter pâverka nätet, som skulle kunna inverka ogynnsamt pá nätets', 'ställning. Uppfinningen beskrives närmare i det följande med ledning', 'av ett valt utföringsexempel, och pá ritningen visas kabeln i tvär-', 'sektion.', 'Kabeln bestär av en inre ledare 1, som t.ex. bestär av', 'kopparlitser och som omges av ett glättningsskikt 2 för ledaren av', 'nágon ledande plast eller elast. Utanpa detta befinner sig isolerings-', 'skiktet 3 av plast- eller elastmaterial och det ledande yttre fält-', 'begränsningsskiktet 4. Utanpa fältbegränsningsskiktet 4 äro bärande', 'organ samt ledare 5 anordnade, vilka exempelvis bestà av i skikt', 'ordnade massiva trádar, som inbördes ha varandra motlöpande slag-']"
4,"['359723', '4', 'riktning. Om sá erfordras, *kan en mantel av plast eller elast', 'dessutom anbringas utanpá det bärande organet och ledaren 5.', 'I det ifrágavarande diameteromrádet, som exempelvis är', 'mellan 15 och 30 mm, skall: vid en hastighet av ca 4 knop ráda ett', 'förhällande mellan metervikt och kabeldiameter, som exempelvis', 'uppgár till ungefär 0,057 p/mm2.']"
5,"['5', 'PATENTKRAV', '1.', 'Böjlig, upplindbar impulskabel för höga statiska och dynamiska', 'dragpäkänningar vid fiske med elektricitet, särskilt för trälfiske', 'medelst elektricitet, varvid kabeln innefattar ett bärande organ', 'och är avsedd att utöva minsta möjliga kraft gentemot nätställningen,', 'k à n n e t e c k n a d av att vid den närmast vridmomentfria im-', 'pulskabeln ráder ett definierat förhällande mellan metervikt, lyft-', 'kraft, strömningsmotstand och kabeldiameter, som bestämmes med', 'ekvation en', 'd 2', 'varvid', 'al betecknar metervikten,', 'd betecknar kabeldiametern och', 'a, b beteckna koefficienter,', 'och att man för att uppnà vridmomentfrihet i det bärande organets (5)', 'enskilda skikt, vilka ha varandra motlöpande slagriktningar, endast', 'utnyttjar slaglängder, som förhindra sâväl en alltför stor töjning', 'av kabeln till följd av alltför liten slaglängd som att kabelns', 'innerkonstruktion vid böjning utträder till följd av att slag-', 'längderna äro alltför stora.', '2.', 'Böjlig, upplindbar impulskabel enligt krav 1, k à n n e', '-', 't e c k n a d av att det bärande organet (5) är framställt av en', 'specialtrád med en styrka av 140 - 180 kp/mm 2 samt tjänar sásom', 'elektrisk huvudledare, varvid kabeln skall uppvisa en lägsta drag-', 'last och icke fär överskrida en högsta draglast vid samtidig vrid-', 'momentfrihet och en bestämd metervikt, som framgar av ekvationen', 'QI', '=', 'a', 'd', '+', 'b', '.', 'a2.', '3.', 'Böjlig, upplindbar impulskabel enligt krav 1, k à n n e', '-', 't e c k n a d av att det flerskiktiga bärande organet (5) upp-', 'visar sádana variationer beträffande slaglängder i tvärsnitt genom', 'skikten av stâl sâväl som beträffande träddiametern, att en full-', 'ständig överklädnad av kabeln säkerställes samtidigt som vrid-', 'momentfrihet erhälles, varvid dock vid användning av ställitstrád', 'i det yttre skiktet ett ytterhölje av plast eller elast överdrages.', 'ANFÖRDA PUBLIKATIONER:']"
6,"['1', '2', '3', '4', '5']"
