PageNo,Text
1,"['UTLÄGGNINGSSKRIFT nr 353 164', 'Int CI', 'G 03 d 13/00', 'P.ans. nr', '11946/70', 'Inkom den', '2 IX 1970', 'Giltighetsdag den', '2 IX 1970', 'PATENT- OCH', 'Ans. allmänt tiligänglig den', '4 III 1971', 'REGISTRERINGSVERKET', 'Ans. utlagd och utläggnings-', 'skriften publicerad den', '22 I 1973', 'Prioritet begärd frân den 3 IX 1969', '(USA, 855 161)', 'PAKO CORPORATION, MINNEAPOLIS, MINN. USA', 'Uppfinnare: E K Bergeson, St. Louis Park, Minn.', 'Ombud: J-A Delmar', 'Anordning för uppsamling, identifiering och stapling av filmstycken', 'Föreliggande uppfinning avser en anordning för uppsamling,', 'identifiering och stapling av filmstycken av det slag som exempelvis', 'användes av tandläkare och som matas ut frän en filmframkallningsmas-', 'kin. Under filmstyckenas transport genom en filmframkallningsmaskin', 'uppladdas dessa med statisk elektricitet, och med denna laddning fär', 'styckena en förmäga att fastna pá en utloppsränna pá maskinen. Pã', 'grund härav och genom den lâga vikten av varje litet filmstycke glider', 'inte filmstyckena nedför rännan till dess botten där de skall staplas', 'i följd och identifieras.', 'Föreliggande uppfinning avser en filmuppsamlande ränna och en', 'härför avsedd stödanordning samt en skena, vilken uppbär materialrem-', 'sor innehallande polonium. Skenan är belägen i banan för filmstyckenas', 'frammatning till rännan och poloniumet pá skenan joniserar snabbt luf-', 'ten genom vilken filmstycket passerar, vilket i sin tur tar bort den', 'statiska laddningen pâ filmstycket. Till följd härav glider filmstyc-', 'ket fritt nedför rännan där den slâr an mot ett stopporgan. För att', 'fà filmen att staplas vid den nedre änden av rännan är en ramp anordnad', 'pá rännans botten pá avstand frän den nedre änden av rännan. Pã grund', 'av tyngdkraften glider filmstycket nedför rännan och upp pa rampen,', 'vilken lyfter upp filmstycket ovanför rännans botten. Da filmstycket', 'upplyfts pá detta sätt lämnar den änden av rampen och faller ned pâ', 'Dupl.kl. G 03 b 1/00']"
2,"['2', 'ett filmstycke, som tidigare lämnat änden av rampen och vilar pá den', 'nedre änden av rännan, varigenom astadkommes en stapling av filmstyc-', 'kena. Bäranordningen för rännan bestär av ett träg, som är anslutbart', 'till filmframkallningsmaskinen och som kan uppbära tre identiska rän-', 'nor som samtidigt kan mottaga filmstycken frän tre utmatningsöppningar', 'i filmframkallningsmaskinen. Dessa utloppsöppningar ligger i linje', 'med filmstyckenas inloppsöppningar i maskinen, sã att en säker identi-', 'fiering av filmen erhälles. Ett antal filmstycken för en viss patient', 'som har matats in i en bestämd inloppsöppning i maskinen, kommer med', 'andra ord att matas ut i motsvarande ränna vid en utloppsport pá mas-', 'kinen. Den utmatade samlingen utgör därvid en identifiering av film-', 'styckena för en viss patient. Detta är även fallet för varje ränna i', 'en rad av sâdana.', 'Uppfinningen beskrives närmare nedan under hänvisning till bi-', 'fogade ritningar, där fig. 1 är en perspektivvy av utmatningsänden pã', 'en filmframkallningsmaskin, pa vilken den filmuppsamlande-, identifie-', 'rande- och staplande anordningen enligt uppfinningen är anbragt, fig.', '2 är en vy liknande fig. 1, i vilken separata rännor visas borttagna', 'frän ett bärträg, fig. 3 är en sektionsvy längs linjen 3-3 i fig. 1,', 'fig. 4 är en planvy av anordningen, fig. 5 är en sektionsvy längs lin-', 'jen 5-5 i fig. 4, och fig. 6 är en sektionsvy liknande fig. 5 och visar', 'en ytterligare utföringsform av en anortining, som borttar statisk', 'elektricitet.', 'I fig. 1, 2 och 3 visas ett ändparti av en maskin A för fram-', 'kallning av exponerad film, särskilt av den typ som användes av tand-', 'läkare för röntgenfotografering av en patients tänder. De exponerade', 'filmstyckena matas in i maskinen A vid den icke visade änden, och inu-', 'ti maskinen matar valsar successivt fram filmstyckena genom framkall-', 'ningslösningar och en torkningsanordhing. De framkallade filmstyckena', 'F matas därefter ut ur maskinen genom öppningen G medelst ett sista par', 'valsar 10 och 12 (se speciellt fig. 3). Under det att filmstyckena', 'passerar igenom maskinen laddas de upp med statisk elektricitet.', 'Den beskrivna uppfinningen avser en filmuppsamlande- identifi-', 'erande- och staplande anordning C, som uppsamlar, staplar och identifi-', 'erar filmstyckena F dâ desamma matas ut frän maskinen A under det att', 'samtidigt statisk elektricitet borttages frân filmen. Genom att film-', 'styckena uppladdas med statisk elektricitet under det att de matas ut', 'frän maskinen A har filmstyckena en förmâga att fastna pã den uppsam-', 'lande rännan. Vissa filmstycken upptar mer statisk elektricitet än']"
3,"['3', 'andra, varför fallhastigheten och fallängden i en ränna kan variera,', 'sã att en effektiv och lätt stapling av filmstyckena i bottnen pá rän-', 'nan icke kan erhâllas.', 'Den filmuppsamlande-, identifierande- och staplande anordningen', 'C innefattar ett bärträg 14. Bärträget bestär av en botten 16 pá vars', 'öyre ände är utformad en hake 18. Den nedre änden av bottnen är ut-', 'formad med âtskilda gavelväggar 20 och 22, vilka mellan sig lämnar en', 'öppning 24. Ett spar 26 är anslutet till öppningen 24 i bottnen 16.', 'Bottnen 16 är även utformad med tillträdeshäl 28 och 30.', 'Pã den övre änden av bottnen 16 är anbragt en bärdel i form av', 'en skena 32, pá vilken är anordnade tvärliggande materialremsor 34', 'innehällande poloniumpartiklar. Den avgivna strälningen frân polonium-', 'remsorna kallas alfasträlning och är ofarlig. Alfastralarna föres ge-', 'nom luften mycket snabbt, men har icke kraft att genomtränga hud. Da', 'strálarna föres genom luften alstrar de en jonisering, och det är den-', 'na joniserade luft som borttar de statiska laddningarna i filmstyckena', 'F medan dessa föres över remsorna 34. Dâ de statiska laddningarna', 'borttagits glider filmstyckena mycket lätt nedför rännan och staplas', 'vid dess botten pá ett sätt som beskrives nedan.', 'Med 36 betecknas en första sidovägg pã bottnen 16, vilken sträc-', 'ker sig i huvudsak fran den övre änden av bottnen 16 till gavelväggen', '20 pã bärträget 14. Dessutom är anordnad en andra sidovägg 38 pa bott-', 'nen 16 vilken sträcker sig i huvudsak frân den övre änden av bottnen', '16 till gavelväggen 22. Haken 18 pá bärträget 14 är införd under en', 'stang 40 i maskinen A och bottnen vilar pá en stang 42, som är belägen', 'pá undersidan av öppningen G i väggen W i maskinen A, varvid bärträget', '14 uppbäres i en sned vinkel relativt vertikalplanet, sásom framgár i', 'fig. 1, 2 och 3.', 'Med 44 betecknas en ränna vilken bestär av en botten 46, en', 'uppâtriktad första sidovägg 48 längs bottenkanten samt en andra sido-', 'vägg 50, vilka bâda väggar sträcker sig längs bottnen 46 och har en', 'successivt ökande höjd räknat frân toppen till bottnen. Väggarna 36', 'och 38 i bärträget har ävenledes successivt ökande höjd räknat frân', 'toppen till de nedre gavelväggarna 20 och 22. Med 52 betecknas en', 'nedre uppätriktad anslagsvägg, som är förbunden med bottnen 46 och', 'sidoväggarna 48 och 50 pá rännan. Väggarna 48 och 50 pâ rännan utgör', 'styrningar för filmstyckena till anslagsväggen 52.', 'I rännan är dessutom anordnad en ramp 54, som bestär av en svagt', 'bâgformig överdel 56 och en nedätriktad änddel 58. Rampen 54 sträcker', 'sig i huvudsak mellan sidoväggarna 48 och 50 samt är belägen mellan']"
4,"['4', 'ändarna av bottnen 46 pa rännan. Den övre änden av rampen 54 är fäst', 'medelst ett öra 60, som sträcker sig frân den övre änden av överdelen', '56 och genom ett smalt hal 62 utformat i bottnen 46 samt omvikt i denna.', 'Den nedre kanten av ändpartiet 58 av rampen uppvisar ett öra 64, som', 'sträcker sig genom ett hâl 66 utformat i bottnen 46 samt är omvikt i', 'denna. Varje ränna uppvisar ett tillträdeshâl 29 utformat i dess bot-', 'ten i närheten av väggen 52.', 'Bärträget 14 är brett nog för att uppbära tre identiska rännor', '44, och tillträdeshälet 28 möjliggör att ett finger kan införas däri-', 'genom och genom hâlet 29 i rännan, för att lyfta upp en stapel av', 'filmstycken, som uppsamlats vid hâlen. Tillträdeshâlet 30 användes pâ', 'liknande sätt vid en ränna som ligger ovanpã detsamma, och sparet 26', 'lämnar plats för ett finger för upplyftning av filmstycken, som ligger', 'ovanför spáret 26 och hälet 29 i rännan.', 'Anordningen fungerar pa följande sätt.', 'Filmstycket F utmatas genom valsarna 10 och 12 i maskinen A och', 'skenan 32 är sã belägen att filmen F föres över skenan där de polonium-', 'innehällande remsorna borttar den statiska elektriciteten som laddats', 'upp i filmen F under dess passering genom valsarna i maskinen A, där', 'film framkallas och torkas. Filmen pâföres bottnen 46 i en bestämd', 'ränna, och beroende pa tyngdkraften glider filmen F ned till rampen', '54. Filmen F förskjutes över och nedför rampen, vilken lyfter upp', 'filmen ovanför bottnen 46. Därefter faller filmen F av änden av ram-', 'pen och ned pâ bottnen 46 samt intar ett läge mot ändväggen 52. Nästa', 'film F förflyttar sig pá samma sätt och efter passerandet av rampen', '54 intar den ett läge ovanpã filmen F och anligger likasã mot ändväggen', '52 i ett stapelformigt förhällande. Till följd härav staplas film-', 'styckena F i rännan 44 i samma ordningsföljd som de matades in i mas-', 'kinen A. Innan anordningen användes tas en serie röntgenfotografier', 'i exempelvis i en patients mun. Filmen F matas därefter genom maskinen', 'och staplas slutligen pá ovan beskrivna sätt. Dâ staplingen av en', 'serie filmstycken F för en viss patient slutförts införes även en iden-', 'tifieringslapp genom maskinen som stannar ovanpa filmstapeln, vilken', 'därigenom identifierar stapeln med en viss patient samt separerar sta-', 'peln frän en efterföljande stapel ovanför densamma. Härigenom erhâl-', 'les ett ytterligare sätt att identifiera en serie filmbilder för en', 'patient gentemot en serie filmer för en annan patient.', 'I utföringsformen enligt fig. 6 är skenan 32a identisk med ske-', 'nan 32, men densamma är anbragt pã ett par konsoler 68, som är fästa pá', 'sidoväggarna i öppningen G 1 maskinen A, varvid skenan befinner sig i', 'matningsbanan för filmstyckena da desamma matas ut frän maskinen.']"
5,"['5', 'Skenan 32a borttar statisk elektricitet frân filmstyckena pá samma sätt', 'som beskrivits ovan.', 'Patentkrav', '1.', 'Anordning för uppsamling, identifiering och stapling av film-', 'stycken utmatade fran en ilmframkallningsmaskin, k à n n e t e e k-', 'n a d a V atminstone en ränna (44) som uppvisar stopporgan (52) vid', 'dess nedre ände, organ (32, 34) intill den övre änden av rännan (44)', 'för borttagande av statisk elektricitet frân filmstycken (F) utmatade', 'fran maskinen (A) till rännan (44), samt organ (14), för uppbärande', 'av rännan (44) pa maskinen i en spetsig vinkel med vertikalplanet för', 'att mottaga filmstycken (F), som utmatas frân maskinen, och bringa', 'desamma att förskjutas ned till stopporganen (52).', '2.', 'Anordning enligt kravet 1, k à n n e t e e k n a d a V att', 'det rännan uppbärande organet pa maskinen bestâr av ett trag (14),', '1 vilket rännan (44) är belägen, vilket trâg innefattar organ (18) för', 'anslutning till maskinen och för att uppbära detsamma.', '3.', 'Anordning enligt kravet 1 eller 2, K à n n e t e c k n a d a', 'V', 'att organet för eliminering av statisk elektricitet innefattar en bär-', 'skena (32), pã vilken är anbragt medel (34) för jonisering av den luft', 'genom vilken de filmstycken, som tillföres rännan, passerar.', '4.', 'Anordning enligt kravet 3, k à n n e t e e k n a d a y att', 'medlet för jonisering bestär av en eller flera materialremsor innehäl-', 'lande polonium.', '5.', 'Anordning enligt nágot av kraven 1-4, k à n n e t e 0. k n a d', 'a V', 'att mellan rännans bãda ändar är anordnad en ramp (54).', 'ANFÖRDA PUBLIKATIONER:']"
6,"['u', 'w', 'a', 'N', '20', 'N', '8', '2', 'a', 'A', 'N', '54', 'by', 'N', '2', 'G', 'I']"
7,"['FIG.S', '10', 'G', 'F', '12', '32a', '40', '18', '18', '32', '/4', '14', '+', '46', '38', '42', '42', '50', 'W', '16', 'FIGE', '14', '44', '14', '30', 'sult', '29', '20', '53', '24', '29', '26', '56', '54', '26', '52', '96', 'A', '46', '50', '48', '29', '11/13', '-', '36', '22', '18 34', '44', '32', '94', '52', '20', '46', '50', '111155', '54', '1', 'a', '32 34', 'F', '58', 'ma', '16', 'L66', '29', '60', '62', '64', '28', '18', 'FICES']"
