PageNo,Text
10,"['10', 'ett kontinuerligt tillfört prov, pa vilket mycket högt tryck avses', 'att appliceras. Det är känt, att mycket högt tryck pã metaller, exem-', 'pelvis under värmebehandling, medför att metallerna antar skilda', 'egenskaper.', '5', 'I denna utföringsform antages, att det prov, som skall matas', 'genom anordningen, är en metallstäng, men givetvis är uppfinningen', 'ej begränsad till denna tillämpning. Exempelvis kan man anordna sã,', 'att ett provstycke med begränsad längd matas genom anordningen. Bâda', 'provstyckena matas huvudsakligen automatiskt, beroende pã maskinens', '10', 'arbetssätt.', 'I fig. 5 - 9 visas en typisk utföringsform av en sãdan anordning.', 'Grundläggande för anordningen enligt uppfinningen är vad som', 'ovan beskrivits, men i stället för att reaktionskärlet är omgivet av', 'ett sfäriskt format organ för applicering av trycken, har röret for-', '15', 'men av ett längt rör 102 med deformerbara väggar av material, vilket', 'kan motst& trycket och temperaturen vid behandlingen av materialet', 'i provstycket.', 'Detta rör har en serie smala, tätt intill varandra belägna tryck-', 'appliceringssystem sãsom 112, 114, 116, och detta system arbetar i', '20', 'en massa av inpackat, partikelformigt material 110.', 'Vid denna utföringsform har röret en beklädnad av partikelformigt', 'material, i vilket är inbäddat en tätt intill belägen serie radiellt', 'utskjutande kilar eller en koaxial, stegvis anordning av kilar sã-', 'som ovan beskrivits. Ett yttre hölje är anordnat för inrymmande av', '25', 'det partikelformiga materialet. Höljets ändpartier är företrädesvis', 'koniska och innefattar inät riktade kilaggregat.', 'Upphettning av det material som skall behandlas astadkommes pã', 'normalt sätt genom användning av elektriska medel genom diametralt', 'motstäende punkter, genom ledningar 108 för vardera serien kilar.', '30', 'Detaljerna av de elektriska ledningarna och isolationen genom organen', '126 är ej visade.', 'Det partikelformiga materialets inre regioner intill röret inne-', 'häller granulerat eller pulverformigt, ledande material, eller kan', 'innefatta en lämplig metall för att leda elektricitet till en sektion,', '35', 'av röret.', 'Beträffande konstruktionen av den pa kontinuerligt matade prov-', 'kroppar eller material verkande cellen bör observeras, att det tryck,', 'som den centrala, parallella, cylindriska delen kan motsta eller av-', 'leda, är en funktion av dess diameter jämfört med den sfäriska cell,', 'vilken är en funktion av diameterns tvärsnittsarea, sã att en större', '40', 'cell erfordras för att motstà samma tryck.']"
11,"['353237', 'Det är opraktiskt att utnyttja kemiska reaktionsämnen för .att', 'stegra trycket inifrän, med undantag för ästadkommande av den huvud-', 'sakliga, inledande trycknivan, eftersom detta är en endagängs-metod.', 'Emellertid kan upphettning av ett reaktionsämne inifrán tillgripas', '5', 'för astadkommande av tryckeffekten genom dess expansion. För detta', 'ändamal kan ett lämpligt ändamäl placeras och upphettas elektriskt,', 'och kylas oberoende av provkroppsmaterialet.', 'Emedan cellens funktion är beroende av variation och reglering', 'av trycket i varje ringformig sektion oberoende, är hydrauliska me-', '10', 'del anordnade utvändigt, emedan sãdana är bekvämt och enkelt varier-', 'bara.', 'Fig. 6 visar mera i detalj en tryckappliceringscylinde: 126 via', 'ett mothall 124 sãsom tidigare. Det ringformiga fodret 120, vilket', 'sättes under tryck genom fluidet 122, har en serie öppningar för', '15', 'mottagande av kilarna och kan även applicera tryck pã det partikel-', 'formiga materialet intill höljet 104.', 'Det inses, att genom denna anordning kan i följd anbringande', 'av tryck astadkommas utefter anordningens längd, varvid det partikel-', 'formiga materialet säkerställer jämn och kontinuerlig avledning av', '20', 'trycket utât frän den axiella kärnan. Trycken kan sãlunda vara sã', 'anordnade, att därigenom säkerställes en naturlig vagbildning utef-', 'ter röret, varigenom astadkommes en rörelse framät hos en provkropp,', 'som införes under ett pã förhand bestämt minimitryck i apparaten.', 'Denna tryckvägrörelse kan vara sã anordnad att den ästadkommer', '25', 'axiell rörelse hos provkroppen eller ocksã kan provkroppen lämnas in', 'situ och behandlas med högt tryck i följd utefter huvudsakligen', 'hela sin längd, för att därefter avlägsnas ur anordningen.', 'Det inledningsvis i cellen râdande trycket (under icke-ström-', 'ning-tillständ) representeras grafiskt i fig. 7 - statiska friktions-', '30', 'krafter balanserar trycket.', 'Materialets flöde kan ernãs genom att man astadkommer att tryck-', 'avledningen i riktning mot anordningens inlopp genom det partikel-', 'formiga materialet är mindre frän en ringformig serie av tryckappli-', 'cerande organ, än stegringen mellan angränsande serier. Med andra', '35', 'ord uttryckt är tryckgradiensvagen i riktning framat större än tryck-', 'gradienten bakom toppen, och tryckdifferensen mellan de ringformiga', 'serierna i riktning framät är tillräcklig för astadkommande av flödet.', 'De inducerade serierna ""tryckvâgor"" visas grafiskt i fig. 9,', 'med deras momentana toppar vid P, P3, P5. I fig. 8 är tryckfallet', '40', 'eller- gradiensen 01 otillräcklig för att âstadkomma flöde at vänster', 'eller at inloppet, under det att 02 är tillräckligt stor för att']"
12,"['12', 'övervinna den statiska friktionskraften och därvid finnes tillräcklig', 'kraft för att âstadkomma ett lokalt, dynamiskt tillständ - eller att', 'âstadkomma flöde utefter cellen.', 'Fran den parallella delen - en region med huvudsakligen konstant', '5', 'tryck, där den &syftade reaktionen eller behandlingen av materialet', 'äger rum - börjar trycket falla vid B. Linjen B - D representerar den', 'minimala gradiensen för cke-flöde""-tillstând. Gradienten B - C', 'är', 'otillräckligt, men med BE âstadkommes flöde. Astadkommande av en vãg', 'BFGHIJ kommer även att tillata flöde att äga rum.', '10', 'De streckade linjerna med toppar Pl, P4, P6 representerar annat', 'läge hos vâgen.', 'Det inses även, att utefter rörets längd kan trycket uppbyggas,', 'upprätthällas och därefter graduellt eller plötsligt upphävas eller', 'byggas upp och upphävas utan nãgon upprätthällande period. Därigenom', '15', '&stadkommes ett vidsträckt omrade av operationsförhâllanden, vilka', 'kan anordnas relativt lätt med varje som helst speciell anordning,', 'utförd enligt uppfinningen.', 'I alla utföringsformer astadkommes genom användning av det par-', 'tikelformiga materialet sãsom direkt eller underlagsmaterial att ej', '20', 'plötslig diskontinuitet och âtföljande svaghet i tryckapplicerings-', 'och tryckhöjnings- och/eller avledningsmediet uppstar. Aven astadkom-', 'mes därvid anordning för kontinuerlig matning av provkroppar genom', 'anordningen, företrädesvis frän axeln pã lägtryckssidan.', 'Vid praktisk drift kan alla lämpliga förfaranden för förkompres-', '25', 'sion och slutlig kompression utnyttjas.', 'Av ovanstäende inses, att vidsträckt variation i detali kan', 'tillämpas, utan att uppfinningstanken frängas.', 'Särskilt beträffande det förhällandet, att tryckgradienten kan', 'plötsligt eller gradvis alstras, bibehallas och friges, är det tyd-', '30', 'ligt, att en kontinuerligt opererande cykel kan utnyttjas för fram-', 'ställning av syntetiska diamanter av kolhaltigt material, vilket in-', 'föres under positivt tryck.', 'Vid mera vidsträckt användning av cellen kan höljets ytterände', 'förses med ett väl understött munstycksaggregat för reduktion av', '35', 'stangen eller för framställning av sina tradar eller för astadkomman-', 'de av sprutgjutning med manga tvärsnittsformer.', 'I en ytterligare utföringsform tillföres fina tradar tillsammans', 'med ett granulatmaterial, vilket hoptryckes och behandlas för fram-', 'ställning av ett kompositmaterial med armering.', '40', 'Även kan röret sprutgjutas tillsammans med materialet och kon-', 'tinuerligt ersättas, eller ocksà kan röret utmatas tillsammans med']"
13,"['353237', 'och det partikelformiga materialet kan kontinuerligt införas under', 'tryck runt provkroppsmaterialet.']"
14,"['14', 'Patentkrav', '1. Förfarande för att i ett yttre hölje alstra och/eller hâlla', 'och/eller reglera ett högt tryck för att utsätta ett arbetsmaterial', 'för detta, varvid i höljet finnes en i mittpartiet anordnad reaktions-', 'zon för det arbetsmaterial, som skall utsättas för trycket, samt me-', 'del för att bibringa reaktionszonen komprimerande tryck, k ä n n e -', 't e c k n a t av att man inbäddar tryckalstringsmedlen och reaktions-', 'zonen i en helt utfyllande fyllnadsmaterialmassa med lâg draghall-', 'fasthet, kapabel att överföra och avleda högt tryck, varvid man ut-', 'nyttjar materialets inre friktion samt massans inneboende geometri', 'för avledning av tryckenergin i sãdan grad att denna lätt kan upptagas.', '2. Förfarande enligt krav 1, k ä n n e t e c k n a t av att ma-', 'terialmassan utgöres av ett partikelformigt material.', '3. Förfarande enligt krav 1 eller 2, k ä n n e t e c k n a t', 'av', 'att man förkomprimerar materialmassan samt därefter alstrar ytter-', 'ligare tryck i eller vid reaktionszonen samtidigt som fyllnadsmateriale.', 'bibehälles i förkomprimerat tillständ.', '4. Förfarande enligt nãgot av föregãende krav, k ä n n e t e e', 'k-', 'n', 'a t av att man âstadkommer förkomprimeringen genom att man applice-', 'rar tryck pa en serie stela tryokstegringskroppar, vilka är inbäddade', 'i fyllnadsmaterialet.', '5. Förfarande enligtkrav 4,känneteckna t av att de', 'stela kropparna är symmetriskt belägna kilar (6,10) med inbördes sam-', 'ma form.', '6. Anordning för att genom förfarande enligt nâgot av kraven 1-5', 'i ett yttre hölje alstra och/eller hâlla och/eller reglera högt tryck', 'för att utsätta ett arbetsmaterial för detta, varvid i höljet (A; 5;', '40,44) finnes en i mittpartiet anordnad reaktionszon (C,D,E; 1,2) för', 'det arbetsmaterial, som skall utsättas för trycket, samt medel för', 'att bibringa reaktionszonen komprimerande tryck, k ä n n e t e c k-', 'n a d av att utrymmet mellan reaktionszonen och höljet är fyllt med', 'ett fyllnadsmaterial (4; 41,42,43; 110), vilket ej är lättrörligt', '(fluid) under normala förhällanden och är deformerbart när det utsättes', 'för nämnda höga tryck, varvid tryckalstringsmedlen är belägna nära', 'reaktionszonen och/eller vid höljets periferi.', '7. Anordning enligt krav 6, k ä n n e t e c k n a d av att fyll-', 'nadsmaterialet bestär av bly eller av partikelformigt material sãsom', 'sand eller av stal vid förhöjd temperatur eller förhöjt tryck och/eller', 'av ett normalt mycket duktilt material.']"
15,"['15', '8. Anordning enligt krav 7, k ä n n e t e c k n a d', 'av att', 'partiklarna är av olika storlek.', '9. Anordning enligt krav 7 eller 8, k ä n n e t e c k n a d av', 'att det partikelformiga materialet är graderat, keramiskt material.', '10. Anordning enligt krav 1, k ä n n e t e c k n a d av att fyll-', 'nadsmaterialet bestar av en blandning av tva, flera eller samtliga av', 'de partikelslag som anges i kraven 8 eller 9.', '11. Anordning enligt nãgot av kraven 6-10, k ä n n e t e c k n a', 'd', 'av att reaktionszonen är beklädd med ett deformerbart, värmebeständigt', 'material.', '12. Anordning enligt nãgot av kraven 6-11, k ä n n e t e c k n a d', 'av organ för komprimering av fyllnadsmaterialet.', '13. Anordning enligt nágot av kraven 6-12, k ä n n e t e c k n a d', 'av i eller vid reaktionszonen anbragta tryckalstringsorgan.', '14. Anordning enligt krav 13, k ä n n e t e c k n a d av att', 'tryckalstringsorganen star i förbindelse med reaktionszonen genom en', 'ledning, anordnad att överföra det alstrade trycket, gande genom fyll.', 'nadsmaterialet.', '15. Anordning enligt nãgot av kraven 6-14, k à n n e t e c k n a d', 'av att höljet har huvudsakligen sfärisk form.', '16. Anordning enligt nâgot av kraven 6-15, k à n n e t e c k n a d', 'av att höljet har avlang, cylindrisk form med ett med invändig bekläd-', 'nad anordnat lopp utgörande en reaktionszon.', '17. Anordning enligt krav 16, k ä n n e t e c k n a d av en', 'serie', 'ringformigt anordnade tryckpaverkningsorgan samt anordning för till-', 'förande och bortförande av material genom loppet.', '18. Anordning enligt krav 15, k ä n n e t e c k n a d av att krop-', 'parna (10) för stegring av det alstrade trycket har gradvis varierande', 'tvärsnittsform.', '19. Anordning enligt krav 18, k ä n n e t e c k n a d av att krop-', 'parna (10) utgöras av en serie i sidled inbördes angränsande kilar.', '20. Anordning enligt krav 19, k ä n n e t e c k n a d av att', 'kilarna har konisk form.', '21. Anordning enligt krav 19, k ä n n e t e c k n a d av att', 'kilarna är rundade samt har sidor med bâgformig, utformning.', '22. Anordning enligt krav 21, k a n n e t e c k n a d av att', 'kilarna har cirkulärt tvärsnitt.', '23. Anordning enligt nãgot av kraven 19-22, k ä n n e t e c k n a c', 'av att kilar av nämnt slag med inbördes angränsande längdledsaxlar är', 'anordnade, hos vilka storleken är avtagande i riktning mot reaktions-', 'zonen.']"
16,"['16', '24. Anordning enligt krav 13, k ä n n e t e c k n a d av att', 'tryckalstringsorganen innefattar ett eller flera av följande alter-', 'nativ:', 'a) kraftdrivna arbetscylindrar,', 'b) explosiva laddningar,', 'c) kylanordning,', 'd) vibrationsanordning, eller', 'e) anordning för astadkommande av stötar,', 'f) hydrauliska tryckdomkrafter.', 'ANFÖRDA PUBLIKATIONER:', 'Tyskland 1 251 280 (12g:2/01)', 'USA 3 238019 (23-209,1)']"
17,"['G', 'H', 'A', 'B', 'D', 'C', 'E', 'F', 'FIG.', '1.', '12', 'II', '14 13', '9', '22', '20', '4', 'Q', '10', '14', '6-', '0', '0', '2', '1', 'D', '-6-', '7', '3', '8', '6', ""9'"", '8', '18', '5', '10', '21 13', '8', '8', '12', '15', '4', '19 17', '16', 'FIG. 2.']"
18,"['5', '-9-', '-14-', '13', '-6-', '12', 'FIG. 3.', '4', '44', '42', 'o:', '41', '46', '40', '45', '43', '46', 'FIG. 4.']"
19,"['108', '112', '114', '116', '110', '106', '104', '102', '100', '110', '126', '108', 'FIG. 5.', '126', '128', 'pt', '130', '104', '120', 'FIG. 7.', '122', '124', '110', '106', 'of', '92', 'FIG. 8.', 'FIG. 6.', 'B', 'Ps Pc', 'P3 P4', 'F', 'G', 'P', 'P,', 'I', 'H', 'A', 'AXIAL LENGTH', 'E DJC', 'FIG. 9.']"
