PageNo,Text
10,"['10', '0021172', 'är en korrugerad, med vartor försedd eller en etsad skiva önskvärd.', 'Eftersom kylplattan företrädesvis ligger i kontakt i olika punkter', 'med elektrodytan kommer skivan även att tjänstgöra sãsom en uttags-', 'klämma för den elektriska ström, som alstras.', 'Även om endast en utföringsform av värmeväxlaren, luftfuktaren, koldi-', 'oxidrenaren, luftutsläppningsventilen och andra element beskrivits torde', 'det vara uppenbart att anordningar av annan konstruktion kunna utnyttjas', 'sã länge de utföra den erforderliga funktionen. Sadana modifikationer', 'äro uppenbara för fackmannen.', 'En typisk anordning av det aktuella slaget har följande data:', 'Stapel', 'Nettoeffekt, watt', '500', 'Bruttoeffekt, watt', '600', 'Spänning, volt', '28,8', 'Ström, amp.', '20,8', 'Bränslecell', 'Cellspänning, volt', '0,8', 'Strömtäthet, A/cm²', '0,1677', 'Elektrolyt koncentration, viktprocent KOH', '30', 'Aktiv elektrodstorlek, cm', '11,4 . 11, 4', 'Arbetstemperatur, max °C', '71', 'Förbrukning g O intagsluften', '0,4', 'Verkningsgrad,', 'lettoeffekt/bränsleförbrukning x LHV H2', '54,0', 'Antal seriekopplade cellstaplar', '36', 'Antal celler/stapel', '12', 'Total vikt för 3 stycken 2-cellstaplar, kg 9,53', 'Stapeldimensioner', 'längd, cm', '13,2', 'bredd, cm', '15,24', 'höjd, cm', '15,24', 'Givetvis är uppfinningen icke begränsad till de speciella utföringsfor-', 'mer och konstruktionsmaterial, som angivits för att âskädliggöra upp-', 'finningen utan att modifikationer kunna utföras inom ramen för efter-', 'följande patentkrav.', 'PATENTKRAV', '1. Bränslecellbatterianordning, innefattande ett bränslecellbatteri', 'bestäende av en stapel av ett flertal tunna och flata, med en kylvätska']"
11,"['kylda bränsleceller, vardera innehällande en elektrolyt i en matris,', 'som är placerad mellan en tunn luft- och en tunn väteelektrodplatta,', 'varvid nämnda plattor stà i direkt värmeledande kontakt med var sin', 'kylplatta av metall med däri ingaende kylmedelskanale: sã utformad och', 'anordnad, att en väte- och en luftkammare bildas mellan kylplattan och', 'respektive elektrod, varvid cellerna äro sã staplade, att mellan tva', 'kylplattor i var sin av tva varandra intilliggande celler bildas en smal', 'kanal för kylvätskan, k ä n n e t e C k n a d av att anordningen har en', 'kylkrets vari ingar en expansionstank (82) för kylmediet och en pump (27)', 'en första reglerbar shuntningsanordning (24,80) med en ledning som bil-', 'dar en passage för ledning av kylmedlet förbi en luftkonditionerings-', 'och befuktningsanordning (23), en shuntventil (24), som är styrd av en', 'termostat (80) sã att densamma riktar strömmen av kylmedium till luft-', 'konditionerings- och befuktningsanordningen (23) eller genom nämnda för-', 'bigängspassage för kylmediet, en värmeväxlare (70), som är utsatt för', 'den omgivande atmosfären, en andra reglerbar shuntningsanordning (71,72)', 'för kylmediet med en ledning, som bildar en passage för ledning av kyl-', 'mediet förbi värmeväxlaren (70), en termostat (72), som är anordnad i', 'kretsen för att avkänna temperaturen hos kylmediet vid kretsens kylme-', 'dieinlopp och en reglerbar förbigängsventil, som är styrd av termosta-', 'ten (72) sã att densamma riktar strömmen av kylmedium genom värmeväxla-', 'ren (70) eller sistnämnda förbigängspassage för kylmediet för att ge', 'det cirkulerande kylmediet vid nämnda inlopp ett pa förhand bestämt tem-', 'peraturtillstând, samt att anordningen vidare uppvisar en matarkrets för', 'processluft, vari luftbefuktningsanordning (23) för konditionering och', 'befuktning av luften ingär, vilken senare anordning (23) har ett luft-', 'inlopp (41) och ett luftavlopp (42), en vattenreservoar (48), aluminium-', 'plattor (43) klädda med ett absorberande vekematerial, vilket material', 'sträcker sig till bottnen av vattenreservoaren (46), varvid nämnda re-', 'servoar är tillsluten medelst en tätning (47) och aluminiumplattorna', '(43) äro försedda med ett antal kanaler, genom vilka kylmediet ledes i', 'beroende av temperaturen hos den luft, vars temperatur avkännes av den', 'förstnämnda termostaten (80) i luftavloppet (45) och styr shuntventilen', '(24), sã att denna upprättar en pa förhand bestämd temperatur och rela-', 'tiv fuktighet hos luften, samt vidare en luftkompressor (21), som är', 'försedd med ett luftintagsfilter (20) och är sã inställbar att den ger', 'luften en konstant strömningshastighet, ett snabbtömningsreglage (22)', 'innefattande en proportionalelektromagnet (38), som är paverkbar pa sã-', 'dant sätt, att den förflyttar ventilen frän öppet till stängt läge med', 'ökande belastning pa bränslecellstapeln i och för upprättande av en pa', 'förhand bestämd förängningshastighet för produktvatten frän ytan av den', 'oxiderande elektroden och ett likformigt avlägsnande av produktvatten', 'frän cellstapeln.']"
12,"['12', '0021172', '2. Bränslecellsysten enligt krav 1, k ä n n e t e C k n a d av att en', 'elektrisk värmare (28) är anordnad i kylmediekretsen strax intill kyl-', 'mediekanalerna (15) i bränslecellstapeln för ökande av temperaturen hos', 'kylmediet, särskilt under igangsättningsperioder när den omgivande tem-', 'peraturen är speciellt lâg.', '3. Bränslecellsystem enligt krav 1 och 2, k ä n n e t e C k n a d av', 'att matarkretsen för processluft innefattar en koldioxidskrubber (25),', 'insatt mellan luftbefuktnings- och konditioneringsanordningen (23) och', 'bränslecellstapeln för att förhindra mindre mängder koldioxid i luft-', 'strömmen att inkomma i bränslecellstapeln.', 'ANFÖRDA PUBLIKATIONER:', 'Frankrike 1 456 971', 'Tyskland 1 128 898 (21 b:14/01)', 'USA 3 172 784 (136-86)']"
13,"['FIG.1', '10', 'V', 'V', '+', 'KYL-', 'KOH', 'H2', 'LUFT', 'medel', '+', 'H2O', '82.', '29', 'V', '28', '27 722', '71', 'V', '002-', 'O', 'RENARE', '-25', '80', '45', '70', 'V', 'T', '49', '23', '24', 'V', '20', 'H2O', 'VI', '48', ',', '21', 'M', '41', 'V', '22', '43', 'to', 'FIG.3', '31', '30', '35', '34', '33', '37', '36', '38', '32']"
14,"['FIG.5', '49', '-61', '43', '48', '42', '23', '44', '64', 'e', '000', '62', '47', '46', 'FIG.6', '9', '63', 'I', '2', '29', '7', '3', '11.', '6', '5', '8', '@', '23', 'FIG.Z', '8', '8', '43', '5', '45', 'FIG.4', '41', ""46 47'"", '5', '!']"
