PageNo,Text
1,"['UTLÄGGNINGSSKRIFT nr 360 121', 'Int CI', 'C 23 g 1/00', 'P.ans. nr', '1307/72', 'Inkom den 4 II 1972', 'Giltighetsdag den', '4 II 1972', 'PATENT- - OCH', 'Ans. allmänt tillgänglig den', '5 VIII 1973', 'REGISTRERINGSVERKET', 'Ans. utlagd och utläggnings-', 'skriften publicerad den', '17 IX 1973', 'Prioritet', 'ej begärd', 'SALÉN & WICANDER AB, SUNDBYBERG, SVERIGE', 'Uppfinnare: B H Stenström, Enebyberg, Sverige och 0 A Andresen, Oslo,', 'Norge', 'Ombud: G Wennborg', 'Sätt att vid renspolning av behallare för explosiva ämnen, särskilt', 'fartygstankar, reducera explosionsrisk till följd av bildning av statisk', 'elektricitet samt anordning för tillämpning av sättet', 'I samband med rengöring av exempelvis lastoljetankar pã', 'fartyg med hjälp av spolaggregat under användning av lämplig ren-', 'göringsvätska alstras statisk elektricitet med finfördelade vätske-', 'droppar som bärare. Dessa vätskedroppar fyller tankvolymen med en lätt', 'dimma, och dropparnas storlek är sâdan att de förblir fritt svävande', 'under avsevärd tid.', 'Föreliggande uppfinning har till ändamäl att med enkla medel', 'reducera mängden finfördelade droppar och därmed även risken för gnist-', 'urladdningar frän den statiska elektriciteten, som är en potentiell', 'orsak till antändning resp. explosion i gashaltig atmosfär.', 'Uppfinningen avser sãlunda ett sätt att vid renspolning av', 'behâllare för explosiva ämnen, särskilt fartygstankar, reducera explo-', 'sionsrisk till följd av bildning av statisk elektricitet pa vid spol-', 'ningen alstrade finfördelade vätskedroppar, som i form av en lätt dimma', 'fyller behâllaren. Det för uppfinningen väsentligen tännetecknande är', 'att i behällaren skapas en temperaturgradient mellan dimman och ett', 'ytterligare ämne eller föremäl, sã att kondensationskärnor av lägre', 'temperatur än dimman alstras för i denna ingaende vätskedroppar.', 'Dupl.kl. C 23 g 3100']"
2,"['2', 'Genom den skapade temperaturgradienten bringas sâlunda vätske-', 'dimman att kondensera, varvid de elektriska laddningarna kontinuerligt', 'föres till jord och uppbyggnad av elektrostatiska laddningar av farlig', 'storleksordning förhindras.', 'Vid tillämpning av sättet enligt uppfinningen kan i behällaren', 'sprinklas ett regn av vattendroppar, som har lägre temperatur än vätske-', 'dimman. I praktiken kan detta uppnãs endera genom att spolvätskan som', 'tillföres tanken är uppvärmd, under det att sjövatten av râdande tem-', 'peratur användes i sprinklingssystemet. Alternativt kan spolvätska av', 'râdande temperatur användas i spolsystemet under det att vatten som till-', 'föres sprinklingssystemet nedkyles pa lämpligt sätt. Det är härvid', 'väsentligt att vattnet via sprinklingssystemet tillföres i jämförelsevis', 'stora droppar och med lag hastighet, sã att statisk elektricitet ej', 'alstras i själva sprinklingsanordningen. Ett annat sätt att uppnã den', 'önskade effekten är att genom lämpliga munstycken i behällaren inspruta', 'ett nedkylt ämne sãsom exempelvis kolsyresnö.', 'Vid ett ytterligare tillämpningssätt installeras kylslingor i', 'behällaren eller anordnas en eller flera pa lämpligt sätt utbildade', 'metallytor, som bringas inta lägre temperatur än tankatmosfären.', 'Uppfinningen avser även en anordning för tillämpning av det', 'uppfinningsmässiga sättet, vilken anordning väsentligen kännetecknas av', 'organ för skapande av en temperaturgradient mellan vätskedimman och ett', 'ytterligare ämne eller föremal i behâllaren, sã att kondensationskärnor', 'av lägre temperatur än dimman alstras för i denna ingaende laddade', 'vätskedroppar.', 'Anordningen innefattar vidare företrädesvis organ för indike-', 'ring av förekomst av vätskedimma, sã att möjlighet beredes till en', 'bestämning av huruvida explosionsrisk är förhanden. Indikeringsorganet', 'kan lämpligen arbeta pa optisk väg och bestà av ett exempelvis i be-', 'hallarens överdel anbragt ljusemitterande element sãsom en glödlampa', 'samt ett detekteringselement sãsom en fotocell, som avkänner de utsända', 'ljusstrâlarnas reflektion mot vätskedimman i behällaren. Da fotocellen', 'registrerar otillräcklig reflektion innebär detta att väsentligen samt-', 'liga vätskepartiklar i dimman kondenserats till följd ay den alstrade', 'temperaturgradienten, och att följaktligen explosionsrisken undanröjts.', 'Vid ett exempel pã uppfinningens tillämpning är var och en', 'av lasttankarna i ett tankfartyg försedda med en renspolningsanordning']"
3,"['360121', 'av det slag som är beskrivna i det svenska patentet 307.719 med tilläggs-', 'patentet 331.937. Vidare är i tanken anordnat ett med en kylanordning', 'samverkande sprinklingssystem för att i tanken sprinkla ett regn av', 'vattendroppar med en lägre temperatur än den vattendimma som bildas', 'vid tankens renspolning. Därtill är i tankens överdel anordnad en optisk', 'indikeringsanordning som innefattar ett mot tankens botten riktat ljus-', 'utsändande organ samt en fotocell anordnad att indikera ljusreflektion', 'frân i tanken eventuellt förekommande vattendimma.', 'Vattnet frän sprinklingssystemet tillföres i relativt stora', 'droppar med lag hastighet, varvid statisk elektricitet ej alstras vid', 'sprinklingsoperationen. Den av sprinklingssystemet alstrade temperatur-', 'gradienten i tanken medför att den av spolningsanordningen alstrade', 'vattendimman bringas att kondensera, varvid statisk elektricitet med', 'de finfördelade vattendropparna som bärare kontinuerligt föres till jord', 'och uppbyggnad av elektrostatiska laddningar av farlig storleksordning', 'förhindras. En indikation av huruvida explosionsrisk föreligger erhälles', 'pa optisk-elektrisk väg av den ovan angivna indikeringsanordningen.', 'Vid en modifikation av anordningen samverkar sprinklings-', 'systemet icke med nágon kylanordning. I stället är den till spolnings-', 'anordningen tillförda vätskan uppvärmd.', 'Vid ytterligare en modifikation är en kylslinga anordnad', 'i', 'anslutning till tankväggen, sã att väggen erhäller reducerad temperatur', 'i förhällande till vätskedimman. Enligt en tredje modifikation inblises', 'kalluft i tanken i anslutning till renspolningsoperationen.', 'Vid en ytterligare modifikation är tanken försedd med lämpliga', 'munstycken, genom vilka kolsyresnö insprutas.', 'Ovanstäende exemplifiering ger vid handen att uppfinnings-', 'tanken är tillämpbar pa olika sätt. Ett flertal andra möjligheter att', 'tillämpa uppfinningen än de ovan angivna erbjudes.', '5.']"
4,"['4', 'Patentkrav', '1.', 'Sätt att vid renspolning av behâllare för explosiva ämnen,', 'särskilt fartygstankar, reducera explosionsrisk till följd av bildning', 'av statisk elektricitet pa vid spolningen alstrade finfördelade vätske-', 'droppar, som i form av en lätt dimma fyller behällaren, k ä n n e -', 't', 'e e k n a t av att i behällaren skapas en temperaturgradient mellan', 'dimman och ett ytterligare ämne eller föremal, sã att kondensations-', 'kärnor av lägre temperatur än dimman alstras för i denna inglende vätske-', 'droppar.', '2.', 'Sätt enligt krav 1, k ä n n e t e c k n a t av att i behâlla-', 'ren sprinklas ett regn av vattendroppar av lägre temperatur än vätske-', 'dimman.', '3.', 'Sätt enligt krav 2, varvid spolvätskan bestar av sjövatten', 'eventuellt med kemikalietillsatser, som uppvärmes innan behällaren ren-', 'spolas, k à n n e t e c k n a t av att i behâllaren sprinklas sjövatten', 'av râdande temperatur.', '4.', 'Sätt enligt enligt krav 1,k ä n ni e t e e k n a t av att i', 'behâllaren sprinklas kolsyresnö.', '5.', 'Sätt enligt krav 1, k à n n e t e c k n a t ay att i behalla-', 'ren installeras kylslingor eller andra metallytor, vilka bibringas lägre', 'temperatur än behâllaratmosfären.', '6.', 'Sätt enligt krav 1, k à n n e t e e k n a t av att i behâlla-', 'ren inblâses kalluft.', '7.', 'Anordning för tillämpning av sättet enligt nâgot av krav 1-6,', 'innefattande organ för renspolning av en behâllare för explosiva ämnen,', 'särskilt en fartygstank, varvid föreligger explosionsrisk till följd av', 'bildning av statisk elektricitet pa vid spolningen alstrade finfördelade', 'vätskedroppar, som i form av en lätt dimma fyller behällaren, k ä n n e -', 't e c kn a d av organ för skapande av en temperaturgradient mellan', 'vätskedimman och ett ytterligare ämne eller föremäl i behällaren, sã att', 'kondensationskärnor av lägre temperatur än dimman alstras för i denna', 'inglende laddadevätskedroppar.', '8.', 'Anordning enligt krav 7, k à n n e t e c k n a d av organ för', 'indikering av förekomst av vätskedimma i ändamäl att bestämma den', 'tidpunkt da explosionsrisken är undanröjd.']"
5,"['5', '9.', 'Anordning enligt krav 8, k ä n n e t e c k n a d av att', 'indikeringsorganet innefattar ett ljusutsändande element, t.ex. en', 'glödlampa samt ett detekteringselement, t.ex. en fotocell, anordnat', 'att avkänna de utsända ljussträlarnas reflektion mot vätskedimman i', 'behällaren.', 'ANFORDA PUBLIKATIONER:']"
