PageNo,Text
1,"['UTLÄGGNINGSSKRIFT nr 360 923', 'Int CI', 'F 25 b 29/00', 'P.ans. nr', '17833/69', 'Inkom den', '23 XII 1969', 'Giltighetsdag den', '23 XII 1969', 'PATENT- OCH', 'Ans. allmänt tillgänglig den', '27 VI 1970', 'REGISTRERINGSVERKET', 'Ans. utlagd och utläggnings-', 'skriften publicerad den', '8 X 1973', 'Prioritet begärd frän den 26 XII 1968', '(USA, 786 941)', 'AMERICAN AIR FILTER COMPANY, INC., JEFFERSON, KY. USA', 'Uppfinnare: R W Pond, Bethel Park, Penn.', 'Ombud: E Ferkinghoff', 'Luftkonditioneringsanordning', 'Föreliggande uppfinning avser en med kompression och kon-', 'densation arbetande, temperaturstyrande anordning med en evapora-', 'tor för att kyla luft, som passerar genom anordningen, till en', 'första temperatur och med uppvärmningsorgan för att âteruppvärma', 'den kylda luften.', 'Vissa arbeten, t.ex. bearbetning av smà metalldelar', 'för passning med mycket sma toleranser, har tidigare försvárats', 'genom närvaron av smuts och andra luftburna föroreningar i om-', 'givningen av de lokaler, där arbetet utföres. Behovet i hög grad', 'av renhet i sádana lokaler har blivit mycket stort. Det har', 'emellertid hittills varit svärt att upprätthâlla temperaturen', 'i ett rum med mycket smà fluktuationer av mánga olika orsaker.', 'En orsak är att endast ringa värme alstras i ett sãdant utrymme', 'och en annan orsak är att det omgivande rummet vanligen är be-', 'läget i ett större utrymme. Vidare passerar litet eller inget', 'värme genom väggarna i det omgivande rummet, vilket gör det svârt', 'att hálla temperatur och fukt i sãdant omgivande rum inom de', 'Dupl. kl. F 24 f 5/00; F 24 h 9/20']"
2,"['2', 'trânga toleranser, som vanligen skall upprätthällas. Det är emel-', 'lertid för vissa arbeten av väsentlig betydelse, att temperaturen', 'i ett sadant omgivande rum hâlles inom gränser pa en tiondels', 'grad över och under den i förväg valda temperaturen.', 'Tidigare kända temperaturstyranordningar har icke varit', 'effektiva för upprätthällande av temperaturen i det omgivande rum-', 'met inom de föreskrivna gränserna och de har därför icke varit', 'tillfredsställande. Det torde emellertid framga för envar fack-', 'man, att anordningen enligt föreliggande uppfinning är i stand', 'att upprätthâlla temperaturer i ett omgivande rum inom mycket', 'snäva, i förväg valda temperaturgränser.', 'Uppfinningen kännetecknas för detta ändamál av en be-', 'hállare för upptagande av varmt, under tryck stande köldmedium', 'och av ledningar för att leda varmt, gasformigt köldmedium till', 'denna behâllare frán en kompressor och frän behällaren till upp-', 'värmningsorganet. Övriga kännetecken pa uppfinningen framgar av', 'underkraven.', 'Uppfinningen skall i det följande närmare förklaras med', 'hänvisning till den bifogade ritningen, varà visas schematiskt', 'en temperaturstyranordning enligt uppfinningen för ett omgivande', 'rum.', 'Pa ritningen visas schematiskt en anordning 11 för styr-', 'ning av temperaturen i ett omgivande rum, som uppvärmes eller', 'kyles medelst en luftström, vilken strömmar i riktning av pilarna', 'A in i rummet (ej visat), t.ex. ett rent rum eller annat bostads-', 'utrymme.', 'En kompressor 15 av det slag, som användes vid luftkondi-', 'tioneringsanordningar komprimerar ett lämpligt, gasformigt köld-', 'medium, som strömmar till kompressorn i en köldmediumsugledning', '13. Kompressorn 15 komprimerar köldmedlet, vilket kan bestá av', 'Freon-22 eller liknande, till ett i förväg valt tryck och den', 'komprimerade varma köldmediungasen strömmar frân kompressorn 15', 'genom ledningen 17 in i en vanlig kondensor 19, som är försedd', 'med en fläkt 21, vilken arbetar under styrning av en värmeav-', 'kännare 23 och en strömställare TS-1. Under styrning av värmeav-', 'kännaren 25 blaser fläkten 21 luft över kylspiralerna i kondensorn', '19, när temperaturen hos köldmedlet i ledningen 25 överstiger', 'ett i förväg valt värde. Det gasformiga köldmedlet kondenseras']"
3,"['360923', 'till en vätska i kondensorn 19.', 'Det under tryck försatta, vätskeformiga köldmediet ström-', 'mar därefter i ledningen 25 genom en jälvreglerande tryckstyr-', 'ventil TCV-3, som styr flödet av köldmedium inom ett i förväg', 'valt tryckomräde. Den vätskeformiga köldmediumströmmen införes', 'därefter i en vanlig mottagaranordning 27.', 'Frän mottagaranordningen 27 strömmar köldmedium i led-', 'ningen 29 genom en vanlig termisk expansionsventil 31 och in i', 'en fördelare 33 för det vätskeformiga köldmediet, vilken för-', 'delare leder köldmediet in i en direkt expansionskylspiral 35.', 'En sugledningsavkännare 37 star i fluidumförbindelse med den', 'termiska expansionsventiler 31 för att reglera och styra denna.', 'Vidare är en tryckströmställare PS-2 anordnad i ledningen 29 för', 'att styra trycket i denna.', 'Vätskeformigt köldmedium, som införes i den direkta', 'expansionskylspiralen 35, star under betydande tryck, men i kyl-', 'spiralen 35 kommer det vätskeformiga köldmediet att vid reducerat', 'tryck och temperatur förängas med inât riktat köldmediumvärme-', 'flöde och blir köldmediumänga. Köldmediumängan lämnar kylspiralen', '35 genom ledningen 13 och âterföres till kompressorn 15, där det', 'ângformiga köldmediet komprimeras och cykeln pabörjas ânyo.', 'Luft, som strömmar i riktning av pilarna B över kylspi-', 'ralen 35, avger värme till den kalla förângningsspiralen 35, som', 'innehäller det ângformiga köldmediet. Denna luft kyles till en', 'temperatur av ca 7°c, vilken luft är alltför kall för att införas', 'direkt i ett rent rum eller liknande bostadsutrymme, sãsom för-', 'klarats i det föregãende. Sálunda är det nödvändigt att uppvärma', 'sádan kall luft till en temperatur av ca 19°C och det är vanligen', 'önskvärt och nödvändigt att hâlla sãdan luft inom ett omràde av', '+ 0,1° fran den önskade temperaturen pà 19°C eller annan vald', 'temperatur.', 'Tidigare kända varmgasshuntsystem, vilka är tillgängliga', 'pa marknaden, styr blott tryck och temperatur, hos köldmediet vid', 'expansionskylspiralen 35. Flödet av varmt gasformigt kylmedel till', 'kylspiralen 35 âstadkommes genom ledningar 39 till en shuntregulator', 'SOL-1. Därefter strömmar det varma köldmediet genom ledningen 41', 'till tryckventilen PCV-2 och genom ledningarna 43, 13 och 45, som', 'direkt leder den varma gasen till eldningsdelen 47 i den termiska']"
4,"['4', 'expansionsventilen 31.', 'Pa marknaden tillgängliga varmgasshuntregulatorer, ..ex.', 'SOL-1, har ett omrâde av tryckvariationer pa 1-3 kg, vilket är all-', 'deles för litet för ästadkommande av noggrann temperaturstyrning', 'i ett styrt omgivande utrymme, t.ex. ettimätrum eller ett rent rum', 'av ovan beskrivet slag.', 'För att kompensera för dessa tryckvariationer har en', 'tryckpäverkad, automatisk omlänkningsventil PCV-1 anbragt i en', 'ledning 49, som star i förbindelse med ledningen 39 och en för-', 'rádsbehâllare 51 för varmt gasformigt köldmedium.', 'Med förràdsbehâllaren 51 för gasformigt köldmedium är', 'förbunden en blind tryckstyranordning PC-1, som star i förbindelse', 'med ventilen PCV-1 och behällaren 51 för att hâlla trycket i denna', 'behâllare 51 alltid i balans.', 'I vissa fall kunna ventilerna SOL-1 och PCV-1 om önskvärt', 'utgöras a direkt eller pilotmanövrerade, av tryck pâverkade ven-', 'tiler för fullständig modulering frân O till 100% av ventilernas', 'kapacitet.', 'Ventilerna SOL-1 och PCV-1 kunna även vara pneumatiskt', 'eller elektriskt manövrerade under förutsättning av att den an-', 'vända avkännaren kan âstadkomma en modulering frân O till 100%.', 'Det varma gasformiga köldmediet strömmar frân förräds-', 'behâllaren 51 genom ledningarna 53 och 55 till temperaturstyr-', 'ventilen TCV-1 och därefter genom ledningen 57 till en âterupp-', 'värmande spiral 59. En kontrollventil CKV-1 hindrar ström av varmt', 'köldmedium frân ledningen 41 in i behällaren 51. Ateruppvärmnings-', 'spiralen 59 kan även tjäna som en förvärmarspiral för en andra-', 'stegsâteruppvärmningsanordning (ej visad), som till sin funktion', 'liknar âteruppvärmningsspiralen 59 men som tjänar som slutgiltig', 'värmekälla, innan tempererad luft införes i det omgivande ut-', 'rymmet.', 'Sálunda passerar gasformigt köldmedium genom âterupp-', 'värmningsspiralen 59 och avlämnar där värmet till kall luft, som', 'strömmar över spiralerna. Luft, som strömmar ut ur âteruppvärm-', 'ningsspiralanordningen 59 i riktning av pilarna A, är nu uppvärmd', 'till en temperatur av 19°C.', 'Det kondenserade vätskeformiga köldmediet strömmar ut ur', 'âteruppvärmningsspiralen 59 genom ledningen 61 in i ledningen 25.']"
5,"['5', 'En temperaturstyravkännare 63 och en styranordning TC-1', 'är förbundna med âteruppvärmningsspiralen 59 och de styr tempera-', 'turen av den luft, som lämnar iteruppvärmningsspirale 59. En', 'sádan avkännare 63 och styranordningen TC-1 styr temperaturstyr-', 'ventilen TCV-1, sã att temperaturen hos den luft, som lämnar', 'âteruppvärmningsspiralen 59, hâlles inom det i förväg valda,', 'mycket snäva temperaturomrädet, dvs. inom + 0,1 o av den', 'valda', 'temperaturen. Idet här valda exemplet uppgar den i förväg valda', 'lufttemperaturen till 19°C.', 'Ateruppvärmningsspiralen 59 tjänar som temperaturstabili-', 'sator tack vare massan hos spiralen, som ej tillâter plötsliga', 'eller snabba förändringar i temperaturen hos den luft, som lämnar', 'âteruppvärmningsspiralen 59.', 'I en speciell anläggning, där mycket noggrann temperatur-', 'styrning är nödvändig och önskvärd och där en andra âteruppvärm-', 'ningsspiral användes, kan en sádan slutlig âteruppvärmningsspiral', 'uppvärmas med ânga, varmvatten eller elektricitet beroende av nog-', 'grannheten hos den önskade temperaturstyrningen i det omgivande ut-', 'rymmet.', 'I vissa fall kan även en angkylarventil TX-2 inkopplas', 'i sugledningen 13, om sã skulle vara önskvärt, där den tjänar', 'blott till att skydda kompressorn 15 frän höga temperaturer i', 'köldmediumsugledningen vilka skulle kunna uppträda, om ventilen', 'SOL=1 skulle bortfalla i öppet läge.', 'Av ovanstäende torde fackmän pà omrádet förstà mánga be-', 'tydande kännetecken och fördelar hos uppfinningen, bland vilka má', 'nämnas att en del av det under tryck försatta, gasformiga köld-', 'mediet strömmar in i en värmestralare och en tryckutjämnare för', 'köldmedium, sã att den vanliga kylkretsen fungerar vid i det', 'närmaste perfekt, icke varierande tryck och temperatur, vilket är', 'av vital betydelse för erhällandet av ett utrymme med noggrann', 'styrning av temperatur och fukt, att användningen av värmet i det', 'varma, under tryck försatta gasformiga köldmediet i avsevärd grad', 'uppvärmer den kylda luften, minskar energikostnaderna för vanliga', 'slutgiltiga âteruppvärmningsanordningar, oberoende av om dessa är', 'uppvärmda av ânga, varmvatten eller elektricitet. Ytterligare en', 'fördel är att se däri, att kylförmägan hos kondenseringsenheten,', 'som tidigare mâste uttagas i kylspiralen i avsevärd grad, minskas', 'samt att i uppfinningen, när total kylkapacitet icke är erforder-', 'lig pà grund av ett obelastat tillständ i omgivningen, överskotts-']"
6,"['6', 'kapacitet hos kompressorn avledes för att minska kyleffekten hos', 'spiralen, sã att därigenom anordningen blir billigare i drift och', 'mycket effektiv.', 'P a t e n t k r a V', '1. Med kompression och kondensation arbetande, temperatur-', 'styrande anordning med en evaporator för att kyla luft, som pas-', 'serar genom anordningen, till en första temperatur och med upp-', 'värmningsorgan för att âteruppvärma den kylda luften, k à n n e-', 't e c k n a d a V en behâllare (51) för upptagande av varmt,', 'under tryck stäende köldmedium och av ledningar (49, 53, 55) för', 'att leda varmt, gasformigt köldmedium till denna behâllare (51)', 'frän en kompressor (15) och frän behällaren till uppvärmnings-', 'organet (59)', '2. Anordning enligtkravet 1, k à n n e t e ckn a d', 'a V ventilorgan (PCV-1) för att styra trycket hos det gasformiga', ""köldmediet, som strömmar till behällaren (51), och 'av en tryck-"", 'kontrollanordning (PC-1), som stâr i förbindelse med det trycket', 'styrande ventilorganet (PCV-1) och behällaren (51), för att upp-', 'rätthilla trycket i behâllaren vid ett förutbestämt värde.', '3. Anordning enligt nâgot av föregäende krav, k à n n e-', 't e c k n a d d à r a v, att uppvärmningsorganet (59) bestär av', 'en värmespiral, som leder varmt, gasformigt köldmedium och längs', 'vilket organ (59) den kylda luften passerar.', '4. Anordning enligt nâgot av föregäende krav, k à n n e-', 't e c k n a d a V ventilorgan (TCV-1) för styrning av tempera-', 'turen hos det gasformiga köldmediet i uppvärmningsorganet (59)', 'och av temperaturen avkännande organ (63) i kontakt med luft,', 'som avges fran uppvärmningsorganet (59), vilka avkännarorgan', '(63) styr driften av det temperaturen styrande ventilorgan (TCV-1),', 'när temperaturen hos luften varierar utanför det förutbestända', 'temperaturomrádet.', 'ANFORDA PUBLIKATIONER:', 'USA 3 316 730 (62-173), , 3 362 184 (62-160)']"
7,"['17', '19', '25', '15', '23', '&', '21-', 'TS-/', '39', '13', 'PC-1', '11-1', 'SOL-I', 'PCV-1', '4/', 'PS-1', '49', '51', 'TX-2', 'CKV-1', '53', '-55', '43', '18', 'PCV-2', 'TCV-/', '45 37, -13', '57-', 'TC-1', '47', 'B', '13/33', '59-', 'A', '35', '63', 'TX-1', 'PS-2', '9 29', '27', 'TCV-3', 'F-11 25,']"
