PageNo,Text
1,"['(11) UTLÄGGNINGSSKRIFT', '7103974-7', '(51)', 'Internationell klass', 'F03c 1/02', '(44)', 'Ansökan utlagd och', '74-12-16 Publicerings- 372 312', 'utläggningsskriften', 'nummer', 'publicerad', '(41)', 'Ansökan', '71-09-28', 'allmänt tillgänglig', '(22)', 'Patentansökan inkom', '71-03-26', 'PATENT-OCH', 'REGISTRERINGSVERKET', '(30) Prioritetsuppgifter', '70-03-27 US 23 411', '(32) (33) (31)', 'Datum Land No', 'Siffrorna inom parentes anger internationell identifieringskod, INID-kod.', '(71) Sökande: R E ANCHORAGE, ALAS. US', '(72) Uppfinnare: Sök.', '(74) Ombud: S Penderud', '(54) Benämning: Utan förbränning av bränsle arbetande kolvmotor,', 'med tva olika arbetsmedier för drivning av kolvarna', 'Föreliggande uppfinning avser en utan förbränning av bränsle arbetande', 'kolvmotor, innefattande en vevaxel med en som kraftuttag tjänande för-', 'längning och ett flertal kolvar, som är drivbart förbundna med vev-', 'axeln och uppvisar första och andra arbetsytor samt ett mot kolvarnas', 'antal svarande antal cylindrar, i vilka kolvarna är anbragta.', 'Det föreligger ett stort behov av en motor, som kan användas för att', 'driva jälvgäende fordon och liknande vid önskad hastighet utan för-', 'bränning av bränsle och âtföljande nedsmutsning av atmosfüren. Manga', 'försök ha tidigare gjorts för att nã detta syfte, dock utan att ha', 'lett till önskad framgang. Ändamälet med föreliggande uppfinning är', 'att âstadkomma en praktisk, utan förbränning arbetande kraftanlägg-', 'ning eller motor, som har jämn gang, samt arbetar med ett drivmedium,', 'som är lätt att hâlla under tryck samt medför sãväl kylning som smörj-', 'ning av motorn.', 'Motorn enligt uppfinningen kännetecknas i huvudsak därav, att första', 'inloppsöppningar och utloppsöppningar är belägna i den övre delen av.', 'respektive cylinder, att en källa för ett första arbetsmedium i form', 'av en inert gas är anordnad att via första tillförselorgan mata det', 'första arbetsmediet under tryck och i bestämd tidsföljd till var och']"
2,"['2', 'en av de första inloppsöppningarna för att verka mot de första arbets-', ""y'corna, att varje cylinder vidare har andra inloppsöppningar och ut-"", 'loppsöppningar belägna i den undre delen av varje cylinder, att andra', 'tillförselorgan är anordnade att mata ett andra arbetsmedium i form', 'av. tryckolja till de andra inloppsöppningarna i följd efter varandra', 'för att verka pa de andra arbetsytorna, varvid motorn innefattar tryck-', 'alstringsorgan och cirkulationsorgan för det andra arbetsmediet, var-', 'jämte de första tillförselorganen bestär av en första anordning för', 'att mata det första, under tryck stâende arbetsmediet i tidsbestämd', 'följd och i bestämd mängd till varje första arbetsyta för att för-', 'skjuta tillhörande kolv nedât ett förutbestämt stycke och de andra', 'tillförselorganen bestär av en andra anordning för att kontinuerligt', 'mata bestämd mängd tryckolja till den undre delen av varje cylinder i', 'följd efter varandra och för att periodiskt öka flödet till respekti-', 've cylinders undre del.', 'Uppfinningen skall i det följande närmare beskrivas med hänvisning', 'till bifogade ritning, varvid ytterligare för uppfinningen känneteck-', 'nande drag och fördelar kommer att framga. Pã ritningen visas grund-', 'dragen hos en anordning enligt föreliggande uppfinning och mera spe-', 'ciellt en schematisk tvärsektion genom en motor enligt uppfinningen.', 'I cylinderblocket 10 förefinnes ett flertal cylinderkammare 11, 12,', '13', 'och 14, i vilka kolvar 15, 16, 17 resp. 18 är glidbart monterade.', 'Naturligtvis kan vilket erforderligt antal cylindrar som helst använ-', 'das. För tydlighetens skull har endast fyra visats pa ritningen. Kol-', 'varna är var och en medelst konventionella förbindningsstänger 19, 20,', '21 och 22 förbundna med en konventionell vevaxel 23 med en vevsläng', 'för varje kolv, sãsom visas pa ritningen. Förbindningsstängerna passe-', 'rar ocksã genom tätningsanordningar 24, 25, 26 och 27 vid den övre', 'änden av varje cylinderkammare. Vevaxeln 23 är pa lämpligt sätt roter-', 'bart lagrad i blocket och innefattar en utanför cylinderblocket 10 sig', 'sträckande förlängning 28, vilken bildar kraftuttagsdel och leder till', 'en transmission.', 'En första, under tryck stande arbetsfluid, företrädesvis kvävgas', 'under högt tryck, är inrymd i en avskild, päfyllningsbar trycktank 29', '3', '(exempelvis en cylinder, som har en volym av ca 6,2 m och kan tala', 'att tryck av ca 140 kp/cm 2) med en matarledning 30, vilken sträcker sig', 'till en roterande fördelningsanordning 31, som är försedd med utlopp,']"
3,"['3', 'vilka är anordnade att vid vissa tidpunkter förläggas mittför matar-', 'ledningar 32, 33, 34 och 35, som i sin tur är förbundna med motsvaran-', 'de inloppsportar 36 - 39 vid de övre ändarna av cylindrarna 11, 12,', '13 resp. 14. Ledningarna 32 - 35 är fästa vid blocket 10, och den', 'roterande fördelningsanordningen 31 reglerar utströmningen av kväve', 'med högt tryck till cylindrarna 11 - 14 i rätt ordning och vid rätt', 'tidpunkt.', 'Den roterande fördelningsanordningen 31 liknar strömfördelaren vid en', 'förbränningsmotor men matar en fluid i stället för elektricitet. För-', 'delningsanordningen drives frän vevaxeln medelst konventionella anord-', 'ningar, här antydda medelst en streckad linje.', 'Cylindrarna 11 - 14 har utloppsportar 40 - 43, som är belägna nära', 'cylindrarnas mitt men pã den sida om mitten, som har inloppsportarna', '36 - 39 och de därtill anslutna matarledningarna 32 - 35. Dessa ut-', 'loppsportar är förbundna med utloppsledningarna 44 - 48 och leder till', 'exempelvis det fria utanför blocket 10, sãsom visas vid 48. Dã kolvar-', 'na 15 - 18 befinner sig i sitt pã ritningen översta läge, stänges ut-', 'loppsportarna 40 - 43 av tillhörande kolvar, sã att den under tryck', 'stande gasen, som inkommer i den övre delen av cylinderkamrarna,', 'kommer att driva kolvarna nedät i rätt ordning för att âvägabringa', 'initiell rotation av vevaxeln och förskjutning av kolvarna. Alltefter-', 'som varje kolv flyttas, kommer utloppsportarna 40 - 43 att i följd', 'friläggas av kolvarna och kommer den under högt tryck stande arbets-', 'gasen ovanför kolvarna att ledas ut i det fria. Fördelningsanordningens', '31 rotation bestämmer tidpunkten för insläppning av kvävgas under högt', 'tryck till överdelen av närmast följande cylinder, tills alla kolvarna', 'i följd ha pressats nedât ett pa förhand bestämt stycke och i rätt', 'ordning medgivit fritt utlopp till atmosfären, sãsom beskrivits.', 'Denna första del av arbetscykeln, som genomföres med hjälp av den', 'första tryckfluiden frän tanken 29, medför att vevaxelns 23 rotation', 'driver fördelningsanordningen 31 med hjälp av konventionella anord-', 'ningar, sãsom nämnts ovan. Den medför även rotation hos en första rem-', 'skiva 49 för att driva en andra remskiva 50 hos en första, för alst-', 'ring av hydrostatiskt tryck avsedd pump 51 för en andra arbetsfluid,', 'exempelvis lätt olja (företrädesvis olja nr 5), som är inrymd i en', 'avskild, päfyllningsbar tryckbehallare 52 (exempelvis en cylinder om', '3', '2', 'ca 6, 2 m och med förmaga att tâla ett tryck av ca 140 . Lämp-', 'liga övertrycks- och backventiler 53 resp. 54 är anordnade mellan pum-']"
4,"['4', 'pen 51 och behällaren 52. Vevaxelns initiella rotation driver ocksà', 'en nära vevaxelns andra ände anordnad tredje remskiva 55, vilken', 'driver en fjärde remskiva 56, som är kopplad till och driver en andra', 'hydrostatisk pump 57, vilken matar en returledning 58, som leder till-', 'baka till behällaren 52. En backventil 59 är placerad mellan behâlla-', 'ren 52 och pumpen 57, och en övertrycksventil 60 är anordnad i retur-', 'ledningen 58.', 'Den första pumpen 51 är i stând att mata den andra arbetsfluiden under', 'det erforderliga trycket genom ledningen eller röret 61 till inlopps-', 'portar 62 - 65 vid de motsatta eller undre änddelarna av cylindrarna', '11 - 14 i serie pa det visade sättet. Backventiler 66 - 68 är an-', 'bragta efter utloppsportarna 69 - 71 hos närliggande cylindrar för', 'att förhindra utjämning av trycken, nâgot som skulle sätta systemet', 'ur drift, om det inträffade. Utloppsporten 72 kommer att diskuteras', 'senare. En lämplig tryckregulator 73 är anbragt i ledningen 61 före', 'cylindrarna, ävensom en snabböppnande ventil 74, vilken drives av en', 'pa vevaxeln anbragt anordning 75, som blir verksam vid fyra lägen', 'hos', 'kolvarna under vevaxelns rotation. Därigenom ledes den andra arbets-', 'fluiden i rätt tidsföljd till underdelen av varje cylinder 11 - 14.', 'När den första arbetsfluiden ovanför respektive kolvar avletts, driver', 'den andra arbetsfluiden, kolvarna uppät och bibringar vevaxeln 23', 'ytterligare rotation under den andra delen av arbetscykeln för varje', 'cylinder. Efter att ha lämnat utloppsporten 72 i den sista cylindern', '14, strömmar den andra arbetsfluiden genom en returledning 76 till', 'en kylradiator 77 och genom en ledning 78 till returpumpen 57.', 'En ytterligare remskiva 79 pa vevaxeln kan driva kylfläkten 80 och', 'andra tillbehör, sãsom en generator 81 för fordonets elektriska ut-', 'rustning. Pâ ovan beskrivet sätt genomföres upprepade gänger en kon-', 'tinuerlig och tidsföljdsbestämd arbetscykel genom inverkan av de tva', 'âtskilda, samordnade arbetsfluidsystemen.', 'De hydrostatiska pumparna 51 och 57 kan alstra ett tryck av exempel-', 'vis ca 105 kp/cm 2 per minut och kan vara anordnade att frânkopplas', '2', 'vid exempelvis ca 140 kp/cm och âterinkopplas vid exempelvis ca', '70 kp/cm . Tryckregulatorventilerna är av den typ, som stänger vid', '2', 'höga och lâga tryck, och användes för att bestämma tryckgränserna. I', 'händelse av fel i funktionen kommer övertrycksventilerna, som är', 'in-', 'ställda pa exempelvis ca 175 kp/cm², att skydda systemet. Tryckregula-']"
5,"['5', 'torventilen 73 i den inkommande hydrostatiska ledningen (kalibrerad', 'till exempelvis ca 60 kp/cm ) kommer att sörja för att tillräcklig', '2', 'kraft finnes för att driva kolvarna uppät frân bottnen av cylindrar-', 'na. Kvävgastrycket fränkopplas, da det hydrostatiska trycket ger den', 'energi, som är nödvändig för att driva kolvarna, och inkopplas, da', 'ytterligare energi behövs. Detta astadkommes med hjälp av ett i röret', '61 anordnat tryckavkänningsorgan 82 och en med tryckavkänningsorganet', 'operativt förbunden och av detta paverkad ventil 83.', 'Sãsom framgär av det ovanstäende, passerar de tvà fluiderna pa föl-', 'jande sätt genom motorn. Den första arbetsfluiden passerar frän tan-', 'ken 29 och ventilen 83 via röret 30 till fördelningsanordningen 31,', 'där den i följd ledes till matarledningarna 32 - 35. Enär strömningen', 'av den första fluiden är densamma för varje cylinder, kommer endast', 'cylindern 11 att beskrivas. Tryckfluiden inkommer genom porten 36', 'och verkar pa den övre ytan av kolven 15 och driver kolven nedãt,', 'tills utloppsporten 40 blir frilagd. Vid denna tidpunkt kommer den', 'första tryckfluiden att avledas till det fria genom utloppsledningen', '44 och utloppet 48. Fördelningsanordningen 31 har avskurit flödet', 'av den första fluiden till cylindern 11 vid den tidpunkt, da utlopps-', 'porten 40 öppnas.', 'Den andra fluiden strömmar frän behâllaren 52 genom ventilerna 53 och', '54 till pump 51. Därifrän passerar den genom röret 61, tryckavkännings-', 'organet 82 och ventilerna 73 och 74 till cylindrarna. Den andra flui-', 'den passerar genom inloppet 62, utloppsporten 69, backventilen 66,', 'inloppet 63, utloppsporten 70, backventilen 67, inloppet 64, utlopps-', 'porten 71, backventilen 68, inloppet 65, och utloppsporten 72, innan', 'den begynner sin äterväg genom returledningen 76, kylaren 77, led-', 'ningen 78, pumpen 57, returledningen 58 och ventilerna 60 och 59 till', 'reservoaren 52.', 'Den roterande fördelningsanordningen 31 är i själva verket en tidregu-', 'lator för det första fluid- eller kvävgassystemet, som verkar pa ena', 'sidan av kolvarna, medan ventilanordningen 74 tjänar som tidregulator', 'för den andra arbetsfluiden och reglerar tillförseln av denna till', 'cylindrarna vid den motsatta sidan av varje kolv.', 'Genom beskrivningen ovan torde den uppfunna motorns funktion vara klar-', 'lagd. Uppfinningen kan emellertid i praktiken utformas pa andra än det', 'visade sättet utan frängäende av grundtanken eller densammas huvudsak-']"
6,"['6', 'liga kännetecken. Uppfinningen är sãlunda icke begränsad till det', 'ovan beskrivna och pa ritningen visade utföringsexemplet, utan ut-', 'förandet av densamma kan modifieras pa mangahanda sätt inom ramen', 'för efterföljande patentkrav.', 'PATENTKRAV', '1. Utan förbränning av bränsle arbetande kolvmotor, innefattande en', 'vevaxeln (23) med en som kraftuttag tjänande förlängning (28) och', 'ett flertal kolvar (15-18), som är drivbart förbundna med vevaxeln', 'och uppvisar första och andra arbetsytor samt ett mot kolvarnas antal', 'svarande antal cylindrar (11-14), i vilka kolvarna är anbragta,', 'k ä n n e t e C k n a d därav, att första inloppsöppningar (36-39)', 'och utloppsöppningar (40-43) är belägna i den övre delen av respek-', 'tive cylinder, att en källa (29) för ett första arbetsmedium i form', 'av en inert gas är anordnad att via första tillförselorgan (30-35)', 'mata det första arbetsmediet under tryck och i bestämd tidsföljd till', 'var och en av de första inloppsöppningarna (36-39) för att verka mot', 'de första arbetsytorna, att varje cylinder vidare har andra inlopps-', 'öppningar (62-65) och utloppsöppningar (69-72) belägna i den undre', 'delen av varje cylinder, att andra tillförselorgan (51,61) är anord-', 'nade att mata ett andra arbetsmedium i form av tryckolja till de and-', 'ra inloppsöppningarna i följd efter varandra för att verka pã de and-', 'ra arbetsytorna, varvid motorn innefattar tryckalstringsorgan 51,57)', 'och cirkulationsorgan (76) för det andra arbetsmediet, varjämte de', 'första tillförselorganen (30-35) bestär av en första anordning för', 'att mata det första, under tyyck stande arbetsmediet i tidsbestämd', 'följd och i bestämd mängd till varje första arbetsyta för att för-', 'skjuta tillhörande kolv nedät ett förutbestämt stycke och de andra', 'tillförselorganen bestär av en andra anordning för att kontinuerligt', 'mata bestämd mängd tryckolja till den undre delen av varje cylinder', 'i följd efter varandra och för att periodiskt öka flödet till respek-', 'tive cylinders undre del.', '2. Motor enligt krav 1, k ä n n e t e C k n a d därav, att den', 'första anordningen innefattar en högtrycksgaskälla (29) pa avständ', 'frän cylindrarna, en roterbar fördelare (31) för reglering av mat-', 'ningen av tryckgas i tur och ordning till cylindrarna och i bestämd', 'mängd, transmissionsorgan, som drivbart förbinder vevaxeln (23) och', 'fördelaren med varandra, en huvudmatarledning (30) som förbinder hög-', 'trycksgaskällan med fördelaren, matargrenledningar (32-35), som för-']"
7,"['7', 'binder fördelaren med var och en av cylindrarna samt utloppsledningar', '(44-48), som förbinder den första utloppsöppningen hos respektive', 'cylinder med det fria.', '3.', 'Motor enligt krav 1 eller 2, k ä n n e t e C k n a d därav,', 'att den andra anordningen innefattar en primär matarledning (61), vil-', 'ken förbinder en tryckoljekälla (52) med den andra inloppsöppningen', 'hos den första cylindern, i denna matarledning anordnade reglerings-', 'organ (74) för reglering av oljeflödet, att avgivningsorgan förbinder', 'den andra utloppsöppningen i varje cylinder med den andra inloppsöpp-', 'ningen hos varje efterföljande cylinder för att leda tryckolja i se-', 'rie genom de efter varandra följande cylindrarna, att styrventilorgan', '(66-68) är anordnade i avgivningsorganen mellan utloppsöppningarna och', 'inloppsöppningarna för att förhindra utjämning av trycket i oljan mel-', 'lan närbelägna cylindrar samt att en anordning finnes för att driv-', 'bart förbinda vevaxeln med tryckalstrings- och cirkulationsorganen.', '4.', 'Motor enligt krav 3, k ä n n e t e C k n a d därav, att tryck-', 'alstrings- och cirkulationsorganen innefattar en första pump (51),', 'som är anordnad i matarledningen mellan källan för tryckoljan och den', 'nämnda första cylindern, en returledning (58), som förbinder den', 'sista av cylindrarna med källan för tryckoljan, en i returledningen', 'anordnad andra pump (57), en anordning för att drivbart förbinda pum-', 'parna med vevaxeln, en i returledningen mellan cylindrarna och den', 'andra pumpen inkopplad kylanordning (77) för tryckoljan, en anordning', '(73-75) för reglering av strömningen av tryckolja frän källan för den-', 'samma samt en i returledningen mellan den andra pumpen och källan för', 'tryckolja belägen reservoar (52) för den andra arbetsfluiden.', '5.', 'Motor enligt krav 4, k ä n n e t e C k n a d därav, att anord-', 'ningen för att förbinda vevaxeln med den första och andra pumpen (51,', '57) innefattar ett par transmissionsanordningar (49, 50; 55, 56), vil-', 'ka drivbart förbinder vevaxeln (23) med pumparna, varigenom de senare', 'drives gemensamt.', '6. Motor enligt krav 3, k ä n n e t e C k n a d därav, att i', 'matarledningen (61) för matning av tryckolja till den nämnda första', 'cylindern är anordnad en tryckavkännare (82), vilken är operativt an-', 'sluten till en i luvudmatarledningen för den första arbetsfluiden mel-', 'lan källan för tryckgasen och fördelningsanordningen belägen ventil-', 'anordning (83).']"
8,"['8', '7.', 'Motor enligt krav 3, , k ä n n e t e C k n a d av en i den', 'primära matarledningen (61) för tryckolja invid den första cylinderns', 'nämnda andra inloppsöppning anordnad snabbt öppnande ventil (74), som', 'styres av ett pa vevaxeln (23) anbragt organ (75), angivande kolvarnas', 'respektive lägen under varje arbetscykel.', 'ANFORDA PUBLIKATIONER:']"
9,"['54', '83', 'UTLOPPS. -', 'RESERVOAR FOR', '30', 'V', '""', 'VICK', 'TRYCKGAS', 'LEDNING', 'TRYCKOLJA', 'REL', 'V', '31', '76', '81', '51', '50', '29', '32', 'FORDELARE', '52', '35', '48', '77.', 'GENE-', '59', 'PUMP', '33', '34', 'RATOR', 'MELLANRESERVOAR', '49', 'Em', '55', '23', 'FOR RETURTRYCK-', '28', 'OLJA', 'Em', 'Em', '75', 'V', '44', '46', '21', '79', '60', 'REL', '47', '0', '22', '80', '58', '19', '78', '61-', '45', '0', '24', '20', '25', 't', '26', 'Y', '0', '27', '82', 'Fe', '37', '38', '395', 'PUMP', '56', '36', '57', '41', 'TRYCKAV-', '42', '43', 'KÄNNINGS-', '15', '10', '58', 'ORGAN', '16', '17', 'II', '73-', '40', '71', '14', '76', 'REG,', 'II', '69', '70', 'C.P.', '1', '18', 'V', 'RIN', '74', '62', '66', '63', '12 67', '64 13', '68', '65', '72']"
