PageNo,Text
9,"['9', 'gruppen av parallella sparpartier 312a. Lod drages även medelst kapillärverkan', 'ut ur sparpartierna till mellanrummen mellan det dielektriska substratet och ky-', 'laren. Indikatorspärpartierna 310d och 312b visa lätt huruvida lodet har blivit', 'rätt fördelat. Om ett av sparen av nágot skäl skulle bli tilltäppt, medgiva dess-', 'utom sparpartierna 310d och 312b flytande lod att dragas tillbaka under det di-', 'elektriska substratet, varvid det flyter fran ospärrade sparpartier till eventuellt', 'tilltäppta eller förträngda sparpartier, vilka icke mata till avlastningsspärpartiet.', 'Avlastningssparpartierna förbättra sãlunda starkt den tillförlitlighet med vilken', 'likformig fördelning av lod uppnas. Sasom fullständigt beskrivits ovan i anslut-', 'ning till de utföringsformerna av uppfinningen förblir det lod som är', 'beläget under det dielektriska substratet relativt fritt fran oxygen. I fig. 6 vi-', 'sas det aterstäende, oxygenrika partiet av lodet, som användes för att foga det', 'dielektriska substratet vid 314 invid konvergenspunkten.', 'Sasom bäst visas i fig. 6, är vid en huvudyta 316 längst frân kylaren det', 'dielektriska substratet försett med i sidled âtskilda, ledande dynor eller kontak-', 'ter. Kontakten 318 har större ytutsträckning och tjänar sãsom en huvudströmförande', 'kontakt, medan kontakten 320 har mindre ytutsträckning och tjänar sãsom en trigger-', 'signal- eller styrkontakt. Ett sidoavstand 322 finnes mellan kontakterna.', 'Sãsom visas med streckad kontur i fig. 6, är ett halvledande element 324 be-', 'läget över kontakterna 318 och 320. Det halvledande elementet kan vara identiskt', 'lika med det halvledande elementet 102, som beskrivits i anslutning till den halv-', 'ledande anordningen 100. I detta avseende är det halvledande elementet anbragt sã', 'att fogningsskiktet 132 samverkar med kontakten 320, medan fogningsskiktet 128', 'samverkar mod kontakten 318, med övergangen 122 mötande den andra huvudytan 106', 'inuti sidoutrymmet 322 mellan kontakterna. Vid fabrikation av halvledaranordningen', '300 innefattar emellertid fogningsskikten endast de kontakter som äro vidfästa', 'det halvledande elementet och innefattar icke lodet för fogning.', 'För att underlätta lödning enligt uppfinningen, är ett flertal parallella', 'sparpartier 326 förbundna med huvudkontakten, vilka möta konvergerande spârpartier', '328, som ha en konvergenspunkt 330. Pa likartat sätt är styrkontakten försedd med', 'ett flertal parallella sparpartier 332, vilka möta konvergerande sparpartier 334,', 'som ha en konvergenspunkt 336. Det bör även observeras att konvergenspunkterna, de', 'konvergerande sparpartierna och ett parti av de parallella sparpartierna i förbin-', 'delse med varje kontakt ligga utanför den area, som är motställd mot det halvledande', 'elementot.', 'Före fogningen vid det dielektriska substratet kan det halvledande elementet', 'förses med en strömsamlare och ledare 338, som visas i fig. 7. När det halvledande', 'elementet 324 är identiskt lika med det halvledande elementet 102, tjänar ledaren', '338 sãsom anodledaren och är fogad vid det halvledande elementets anodemitterskikt.']"
10,"['10', 'För att foga det halvledande elementet vid det dielektriska substratet för värme-', 'avstötning till detta samt medgiva fürbindelser av yttre ledare, anbringas det', 'halvledande elementet tillsammans med en styrledare 340 och en katodledare 342,', 'sãsom visas i fig. 7. En lodpärla, som är anbragt vid konvergenspunkten 330, kom-', 'mer, när den smältes, att sprida lod genom de konvergerande sparpartierna 328', 'till de parallella sparpartierna 326. Det bör observeras att en enda lodpärla sã-', 'lunda icke endast fogar det halvledande elementet vid det dielektriska substratets', 'huvudströmförande kontakt utan även samtidigt fogar katodledaren 342 vid denna', 'samma kontakt. En andra lodpärla, som är anbragt vid konvergenspunkten 336, sprider', 'pa likartat sätt lod genom de parallella sparpartierna 332 under styrledaren 340', 'och det parti av det halvledande elementets yta som bildas av katodbasskiktet. I', 'bâda fallen bildas en seg lödförbindelse med lâg impedans, vilken har de fördelar', 'som angivits med hänvisning till de föregaende utföringsformerna av uppfinningen.', 'Efter det att lödningen fullbordats, kan en plastkapa 344 formas för att samverka', 'med kylaren och inkapsla det halvledande elementet och det dielektriska substratet.', 'Betydelsen av den förbättrade tillverkningsprocessen enligt uppfinningen för', 'halvledaranordningen 300 inses lätt genom att värme vid passage frân det halvle-', 'dande elementet 324 till kylaren 302 máste passera genom lödförbindelserna till kon-', 'takterna 318 och 320 för att nã det dielektriska substratet 316, genom det dielekt-', 'riska substratet samt genom lödförbindelsen mellan kylaren och substratet. Aven med', 'det bästa, praktiska val av dielektriskt substrat, kommer detta element att uppvisa', 'en väsentlig impedans mot värmeflöde. Dessutom maste värme ledas genom tvâ serie-', 'kopplade lödfogar. För att undvika drastisk nedmarkering av anordningen är det följ-', 'aktligen väsentligt att bada lödfogarna uppvisa en läg impedans för värmeflöde. En-', 'ligt uppfinningen uppnas detta ändamäl. Samtidigt hörl det observeras att, vid led-', 'ning av elektricitet fran katodemitterskiktet i det halvledande elementet till ka-', 'todledaren 342, ström maste flyta genom en lödförbindelse mellan det halvledande', 'elementet och kontakten 318, i sidled genom kontakten 318 och genom lödförbindelsen', 'mellan kontakten och katodledaren. Aven här maste sãlunda tvá lödförbindelser passe-', 'ras i serie. En fördel vid. fabrikationen av halvledaranordningen 300 är att alla', 'elementen kunna hopsättas i det i fig. 7 visade förhallandet, och lödning fullbor-', 'das i en enda operation helt enkelt genom tillförsel av lod till sparens tre kon-', 'vergenspunkter. Uppfinningen förbättrar sãlunda icke endast den termiska och elekt-', 'riska tillförlitligheten utan möjliggör även enklare fabrikation av anordningen.', 'För att ytterligare illustrera mängsidigheten hos uppfinningen, visas i fig.', '8 en halvledaranordning 400, som innefattar ett halvledande element 402, utformat', 'med en första huvudyta 404 och en andra, motställd huvudyta 406. Sisom visas, är', 'det halvledande elementet utformat av en kollektorzon 408, invid den första huvud-', 'POOR QUALLTY']"
11,"['11', 'ytan, och en baszon 410 samt en emitterzon 412 invid den andra huvudytan. En emit-', 'terövergang 414 är anbragt mellan emitter- och baszonerna, medan en kollektoröver-', 'gang 416 är belägen mellan bas- och kollektorzonerna. Ett emitteranslutningsdon', '418, som kan vara utfört i ett stycko med eller ledande förbundet med en emitter-', 'ledare är ohmskt ledande förbundet med emitterzonen medelst fogningsskiktet 420. Ett', 'likartat basanslutningsdon 422 är ohmskt ledande anslutet till baszonen medelst ett', 'fogningsskikt 424. Fogningsskikten 420 och 422 kunna vara identiskt lika med fog-', 'ningsskikten 128 och 132. Emitter- och baszonernas anslutningsdon visas interfolie-', 'rade, sãsom är vanligt vid effekttransistorer.', 'En kylare 426 finnes för att fästa det halvledande transistorelementet, bilda', 'en ohmskt ledande förbindelse till kollektorzonen samt avleda värme fran det halv-', 'ledande elementet. En planvy av kylaren, sãsom den finnes före montage av det halv-', 'ledande elementet vid denna, visas i fig. 9. Det halvledande elementets 402 kon-', 'tur visas sãsom en streckad linje i fig. 9. Kylaren är försedd med en central öpp-', 'ning 428, som sträcker sig mellan den första huvudytan 430, vilken är avsedd att', 'samverka med en värmemottagande kropp, och en andra huvudyta 432, som mottager värme', 'fran det halvledande elementet. Ett flertal radiella, primära spar 434 skära öpp-', 'ningen invid den andra huvudytan. Ett flertal utmed omkretsen anbragta spar 436 äro', 'belägna koncentriskt med öppningen och skära de primära sparen. De utmed omkretsen', 'anbragta sparen ha mindre tvärsektion än de primära sparen sã att de erbjuda större', 'kapillärattraktion för lod. Radiella, sekundära spar 438 skära de utmed omkretsen', 'anbragta sparen mellan de primära sparen. De radiella, sekundära sparen äro försed-', 'da med yttre indikatorpartier 441, vilka sträcka sig i sidled utöver den area som', 'är moställd mot det halvledande elementet.', 'Det halvledande elementets första huvudyta är försedd med en kontakt 440.', 'Lod 442 fogar kontakten 440 och den första huvudytan vid kylaren. Lodet sträcker', 'sig in i sparen och öppningen. Ett parti av lodet bildar en knapp 444 invid kyla-', 'rens andra huvudyta. Knappen innehäller en oxidbeläggning 446, medan &terstoden av', 'lodet är relativt oxidfri. En formad kapa 448 omgiver det halvledande elementet', 'och samverkar med kylaren.', 'För att fästa det halvledande elementet 402 vid kylaren 426 förbindas dessa', 'element, sãsom visas 1 fig. 8, med undantag av att den första huvudytan 430 pá ky-', 'laren med fördel är orienterad sã att den är överst, d.v.s. att elementen omvändas', 'fran det visade läget. Lod 442, som förbindes med kylaren vid smältning, införes', 'genom öppningen 428. Lodet sprider sig först genom de primära, radiella sparen 434', 'för att intränga i de utmed omkretsen riktade, sekundära sparen 436, vilka erbjuda', 'en större kapillärattraktion för lodet. Lod sprides även medelst kapillärverkan', 'till mellanrummen mellan kylaren och det halvledande elementet sã att lod blir för-', 'bundet med kontaktens 440 hela yta. Lod intränger i de radiella kapillärerna 438 och']"
12,"['12', 'sprides utât till indikatorpartierma 441. Emedan indikatorpartierna skära och', 'matas av de sekundära sparen vid deras punkt längst fran de primära sparen, är', 'utträngning av lod frân de radiella, sekundära spáren vid indikatorpartierna en', 'tillförlitlig indikering av att de sekundära sparen fyllts med lod. När lodet', 'sprides genom öppningen och kapillärerna, fördelas endast det relativt oxidfria', 'partiet av lodet. Oxidbeläggningen 446, som bildas pa lodet av luftkontakt, för-', 'blir pa knappen 444. Efter det att lodet har hárdnat, kan knappen tillsammans', 'med oxidbeläggningen mekaniskt avkapas fran kylaren. Detta möjliggör även att', 'kylarens första huvudyta 430 kan monteras plant med en plan, värmemottagande yta.', 'Fig. 10 och 11 visa en alternativ kapillärkonstruktion. Kylaren 500 är för-', 'sedd med en första huvudyta 502 och en motställd, parallell huvudyta 504. Kylaren', 'är försedd med ott i samma stycke utfört flikparti 506, som innehäller en öppning', '508. Kylaren visas utformad med ett flertal i sidled förlöpande öppningar 510,', '512 och 514. Dessa öppningar sträcka sig till en kant av kylaren, som är längst', 'fran flikpartiet. Sidoöppningarna skäras vid ett ställe pá avstánd fran ett area-', 'parti av kylaren som skall motställas ett halvledande element, visat medelst', 'streckade linjer 516. En lodmatningsöppning 518 är utformad sá att den sträcker', 'sig frän den första huvudytan för att skära sidoöppningarna, Lodmatningsöppningen', 'har nágot större diameter än sidoöppningarna. Ett flertal lodutsöndringsöppningar', '520, med nágot mindre diameter än sidoöppningarna, äro utformade i kylaren och', 'sträcka sig frán den första huvudytan till en skärningspunkt med sidoöppningarna', 'samt belägna i en area, vilken skall motställas det halvledande element som skall', 'vidfästas.', 'För att fästa ett halvledande element, sãsom visas vid 516, kan en lodpärla', 'införas i lodmatningsöppningen 518. Lodet kommer att vid smältning dragas i sid-', 'led genom sidoöppningarna och därifrän dragas in i lodutsöndringsöppningarna 520', 'under det halvledande elementet. Mellanrummet mellan kylaren och det halvledande', 'elementet kommer att draga lod medelst kapillärverkan ut ur öppningarna 520 sã att', 'slutligen lodet kommer att fogas mellan den första huvudytan pá kylaren och den', 'sammanpassade huvudytan pá det halvledande elementet. Liksom i fallet med spár-', 'capillärer lämnas de oxidhaltiga partierna av lodet vid eller nära punkten för', 'lodets applicering och bringas icke i kontakt med det halvledande elementet eller', 'sammanpassade partier av kylaren.', 'Vid lödning medelst kapillärtransportprocessen enligt uppfinningen förutses', 'att gravitationen kan utnyttjas för att medverka vid lodets spridning. När rela-', 'tivt stora spar användas, kan exempelvis gravitationen vara den primära spridnings-', 'kraften. För de flesta tillämpningar förutses emellertid användning av spar med', 'relativt liten diameter sã att gravitationen i bästa fall är en sekundär kraft.']"
13,"['13', '1 själva verket har det iakttagits att lod kan spridas enligt uppfinningen i', 'sma kapillärer mot gravitationen utan ogynnsam effekt.', 'Det förutses även att värme kan utnyttjas för att medverka vid spridningen', 'av lod. Det har observerats att kapillärspridning kan understödjas och styras me-', 'delst differentialuppvärmning. Genom att hâlla partier av kapillärerna pa avstand', 'frän punkten för lodapplikation vid en nágot förhöjd temperatur, kan eventuell', 'tendens hos lodet att förlora flytförmaga och därigenom rörlighet, innan det an-', 'kommer vid den önskade destinationen, motverkas. Anordningar med metallkylare', 'kunna i de flesta fall uppvärmas för lödning invid den plats, fran vilken värmet', 'skall avledas. Kylare med flikpartier kunna exempelvis lättast uppvärmas för löd-', 'ning och kapillärdistribution av lod genom flikpartierna.', 'Aven om uppfinningen har beskrivits under hänvisning till vissa fördelakti-', 'ga utföringsformer, bör det framhâllas att talrika variationer kunna utföras av', 'en', 'fackman pa omradet. Även om anordningarna 100 och 300 ha beskrivits med hänvis-', 'ning till halvledande tyristorelement, inses att dessa anordningskonstruktioner', 'äro tillämpliga vid halvledande likriktarelement i allmänhet, ävensom halvledande', 'element av effekttransistortyp. Medan anordningarna ha beskrivits sãsom innefat-', 'tande formade kapor, inses att uppfinningen kan tillämpas vid anordningskonstruk-', 'tioner, vid vilka hermetiskt tätade metallkapor användas.']"
14,"['14', 'Patentkrav.', '1. Halvledaranordning, innefattande ett substrat, med en första plan huvud-', 'yta, ett halvledande element (102), med en andra plan huvudyta, samt en kontakt', '(144), som är fästad vid den andra huvudytan, k à n n e t e c k n a d av att kapil-', 'lärorgan (142) sträcker sig frân en punkt (142c) pã avstand frán det halvledande', 'elementet (102), till ett ställe mellan substratet och det halvledande elementet', '(102), och innehäller lodmedel (146), som förbinder kontakten med substratet, vilket', 'lödmedel är relativt oxidfritt  mellan kontakten och substratet jämfört med det i', 'kapillärorganen pa avständ frán det halvledande elementet.', '2. Halvledaranordning enligt krav 1, k ë n n e t e c k n a d av att den', 'första huvudytan pa substratet (134) är ledande.', '3. Halvledaranordning enligt krav 2, k. à n n e t e c k n a d av att substra-', 'tet är en kylare (134) för att avlägsna värme frân det halvledande elementet (102).', '4. Halvledaranordning enligt krav 3, k ä n n e t e c k n a d av att nämnda', 'kapillärorgan definierar ett flertal spár (142), i kylaren (134).', '5. Halvledaranordning enligt nágot av föregaede krav, k à n n e t e c k -', 'n', 'a d av att nämnda kapillärorgan (142) konvergerar vid en punkt (142c), pã avstánd', 'frán det halvledande elementet (102).', '6. Halvledaranordning enligt krav 5, k à n n e t e c k n a d av att ett', 'restparti av lödmedlet (146) är anbragt vid konvergenspunkten (142c), varjämte en', 'oxidfilm är förbunden med nämnda restparti av lödmedlet vid konvergensstället, samt', 'det lödmedel, som är beläget under det halvledande elementet, är relativt fritt', 'frân oxid.', '7. Halvledaranordning enligt nágot av föregaende krav, k ä n n e t e c k -', 'n', 'a d av att nämnda kapillärorgan (142) bildar atminstone en öppning i kylaren (134).', '8. Halvledaranordning enligt krav 1, k ä n n e t e c k n a d av att nämnda', 'kapillärorgan innefattar primära kapillärorgan (211) och mindre, sekundära kapillär-', 'anordningar (215), vilka skär nämnda primära kapillärorgan.', '9. Halvledaranordning enligt krav 1, k ä n n e t e c k n a d av att nämnda', 'kapillärorgan (211, 215) bildar ett gallerverk invid nämnda parti av kylaren.', '10. Halvledaranordning enligt krav 1, k ä n n e t e c k n a d av att nämnda', 'kapillärorgan innefattar ett flertal, koncentriskt anbragta, sekundära kapillär-', 'organ (436) och att ett primärt kapillärorgan (434) skär de skundära kapillärorga-', 'nen för att mata lödmedlet till dessa.', '11. Halvledaranordning enligt krav 1, k ä n n e t e c k n a d av att nämnda', 'kapillärorgan sträcker sig frän det halvledande elementet till en indikatorpunkt', '(310d), som är âtskild frân den avlägsna punkten av det halvledande elementet, var-']"
15,"['7103002-7', 'vid ett restparti av lodmedel hör till nämnda kapillärorgan invid den avlägsna', 'punkten samt ett främre parti av lödmedlet hör till nämnda kapillärorgan invid', 'indikatorpunkten.', '12. Halvledaranordning enligt krav 1, k ä n n e t e c k n a d av att', 'nämnda kapillärorgan definierar alternativa flödesbanor för lod fran den avlägsna', 'punkten under det halvledande elementet till en punkt (518), som är i sidled för-', 'skjuten frân det halvledande elementet, där nämnda alternativa flödesbanor för lod', 'äro förbundna med varandra.', '13. Halvledaranordning enligt krav 1, k à n n e t e c k n a d av att', 'sub-', 'stratet bestar av ett dielektriskt material, vilket innehäller en kontakt (136,', '138), som bildar den första huvudytan.', '14. Halvledaranordning enligt krav 1, k ä n n e t e c k n a d av att', 'kapillärorganen bildar en gemensam reservoar för lödmedlet och fördelningsorganen', 'för att leda lödmedlet till vart och ett av de halvledande elementen i följd.', '15. Sätt vid framställning av en halvledaranordning enligt nágot av förega-', 'ende patentkrav, innefattande ett substrat, med en första plan huvudyta, ett halv-', 'ledande element (102), med en andra plan huvudyta, samt en kontakt (144), som är', 'fästad vid den andra huvudytan, k à n n e t e c k n a d av att minst en kapillär', 'anbringas i ett substrat avsett för stöd av ett halvledande element, vid vilket är', 'fäst en kontakt, att det halvledande elementet inställes sã att kontakten anbringas', 'över ett parti av kapillären och ett parti a.v. kapillären sträcker sig i sidled', 'utanför det halvledande elementet, att lödmedel i smält form anbringas i det sidle-', 'des förlöpande partiet av kapillären pa avstand fran det halvledande elementet, att', 'ett relativt oxidfritt parti av lödmedlet avskiljes och att detta parti av lödmed-', 'let avskiljes och att detta parti av lödmedlet bringas att fórdelas sidledes under', 'det halvledande elementet genom kapillärverkan samt att ett parti av lödmedlet brin-', 'gas att överföras fran det parti av kapillären över vilket det halvledande elementet', 'är beläget till ett ställe mellan det halvledande elementet och substratet till bil-', 'dande av en seg lagimpedansfog däremellan.', '16. Sätt enligt krav 15, k à n n e t e e k n a t av att ett flertal kapil-', 'lärer bildas, vilka skär varandra sidledes pa avstand frân det halvledande elementet', 'samt att lod införes i kapillärerna vid ett enda ställe, pa avstand frân det halv-', 'ledande elementet.', '17. Sätt enligt krav 15, k à n n e t e c k n a t av att substratet bringas', 'till en högre temperatur under det halvledande elementets kontakt än invid det lo-', 'det mottagande partiet av kapillären pa avstand fran det halvledande elementet.', '18. Sätt enligt krav 15, k à n n e t e c k n a t av att det halvledande', 'elementet placeras sã att kapillären är synlig vid motställda sidor av kontakten']"
16,"['16', 'samt lod införes i kapillären tills det blir synligt i det parti av kapillären som', 'är beläget vid den motställda sidan mot tillförselsidan.', '19. Sätt enligt krav 15, k ä n n e t e c k n a t av att första och andra', 'kapillärer bildas i substratet med skärningspunkter vid motsatta sidor av det halv-', 'ledande elementets kontakt, att lod införes invid en skärningspunkt, samt att lod', 'bringas att flyta fran en kapillär till en annan vid den aterstäende skärningspunk-', 'ten för aterflöde under kontakten, om en kapillär skulle bli tilltäppt för flöde av', 'lod.', '20. Sätt enligt krav 15, k ä n n e t e c k n a t av att ett flertal, halv-', 'ledande element placeras sidledes pa avstand frân varandra över kapillären samt att', 'lod införes i ett parti av kapillären âtskilt frân ett halvledande element av ett', 'aterstäende, halvledande element.', '21. Sätt enligt krav 15, k à n n e t e c k n a t av att ett flertal, halv-', 'ledande element anbringas sidledes pá avstànd frân varandra över kapillären samt', 'lod tillföres till ett parti av kapillären mellan tvã av de halvledande elementen.', '22. Sätt enligt krav 15, k ä n n e t e c k n a t av att substratet utfor-', 'mas av dielektriskt substrat, som är försett med en elektrisk ledande kontakt, att', 'ett flertal ledande element anbringas sidledes pa avstánd frân varandra över kapil-', 'lären, att lod överföres genom kapillären frän ett första ställe till vart och ett', 'av de halvledande elementen samt att de halvledande elementen isoleras elektriskt', 'genom delning av den elektriskt ledande kontakten mellan elementen.', 'ANFORDA PUBLIKATIONER:', 'USA 3 062 981 (313-289), . 3 291 578 (29-195)']"
17,"['FIG.I.', '-2', '152', '132', '126 128', '116', '106', '100', '130', '114', '124', '118', '120', '122', '108', '102', '112', 'IIO', '104', '142', '144', '146', '134', '+2', 'FIG.2.', '100', '152', '126', 'I50', '124', '140', '102', '137', '136', '148', '146', '138', '142', '144', '134', 'FIG.3.', '134a', '142b', '137a', '142c', '136a', '102a', '142a', '102b', 'FIG.4.', '203 205', '217-', '217', '211', '201', '209', '213', '217', '217', '215', '207', '215']"
18,"['FIG.5.', '312a', '312b', '308', '302', '306', '310c', '310d', '-', '310b', '304', '3/Oa.', '3/20', 'FIG.6.', '316', '318', '326', '328', '302', '306', '330', '324', '336', '322', '304', '3/4', '320', 'a', '334', '332', 'FIG.7.', '300', '300', '342', 'I', '302-', '306', '338', '330', '336', '3/4', '340', '304', '344']"
19,"['FIG.8.', '400', '420', '406', '424', '422', '418', '448', '412', '408', '4/4', '414', '410', '416', '414', '402', '440', '1', '430', '442', '432', '404', '428', '446', '426', '444', 'FIG.9.', '432', '426', '402', '434', '428', '438', '441', '441', '438', '436', '434', 'FIG.IO.', '500', '510', '-516', '1', '520', 'il', '//', '512', '508', '518', '506', '5/4', 'FIG.II.', '516', '508', '518', '502', '520', '1', '506', '512', '504']"
